Command: /home/mariem/.espressif/python_env/idf5.5_py3.12_env/bin/python /home/mariem/esp-idf/tools/idf_monitor.py -p /dev/ttyUSB0 -b 115200 --toolchain-prefix riscv32-esp-elf- --target esp32c3 --revision 3 --decode-panic backtrace /home/mariem/AP_displayer/build/AP_displayer.elf /home/mariem/AP_displayer/build/bootloader/bootloader.elf -m '/home/mariem/.espressif/python_env/idf5.5_py3.12_env/bin/python' '/home/mariem/esp-idf/tools/idf.py'
ESP-ROM:esp32c3-api1-20210207
Build:Feb  7 2021
rst:0x1 (POWERON),boot:0xc (SPI_FAST_FLASH_BOOT)
SPIWP:0xee
mode:DIO, clock div:1
load:0x3fcd5820,len:0x15b8
load:0x403cc710,len:0xc30
load:0x403ce710,len:0x2fe8
entry 0x403cc71a
[0;32mI (30) boot: ESP-IDF v5.5-dev-1655-gc5865270b5 2nd stage bootloader[0m
[0;32mI (30) boot: compile time Feb 28 2025 16:15:17[0m
[0;32mI (30) boot: chip revision: v0.3[0m
[0;32mI (32) boot: efuse block revision: v1.2[0m
[0;32mI (36) boot.esp32c3: SPI Speed      : 80MHz[0m
[0;32mI (39) boot.esp32c3: SPI Mode       : DIO[0m
[0;32mI (43) boot.esp32c3: SPI Flash Size : 2MB[0m
[0;32mI (47) boot: Enabling RNG early entropy source...[0m
[0;32mI (51) boot: Partition Table:[0m
[0;32mI (54) boot: ## Label            Usage          Type ST Offset   Length[0m
[0;32mI (60) boot:  0 nvs              WiFi data        01 02 00009000 00006000[0m
[0;32mI (67) boot:  1 phy_init         RF data          01 01 0000f000 00001000[0m
[0;32mI (73) boot:  2 factory          factory app      00 00 00010000 00177000[0m
[0;32mI (80) boot: End of partition table[0m
[0;32mI (83) esp_image: segment 0: paddr=00010020 vaddr=3c060020 size=10038h ( 65592) map[0m
[0;32mI (101) esp_image: segment 1: paddr=00020060 vaddr=3fc8ee00 size=015a8h (  5544) load[0m
[0;32mI (102) esp_image: segment 2: paddr=00021610 vaddr=40380000 size=0ea08h ( 59912) load[0m
[0;32mI (116) esp_image: segment 3: paddr=00030020 vaddr=42000020 size=55678h (349816) map[0m
[0;32mI (171) esp_image: segment 4: paddr=000856a0 vaddr=4038ea08 size=003b8h (   952) load[0m
[0;32mI (172) esp_image: segment 5: paddr=00085a60 vaddr=50000000 size=0001ch (    28) load[0m
[0;32mI (179) boot: Loaded app from partition at offset 0x10000[0m
[0;32mI (180) boot: Disabling RNG early entropy source...[0m
[0;32mI (197) cpu_start: Unicore app[0m
[0;32mI (205) cpu_start: Pro cpu start user code[0m
[0;32mI (205) cpu_start: cpu freq: 160000000 Hz[0m
[0;32mI (205) app_init: Application information:[0m
[0;32mI (205) app_init: Project name:     AP_displayer[0m
[0;32mI (209) app_init: App version:      1[0m
[0;32mI (213) app_init: Compile time:     Mar  3 2025 13:10:41[0m
[0;32mI (218) app_init: ELF file SHA256:  062a20061...[0m
[0;32mI (222) app_init: ESP-IDF:          v5.5-dev-1655-gc5865270b5[0m
[0;32mI (228) efuse_init: Min chip rev:     v0.3[0m
[0;32mI (232) efuse_init: Max chip rev:     v1.99 [0m
[0;32mI (236) efuse_init: Chip rev:         v0.3[0m
[0;32mI (239) heap_init: Initializing. RAM available for dynamic allocation:[0m
[0;32mI (246) heap_init: At 3FCA14A0 len 0001EB60 (122 KiB): RAM[0m
[0;32mI (251) heap_init: At 3FCC0000 len 0001C710 (113 KiB): Retention RAM[0m
[0;32mI (257) heap_init: At 3FCDC710 len 00002950 (10 KiB): Retention RAM[0m
[0;32mI (263) heap_init: At 5000001C len 00001FCC (7 KiB): RTCRAM[0m
[0;32mI (269) spi_flash: detected chip: generic[0m
[0;32mI (272) spi_flash: flash io: dio[0m
[0;33mW (275) spi_flash: Detected size(4096k) larger than the size in the binary image header(2048k). Using the size in the binary image header.[0m
[0;32mI (287) sleep_gpio: Configure to isolate all GPIO pins in sleep state[0m
[0;32mI (293) sleep_gpio: Enable automatic switching of GPIO sleep configuration[0m
[0;32mI (300) main_task: Started on CPU0[0m
[0;32mI (310) main_task: Calling app_main()[0m
[0;32mI (320) display_driver: config bl pin[0m
[0;32mI (320) gpio: GPIO[2]| InputEn: 0| OutputEn: 1| OpenDrain: 0| Pullup: 0| Pulldown: 0| Intr:0 [0m
[0;32mI (320) display_driver: init spi bus[0m
[0;32mI (330) display_driver: init lcd panel io[0m
[0;32mI (330) gpio: GPIO[1]| InputEn: 0| OutputEn: 1| OpenDrain: 0| Pullup: 0| Pulldown: 0| Intr:0 [0m
[0;32mI (340) display_driver: init ili9341 driver[0m
[0;32mI (340) gpio: GPIO[4]| InputEn: 0| OutputEn: 1| OpenDrain: 0| Pullup: 0| Pulldown: 0| Intr:0 [0m
[0;32mI (350) ili9341: LCD panel create success, version: 1.2.0[0m
[0;32mI (470) display_driver: init lvgl[0m
[0;32mI (470) display_driver: init lv tick_timer[0m
[0;32mI (470) display_driver: create lvgl task[0m
[0;32mI (470) display_driver: starting lvgl task[0m
[1;31mE (5450) task_wdt: Task watchdog got triggered. The following tasks/users did not reset the watchdog in time:[0m
[1;31mE (5450) task_wdt:  - IDLE (CPU 0)[0m
[1;31mE (5450) task_wdt: Tasks currently running:[0m
[1;31mE (5450) task_wdt: CPU 0: lvgl_task[0m
[1;31mE (5450) task_wdt: Print CPU 0 (current core) registers[0m
Core  0 register dump:
MEPC    : 0x42011e76  RA      : 0x42011e4e  SP      : 0x3fcacea0  GP      : 0x3fc8f600  
TP      : 0x3fcacfb0  T0      : 0x00000000  T1      : 0x40000000  T2      : 0x00000000  
S0/FP   : 0x3fc91d70  S1      : 0x3fc92098  A0      : 0x00000001  A1      : 0x00000000  
A2      : 0x3fc92cd4  A3      : 0x00000035  A4      : 0x3fc92c2c  A5      : 0x00000001  
A6      : 0x00000014  A7      : 0x0000000a  S2      : 0x00000000  S3      : 0x3fc920b0  
S4      : 0x00000027  S5      : 0x00000014  S6      : 0x00000000  S7      : 0x00000000  
S8      : 0x00000000  S9      : 0x00000000  S10     : 0x00000000  S11     : 0x00000000  
T3      : 0x00000000  T4      : 0x00000000  T5      : 0x00000000  T6      : 0x00000000  
MSTATUS : 0x00001889  MTVEC   : 0x40380001  MCAUSE  : 0xdeadc0de  MTVAL   : 0xdeadc0de  
MHARTID : 0x00000000  
Please enable CONFIG_ESP_SYSTEM_USE_FRAME_POINTER option to have a full backtrace.
[1;31mE (10450) task_wdt: Task watchdog got triggered. The following tasks/users did not reset the watchdog in time:[0m
[1;31mE (10450) task_wdt:  - IDLE (CPU 0)[0m
[1;31mE (10450) task_wdt: Tasks currently running:[0m
[1;31mE (10450) task_wdt: CPU 0: lvgl_task[0m
[1;31mE (10450) task_wdt: Print CPU 0 (current core) registers[0m
Core  0 register dump:
MEPC    : 0x42011e78  RA      : 0x42011e4e  SP      : 0x3fcacea0  GP      : 0x3fc8f600  
TP      : 0x3fcacfb0  T0      : 0x00000000  T1      : 0x40000000  T2      : 0x00000000  
S0/FP   : 0x3fc91d70  S1      : 0x3fc92098  A0      : 0x00000001  A1      : 0x00000000  
A2      : 0x3fc92cd4  A3      : 0x00000035  A4      : 0x3fc92c2c  A5      : 0x00000001  
A6      : 0x00000014  A7      : 0x0000000a  S2      : 0x00000000  S3      : 0x3fc920b0  
S4      : 0x00000027  S5      : 0x00000014  S6      : 0x00000000  S7      : 0x00000000  
S8      : 0x00000000  S9      : 0x00000000  S10     : 0x00000000  S11     : 0x00000000  
T3      : 0x00000000  T4      : 0x00000000  T5      : 0x00000000  T6      : 0x00000000  
MSTATUS : 0x00001889  MTVEC   : 0x40380001  MCAUSE  : 0xdeadc0de  MTVAL   : 0xdeadc0de  
MHARTID : 0x00000000  
Please enable CONFIG_ESP_SYSTEM_USE_FRAME_POINTER option to have a full backtrace.
[1;31mE (15450) task_wdt: Task watchdog got triggered. The following tasks/users did not reset the watchdog in time:[0m
[1;31mE (15450) task_wdt:  - IDLE (CPU 0)[0m
[1;31mE (15450) task_wdt: Tasks currently running:[0m
[1;31mE (15450) task_wdt: CPU 0: lvgl_task[0m
[1;31mE (15450) task_wdt: Print CPU 0 (current core) registers[0m
Core  0 register dump:
MEPC    : 0x42011e76  RA      : 0x42011e4e  SP      : 0x3fcacea0  GP      : 0x3fc8f600  
TP      : 0x3fcacfb0  T0      : 0x00000000  T1      : 0x40000000  T2      : 0x00000000  
S0/FP   : 0x3fc91d70  S1      : 0x3fc92098  A0      : 0x00000001  A1      : 0x00000000  
A2      : 0x3fc92cd4  A3      : 0x00000035  A4      : 0x3fc92c2c  A5      : 0x00000001  
A6      : 0x00000014  A7      : 0x0000000a  S2      : 0x00000000  S3      : 0x3fc920b0  
S4      : 0x00000027  S5      : 0x00000014  S6      : 0x00000000  S7      : 0x00000000  
S8      : 0x00000000  S9      : 0x00000000  S10     : 0x00000000  S11     : 0x00000000  
T3      : 0x00000000  T4      : 0x00000000  T5      : 0x00000000  T6      : 0x00000000  
MSTATUS : 0x00001889  MTVEC   : 0x40380001  MCAUSE  : 0xdeadc0de  MTVAL   : 0xdeadc0de  
MHARTID : 0x00000000  
Please enable CONFIG_ESP_SYSTEM_USE_FRAME_POINTER option to have a full backtrace.
[1;31mE (20450) task_wdt: Task watchdog got triggered. The following tasks/users did not reset the watchdog in time:[0m
[1;31mE (20450) task_wdt:  - IDLE (CPU 0)[0m
[1;31mE (20450) task_wdt: Tasks currently running:[0m
[1;31mE (20450) task_wdt: CPU 0: lvgl_task[0m
[1;31mE (20450) task_wdt: Print CPU 0 (current core) registers[0m
Core  0 register dump:
MEPC    : 0x42011e78  RA      : 0x42011e4e  SP      : 0x3fcacea0  GP      : 0x3fc8f600  
TP      : 0x3fcacfb0  T0      : 0x00000000  T1      : 0x40000000  T2      : 0x00000000  
S0/FP   : 0x3fc91d70  S1      : 0x3fc92098  A0      : 0x00000001  A1      : 0x00000000  
A2      : 0x3fc92cd4  A3      : 0x00000035  A4      : 0x3fc92c2c  A5      : 0x00000001  
A6      : 0x00000014  A7      : 0x0000000a  S2      : 0x00000000  S3      : 0x3fc920b0  
S4      : 0x00000027  S5      : 0x00000014  S6      : 0x00000000  S7      : 0x00000000  
S8      : 0x00000000  S9      : 0x00000000  S10     : 0x00000000  S11     : 0x00000000  
T3      : 0x00000000  T4      : 0x00000000  T5      : 0x00000000  T6      : 0x00000000  
MSTATUS : 0x00001889  MTVEC   : 0x40380001  MCAUSE  : 0xdeadc0de  MTVAL   : 0xdeadc0de  
MHARTID : 0x00000000  
Please enable CONFIG_ESP_SYSTEM_USE_FRAME_POINTER option to have a full backtrace.
[1;31mE (25450) task_wdt: Task watchdog got triggered. The following tasks/users did not reset the watchdog in time:[0m
[1;31mE (25450) task_wdt:  - IDLE (CPU 0)[0m
[1;31mE (25450) task_wdt: Tasks currently running:[0m
[1;31mE (25450) task_wdt: CPU 0: lvgl_task[0m
[1;31mE (25450) task_wdt: Print CPU 0 (current core) registers[0m
Core  0 register dump:
MEPC    : 0x42011e76  RA      : 0x42011e4e  SP      : 0x3fcacea0  GP      : 0x3fc8f600  
TP      : 0x3fcacfb0  T0      : 0x00000000  T1      : 0x40000000  T2      : 0x00000000  
S0/FP   : 0x3fc91d70  S1      : 0x3fc92098  A0      : 0x00000001  A1      : 0x00000000  
A2      : 0x3fc92cd4  A3      : 0x00000035  A4      : 0x3fc92c2c  A5      : 0x00000001  
A6      : 0x00000014  A7      : 0x0000000a  S2      : 0x00000000  S3      : 0x3fc920b0  
S4      : 0x00000027  S5      : 0x00000014  S6      : 0x00000000  S7      : 0x00000000  
S8      : 0x00000000  S9      : 0x00000000  S10     : 0x00000000  S11     : 0x00000000  
T3      : 0x00000000  T4      : 0x00000000  T5      : 0x00000000  T6      : 0x00000000  
MSTATUS : 0x00001889  MTVEC   : 0x40380001  MCAUSE  : 0xdeadc0de  MTVAL   : 0xdeadc0de  
MHARTID : 0x00000000  
Please enable CONFIG_ESP_SYSTEM_USE_FRAME_POINTER option to have a full backtrace.
[1;31mE (30450) task_wdt: Task watchdog got triggered. The following tasks/users did not reset the watchdog in time:[0m
[1;31mE (30450) task_wdt:  - IDLE (CPU 0)[0m
[1;31mE (30450) task_wdt: Tasks currently running:[0m
[1;31mE (30450) task_wdt: CPU 0: lvgl_task[0m
[1;31mE (30450) task_wdt: Print CPU 0 (current core) registers[0m
Core  0 register dump:
MEPC    : 0x42011e78  RA      : 0x42011e4e  SP      : 0x3fcacea0  GP      : 0x3fc8f600  
TP      : 0x3fcacfb0  T0      : 0x00000000  T1      : 0x40000000  T2      : 0x00000000  
S0/FP   : 0x3fc91d70  S1      : 0x3fc92098  A0      : 0x00000001  A1      : 0x00000000  
A2      : 0x3fc92cd4  A3      : 0x00000035  A4      : 0x3fc92c2c  A5      : 0x00000001  
A6      : 0x00000014  A7      : 0x0000000a  S2      : 0x00000000  S3      : 0x3fc920b0  
S4      : 0x00000027  S5      : 0x00000014  S6      : 0x00000000  S7      : 0x00000000  
S8      : 0x00000000  S9      : 0x00000000  S10     : 0x00000000  S11     : 0x00000000  
T3      : 0x00000000  T4      : 0x00000000  T5      : 0x00000000  T6      : 0x00000000  
MSTATUS : 0x00001889  MTVEC   : 0x40380001  MCAUSE  : 0xdeadc0de  MTVAL   : 0xdeadc0de  
MHARTID : 0x00000000  
Please enable CONFIG_ESP_SYSTEM_USE_FRAME_POINTER option to have a full backtrace.
[1;31mE (35450) task_wdt: Task watchdog got triggered. The following tasks/users did not reset the watchdog in time:[0m
[1;31mE (35450) task_wdt:  - IDLE (CPU 0)[0m
[1;31mE (35450) task_wdt: Tasks currently running:[0m
[1;31mE (35450) task_wdt: CPU 0: lvgl_task[0m
[1;31mE (35450) task_wdt: Print CPU 0 (current core) registers[0m
Core  0 register dump:
MEPC    : 0x42011e76  RA      : 0x42011e4e  SP      : 0x3fcacea0  GP      : 0x3fc8f600  
TP      : 0x3fcacfb0  T0      : 0x00000000  T1      : 0x40000000  T2      : 0x00000000  
S0/FP   : 0x3fc91d70  S1      : 0x3fc92098  A0      : 0x00000001  A1      : 0x00000000  
A2      : 0x3fc92cd4  A3      : 0x00000035  A4      : 0x3fc92c2c  A5      : 0x00000001  
A6      : 0x00000014  A7      : 0x0000000a  S2      : 0x00000000  S3      : 0x3fc920b0  
S4      : 0x00000027  S5      : 0x00000014  S6      : 0x00000000  S7      : 0x00000000  
S8      : 0x00000000  S9      : 0x00000000  S10     : 0x00000000  S11     : 0x00000000  
T3      : 0x00000000  T4      : 0x00000000  T5      : 0x00000000  T6      : 0x00000000  
MSTATUS : 0x00001889  MTVEC   : 0x40380001  MCAUSE  : 0xdeadc0de  MTVAL   : 0xdeadc0de  
MHARTID : 0x00000000  
Please enable CONFIG_ESP_SYSTEM_USE_FRAME_POINTER option to have a full backtrace.
[1;31mE (40450) task_wdt: Task watchdog got triggered. The following tasks/users did not reset the watchdog in time:[0m
[1;31mE (40450) task_wdt:  - IDLE (CPU 0)[0m
[1;31mE (40450) task_wdt: Tasks currently running:[0m
[1;31mE (40450) task_wdt: CPU 0: lvgl_task[0m
[1;31mE (40450) task_wdt: Print CPU 0 (current core) registers[0m
Core  0 register dump:
MEPC    : 0x42011e78  RA      : 0x42011e4e  SP      : 0x3fcacea0  GP      : 0x3fc8f600  
TP      : 0x3fcacfb0  T0      : 0x00000000  T1      : 0x40000000  T2      : 0x00000000  
S0/FP   : 0x3fc91d70  S1      : 0x3fc92098  A0      : 0x00000001  A1      : 0x00000000  
A2      : 0x3fc92cd4  A3      : 0x00000035  A4      : 0x3fc92c2c  A5      : 0x00000001  
A6      : 0x00000014  A7      : 0x0000000a  S2      : 0x00000000  S3      : 0x3fc920b0  
S4      : 0x00000027  S5      : 0x00000014  S6      : 0x00000000  S7      : 0x00000000  
S8      : 0x00000000  S9      : 0x00000000  S10     : 0x00000000  S11     : 0x00000000  
T3      : 0x00000000  T4      : 0x00000000  T5      : 0x00000000  T6      : 0x00000000  
MSTATUS : 0x00001889  MTVEC   : 0x40380001  MCAUSE  : 0xdeadc0de  MTVAL   : 0xdeadc0de  
MHARTID : 0x00000000  
Please enable CONFIG_ESP_SYSTEM_USE_FRAME_POINTER option to have a full backtrace.
[1;31mE (45450) task_wdt: Task watchdog got triggered. The following tasks/users did not reset the watchdog in time:[0m
[1;31mE (45450) task_wdt:  - IDLE (CPU 0)[0m
[1;31mE (45450) task_wdt: Tasks currently running:[0m
[1;31mE (45450) task_wdt: CPU 0: lvgl_task[0m
[1;31mE (45450) task_wdt: Print CPU 0 (current core) registers[0m
Core  0 register dump:
MEPC    : 0x42011e76  RA      : 0x42011e4e  SP      : 0x3fcacea0  GP      : 0x3fc8f600  
TP      : 0x3fcacfb0  T0      : 0x00000000  T1      : 0x40000000  T2      : 0x00000000  
S0/FP   : 0x3fc91d70  S1      : 0x3fc92098  A0      : 0x00000001  A1      : 0x00000000  
A2      : 0x3fc92cd4  A3      : 0x00000035  A4      : 0x3fc92c2c  A5      : 0x00000001  
A6      : 0x00000014  A7      : 0x0000000a  S2      : 0x00000000  S3      : 0x3fc920b0  
S4      : 0x00000027  S5      : 0x00000014  S6      : 0x00000000  S7      : 0x00000000  
S8      : 0x00000000  S9      : 0x00000000  S10     : 0x00000000  S11     : 0x00000000  
T3      : 0x00000000  T4      : 0x00000000  T5      : 0x00000000  T6      : 0x00000000  
MSTATUS : 0x00001889  MTVEC   : 0x40380001  MCAUSE  : 0xdeadc0de  MTVAL   : 0xdeadc0de  
MHARTID : 0x00000000  
Please enable CONFIG_ESP_SYSTEM_USE_FRAME_POINTER option to have a full backtrace.
[1;31mE (50450) task_wdt: Task watchdog got triggered. The following tasks/users did not reset the watchdog in time:[0m
[1;31mE (50450) task_wdt:  - IDLE (CPU 0)[0m
[1;31mE (50450) task_wdt: Tasks currently running:[0m
[1;31mE (50450) task_wdt: CPU 0: lvgl_task[0m
[1;31mE (50450) task_wdt: Print CPU 0 (current core) registers[0m
Core  0 register dump:
MEPC    : 0x42011e78  RA      : 0x42011e4e  SP      : 0x3fcacea0  GP      : 0x3fc8f600  
TP      : 0x3fcacfb0  T0      : 0x00000000  T1      : 0x40000000  T2      : 0x00000000  
S0/FP   : 0x3fc91d70  S1      : 0x3fc92098  A0      : 0x00000001  A1      : 0x00000000  
A2      : 0x3fc92cd4  A3      : 0x00000035  A4      : 0x3fc92c2c  A5      : 0x00000001  
A6      : 0x00000014  A7      : 0x0000000a  S2      : 0x00000000  S3      : 0x3fc920b0  
S4      : 0x00000027  S5      : 0x00000014  S6      : 0x00000000  S7      : 0x00000000  
S8      : 0x00000000  S9      : 0x00000000  S10     : 0x00000000  S11     : 0x00000000  
T3      : 0x00000000  T4      : 0x00000000  T5      : 0x00000000  T6      : 0x00000000  
MSTATUS : 0x00001889  MTVEC   : 0x40380001  MCAUSE  : 0xdeadc0de  MTVAL   : 0xdeadc0de  
MHARTID : 0x00000000  
Please enable CONFIG_ESP_SYSTEM_USE_FRAME_POINTER option to have a full backtrace.
[1;31mE (55450) task_wdt: Task watchdog got triggered. The following tasks/users did not reset the watchdog in time:[0m
[1;31mE (55450) task_wdt:  - IDLE (CPU 0)[0m
[1;31mE (55450) task_wdt: Tasks currently running:[0m
[1;31mE (55450) task_wdt: CPU 0: lvgl_task[0m
[1;31mE (55450) task_wdt: Print CPU 0 (current core) registers[0m
Core  0 register dump:
MEPC    : 0x42011e76  RA      : 0x42011e4e  SP      : 0x3fcacea0  GP      : 0x3fc8f600  
TP      : 0x3fcacfb0  T0      : 0x00000000  T1      : 0x40000000  T2      : 0x00000000  
S0/FP   : 0x3fc91d70  S1      : 0x3fc92098  A0      : 0x00000001  A1      : 0x00000000  
A2      : 0x3fc92cd4  A3      : 0x00000035  A4      : 0x3fc92c2c  A5      : 0x00000001  
A6      : 0x00000014  A7      : 0x0000000a  S2      : 0x00000000  S3      : 0x3fc920b0  
S4      : 0x00000027  S5      : 0x00000014  S6      : 0x00000000  S7      : 0x00000000  
S8      : 0x00000000  S9      : 0x00000000  S10     : 0x00000000  S11     : 0x00000000  
T3      : 0x00000000  T4      : 0x00000000  T5      : 0x00000000  T6      : 0x00000000  
MSTATUS : 0x00001889  MTVEC   : 0x40380001  MCAUSE  : 0xdeadc0de  MTVAL   : 0xdeadc0de  
MHARTID : 0x00000000  
Please enable CONFIG_ESP_SYSTEM_USE_FRAME_POINTER option to have a full backtrace.
[1;31mE (60450) task_wdt: Task watchdog got triggered. The following tasks/users did not reset the watchdog in time:[0m
[1;31mE (60450) task_wdt:  - IDLE (CPU 0)[0m
[1;31mE (60450) task_wdt: Tasks currently running:[0m
[1;31mE (60450) task_wdt: CPU 0: lvgl_task[0m
[1;31mE (60450) task_wdt: Print CPU 0 (current core) registers[0m
Core  0 register dump:
MEPC    : 0x42011e78  RA      : 0x42011e4e  SP      : 0x3fcacea0  GP      : 0x3fc8f600  
TP      : 0x3fcacfb0  T0      : 0x00000000  T1      : 0x40000000  T2      : 0x00000000  
S0/FP   : 0x3fc91d70  S1      : 0x3fc92098  A0      : 0x00000001  A1      : 0x00000000  
A2      : 0x3fc92cd4  A3      : 0x00000035  A4      : 0x3fc92c2c  A5      : 0x00000001  
A6      : 0x00000014  A7      : 0x0000000a  S2      : 0x00000000  S3      : 0x3fc920b0  
S4      : 0x00000027  S5      : 0x00000014  S6      : 0x00000000  S7      : 0x00000000  
S8      : 0x00000000  S9      : 0x00000000  S10     : 0x00000000  S11     : 0x00000000  
T3      : 0x00000000  T4      : 0x00000000  T5      : 0x00000000  T6      : 0x00000000  
MSTATUS : 0x00001889  MTVEC   : 0x40380001  MCAUSE  : 0xdeadc0de  MTVAL   : 0xdeadc0de  
MHARTID : 0x00000000  
Please enable CONFIG_ESP_SYSTEM_USE_FRAME_POINTER option to have a full backtrace.
[1;31mE (65450) task_wdt: Task watchdog got triggered. The following tasks/users did not reset the watchdog in time:[0m
[1;31mE (65450) task_wdt:  - IDLE (CPU 0)[0m
[1;31mE (65450) task_wdt: Tasks currently running:[0m
[1;31mE (65450) task_wdt: CPU 0: lvgl_task[0m
[1;31mE (65450) task_wdt: Print CPU 0 (current core) registers[0m
Core  0 register dump:
MEPC    : 0x42011e76  RA      : 0x42011e4e  SP      : 0x3fcacea0  GP      : 0x3fc8f600  
TP      : 0x3fcacfb0  T0      : 0x00000000  T1      : 0x40000000  T2      : 0x00000000  
S0/FP   : 0x3fc91d70  S1      : 0x3fc92098  A0      : 0x00000001  A1      : 0x00000000  
A2      : 0x3fc92cd4  A3      : 0x00000035  A4      : 0x3fc92c2c  A5      : 0x00000001  
A6      : 0x00000014  A7      : 0x0000000a  S2      : 0x00000000  S3      : 0x3fc920b0  
S4      : 0x00000027  S5      : 0x00000014  S6      : 0x00000000  S7      : 0x00000000  
S8      : 0x00000000  S9      : 0x00000000  S10     : 0x00000000  S11     : 0x00000000  
T3      : 0x00000000  T4      : 0x00000000  T5      : 0x00000000  T6      : 0x00000000  
MSTATUS : 0x00001889  MTVEC   : 0x40380001  MCAUSE  : 0xdeadc0de  MTVAL   : 0xdeadc0de  
MHARTID : 0x00000000  
Please enable CONFIG_ESP_SYSTEM_USE_FRAME_POINTER option to have a full backtrace.
[1;31mE (70450) task_wdt: Task watchdog got triggered. The following tasks/users did not reset the watchdog in time:[0m
[1;31mE (70450) task_wdt:  - IDLE (CPU 0)[0m
[1;31mE (70450) task_wdt: Tasks currently running:[0m
[1;31mE (70450) task_wdt: CPU 0: lvgl_task[0m
[1;31mE (70450) task_wdt: Print CPU 0 (current core) registers[0m
Core  0 register dump:
MEPC    : 0x42011e78  RA      : 0x42011e4e  SP      : 0x3fcacea0  GP      : 0x3fc8f600  
TP      : 0x3fcacfb0  T0      : 0x00000000  T1      : 0x40000000  T2      : 0x00000000  
S0/FP   : 0x3fc91d70  S1      : 0x3fc92098  A0      : 0x00000001  A1      : 0x00000000  
A2      : 0x3fc92cd4  A3      : 0x00000035  A4      : 0x3fc92c2c  A5      : 0x00000001  
A6      : 0x00000014  A7      : 0x0000000a  S2      : 0x00000000  S3      : 0x3fc920b0  
S4      : 0x00000027  S5      : 0x00000014  S6      : 0x00000000  S7      : 0x00000000  
S8      : 0x00000000  S9      : 0x00000000  S10     : 0x00000000  S11     : 0x00000000  
T3      : 0x00000000  T4      : 0x00000000  T5      : 0x00000000  T6      : 0x00000000  
MSTATUS : 0x00001889  MTVEC   : 0x40380001  MCAUSE  : 0xdeadc0de  MTVAL   : 0xdeadc0de  
MHARTID : 0x00000000  
Please enable CONFIG_ESP_SYSTEM_USE_FRAME_POINTER option to have a full backtrace.
[1;31mE (75450) task_wdt: Task watchdog got triggered. The following tasks/users did not reset the watchdog in time:[0m
[1;31mE (75450) task_wdt:  - IDLE (CPU 0)[0m
[1;31mE (75450) task_wdt: Tasks currently running:[0m
[1;31mE (75450) task_wdt: CPU 0: lvgl_task[0m
[1;31mE (75450) task_wdt: Print CPU 0 (current core) registers[0m
Core  0 register dump:
MEPC    : 0x42011e76  RA      : 0x42011e4e  SP      : 0x3fcacea0  GP      : 0x3fc8f600  
TP      : 0x3fcacfb0  T0      : 0x00000000  T1      : 0x40000000  T2      : 0x00000000  
S0/FP   : 0x3fc91d70  S1      : 0x3fc92098  A0      : 0x00000001  A1      : 0x00000000  
A2      : 0x3fc92cd4  A3      : 0x00000035  A4      : 0x3fc92c2c  A5      : 0x00000001  
A6      : 0x00000014  A7      : 0x0000000a  S2      : 0x00000000  S3      : 0x3fc920b0  
S4      : 0x00000027  S5      : 0x00000014  S6      : 0x00000000  S7      : 0x00000000  
S8      : 0x00000000  S9      : 0x00000000  S10     : 0x00000000  S11     : 0x00000000  
T3      : 0x00000000  T4      : 0x00000000  T5      : 0x00000000  T6      : 0x00000000  
MSTATUS : 0x00001889  MTVEC   : 0x40380001  MCAUSE  : 0xdeadc0de  MTVAL   : 0xdeadc0de  
MHARTID : 0x00000000  
Please enable CONFIG_ESP_SYSTEM_USE_FRAME_POINTER option to have a full backtrace.
[1;31mE (80450) task_wdt: Task watchdog got triggered. The following tasks/users did not reset the watchdog in time:[0m
[1;31mE (80450) task_wdt:  - IDLE (CPU 0)[0m
[1;31mE (80450) task_wdt: Tasks currently running:[0m
[1;31mE (80450) task_wdt: CPU 0: lvgl_task[0m
[1;31mE (80450) task_wdt: Print CPU 0 (current core) registers[0m
Core  0 register dump:
MEPC    : 0x42011e78  RA      : 0x42011e4e  SP      : 0x3fcacea0  GP      : 0x3fc8f600  
TP      : 0x3fcacfb0  T0      : 0x00000000  T1      : 0x40000000  T2      : 0x00000000  
S0/FP   : 0x3fc91d70  S1      : 0x3fc92098  A0      : 0x00000001  A1      : 0x00000000  
A2      : 0x3fc92cd4  A3      : 0x00000035  A4      : 0x3fc92c2c  A5      : 0x00000001  
A6      : 0x00000014  A7      : 0x0000000a  S2      : 0x00000000  S3      : 0x3fc920b0  
S4      : 0x00000027  S5      : 0x00000014  S6      : 0x00000000  S7      : 0x00000000  
S8      : 0x00000000  S9      : 0x00000000  S10     : 0x00000000  S11     : 0x00000000  
T3      : 0x00000000  T4      : 0x00000000  T5      : 0x00000000  T6      : 0x00000000  
MSTATUS : 0x00001889  MTVEC   : 0x40380001  MCAUSE  : 0xdeadc0de  MTVAL   : 0xdeadc0de  
MHARTID : 0x00000000  
Please enable CONFIG_ESP_SYSTEM_USE_FRAME_POINTER option to have a full backtrace.
[1;31mE (85450) task_wdt: Task watchdog got triggered. The following tasks/users did not reset the watchdog in time:[0m
[1;31mE (85450) task_wdt:  - IDLE (CPU 0)[0m
[1;31mE (85450) task_wdt: Tasks currently running:[0m
[1;31mE (85450) task_wdt: CPU 0: lvgl_task[0m
[1;31mE (85450) task_wdt: Print CPU 0 (current core) registers[0m
Core  0 register dump:
MEPC    : 0x42011e76  RA      : 0x42011e4e  SP      : 0x3fcacea0  GP      : 0x3fc8f600  
TP      : 0x3fcacfb0  T0      : 0x00000000  T1      : 0x40000000  T2      : 0x00000000  
S0/FP   : 0x3fc91d70  S1      : 0x3fc92098  A0      : 0x00000001  A1      : 0x00000000  
A2      : 0x3fc92cd4  A3      : 0x00000035  A4      : 0x3fc92c2c  A5      : 0x00000001  
A6      : 0x00000014  A7      : 0x0000000a  S2      : 0x00000000  S3      : 0x3fc920b0  
S4      : 0x00000027  S5      : 0x00000014  S6      : 0x00000000  S7      : 0x00000000  
S8      : 0x00000000  S9      : 0x00000000  S10     : 0x00000000  S11     : 0x00000000  
T3      : 0x00000000  T4      : 0x00000000  T5      : 0x00000000  T6      : 0x00000000  
MSTATUS : 0x00001889  MTVEC   : 0x40380001  MCAUSE  : 0xdeadc0de  MTVAL   : 0xdeadc0de  
MHARTID : 0x00000000  
Please enable CONFIG_ESP_SYSTEM_USE_FRAME_POINTER option to have a full backtrace.
[1;31mE (90450) task_wdt: Task watchdog got triggered. The following tasks/users did not reset the watchdog in time:[0m
[1;31mE (90450) task_wdt:  - IDLE (CPU 0)[0m
[1;31mE (90450) task_wdt: Tasks currently running:[0m
[1;31mE (90450) task_wdt: CPU 0: lvgl_task[0m
[1;31mE (90450) task_wdt: Print CPU 0 (current core) registers[0m
Core  0 register dump:
MEPC    : 0x42011e78  RA      : 0x42011e4e  SP      : 0x3fcacea0  GP      : 0x3fc8f600  
TP      : 0x3fcacfb0  T0      : 0x00000000  T1      : 0x40000000  T2      : 0x00000000  
S0/FP   : 0x3fc91d70  S1      : 0x3fc92098  A0      : 0x00000001  A1      : 0x00000000  
A2      : 0x3fc92cd4  A3      : 0x00000035  A4      : 0x3fc92c2c  A5      : 0x00000001  
A6      : 0x00000014  A7      : 0x0000000a  S2      : 0x00000000  S3      : 0x3fc920b0  
S4      : 0x00000027  S5      : 0x00000014  S6      : 0x00000000  S7      : 0x00000000  
S8      : 0x00000000  S9      : 0x00000000  S10     : 0x00000000  S11     : 0x00000000  
T3      : 0x00000000  T4      : 0x00000000  T5      : 0x00000000  T6      : 0x00000000  
MSTATUS : 0x00001889  MTVEC   : 0x40380001  MCAUSE  : 0xdeadc0de  MTVAL   : 0xdeadc0de  
MHARTID : 0x00000000  
Please enable CONFIG_ESP_SYSTEM_USE_FRAME_POINTER option to have a full backtrace.
[1;31mE (95450) task_wdt: Task watchdog got triggered. The following tasks/users did not reset the watchdog in time:[0m
[1;31mE (95450) task_wdt:  - IDLE (CPU 0)[0m
[1;31mE (95450) task_wdt: Tasks currently running:[0m
[1;31mE (95450) task_wdt: CPU 0: lvgl_task[0m
[1;31mE (95450) task_wdt: Print CPU 0 (current core) registers[0m
Core  0 register dump:
MEPC    : 0x42011e76  RA      : 0x42011e4e  SP      : 0x3fcacea0  GP      : 0x3fc8f600  
TP      : 0x3fcacfb0  T0      : 0x00000000  T1      : 0x40000000  T2      : 0x00000000  
S0/FP   : 0x3fc91d70  S1      : 0x3fc92098  A0      : 0x00000001  A1      : 0x00000000  
A2      : 0x3fc92cd4  A3      : 0x00000035  A4      : 0x3fc92c2c  A5      : 0x00000001  
A6      : 0x00000014  A7      : 0x0000000a  S2      : 0x00000000  S3      : 0x3fc920b0  
S4      : 0x00000027  S5      : 0x00000014  S6      : 0x00000000  S7      : 0x00000000  
S8      : 0x00000000  S9      : 0x00000000  S10     : 0x00000000  S11     : 0x00000000  
T3      : 0x00000000  T4      : 0x00000000  T5      : 0x00000000  T6      : 0x00000000  
MSTATUS : 0x00001889  MTVEC   : 0x40380001  MCAUSE  : 0xdeadc0de  MTVAL   : 0xdeadc0de  
MHARTID : 0x00000000  
Please enable CONFIG_ESP_SYSTEM_USE_FRAME_POINTER option to have a full backtrace.
[1;31mE (100450) task_wdt: Task watchdog got triggered. The following tasks/users did not reset the watchdog in time:[0m
[1;31mE (100450) task_wdt:  - IDLE (CPU 0)[0m
[1;31mE (100450) task_wdt: Tasks currently running:[0m
[1;31mE (100450) task_wdt: CPU 0: lvgl_task[0m
[1;31mE (100450) task_wdt: Print CPU 0 (current core) registers[0m
Core  0 register dump:
MEPC    : 0x42011e78  RA      : 0x42011e4e  SP      : 0x3fcacea0  GP      : 0x3fc8f600  
TP      : 0x3fcacfb0  T0      : 0x00000000  T1      : 0x40000000  T2      : 0x00000000  
S0/FP   : 0x3fc91d70  S1      : 0x3fc92098  A0      : 0x00000001  A1      : 0x00000000  
A2      : 0x3fc92cd4  A3      : 0x00000035  A4      : 0x3fc92c2c  A5      : 0x00000001  
A6      : 0x00000014  A7      : 0x0000000a  S2      : 0x00000000  S3      : 0x3fc920b0  
S4      : 0x00000027  S5      : 0x00000014  S6      : 0x00000000  S7      : 0x00000000  
S8      : 0x00000000  S9      : 0x00000000  S10     : 0x00000000  S11     : 0x00000000  
T3      : 0x00000000  T4      : 0x00000000  T5      : 0x00000000  T6      : 0x00000000  
MSTATUS : 0x00001889  MTVEC   : 0x40380001  MCAUSE  : 0xdeadc0de  MTVAL   : 0xdeadc0de  
MHARTID : 0x00000000  
Please enable CONFIG_ESP_SYSTEM_USE_FRAME_POINTER option to have a full backtrace.
[1;31mE (105450) task_wdt: Task watchdog got triggered. The following tasks/users did not reset the watchdog in time:[0m
[1;31mE (105450) task_wdt:  - IDLE (CPU 0)[0m
[1;31mE (105450) task_wdt: Tasks currently running:[0m
[1;31mE (105450) task_wdt: CPU 0: lvgl_task[0m
[1;31mE (105450) task_wdt: Print CPU 0 (current core) registers[0m
Core  0 register dump:
MEPC    : 0x42011e78  RA      : 0x42011e4e  SP      : 0x3fcacea0  GP      : 0x3fc8f600  
TP      : 0x3fcacfb0  T0      : 0x00000000  T1      : 0x40000000  T2      : 0x00000000  
S0/FP   : 0x3fc91d70  S1      : 0x3fc92098  A0      : 0x00000001  A1      : 0x00000000  
A2      : 0x3fc92cd4  A3      : 0x00000035  A4      : 0x3fc92c2c  A5      : 0x00000001  
A6      : 0x00000014  A7      : 0x0000000a  S2      : 0x00000000  S3      : 0x3fc920b0  
S4      : 0x00000027  S5      : 0x00000014  S6      : 0x00000000  S7      : 0x00000000  
S8      : 0x00000000  S9      : 0x00000000  S10     : 0x00000000  S11     : 0x00000000  
T3      : 0x00000000  T4      : 0x00000000  T5      : 0x00000000  T6      : 0x00000000  
MSTATUS : 0x00001889  MTVEC   : 0x40380001  MCAUSE  : 0xdeadc0de  MTVAL   : 0xdeadc0de  
MHARTID : 0x00000000  
Please enable CONFIG_ESP_SYSTEM_USE_FRAME_POINTER option to have a full backtrace.
[1;31mE (110450) task_wdt: Task watchdog got triggered. The following tasks/users did not reset the watchdog in time:[0m
[1;31mE (110450) task_wdt:  - IDLE (CPU 0)[0m
[1;31mE (110450) task_wdt: Tasks currently running:[0m
[1;31mE (110450) task_wdt: CPU 0: lvgl_task[0m
[1;31mE (110450) task_wdt: Print CPU 0 (current core) registers[0m
Core  0 register dump:
MEPC    : 0x42011e78  RA      : 0x42011e4e  SP      : 0x3fcacea0  GP      : 0x3fc8f600  
TP      : 0x3fcacfb0  T0      : 0x00000000  T1      : 0x40000000  T2      : 0x00000000  
S0/FP   : 0x3fc91d70  S1      : 0x3fc92098  A0      : 0x00000001  A1      : 0x00000000  
A2      : 0x3fc92cd4  A3      : 0x00000035  A4      : 0x3fc92c2c  A5      : 0x00000001  
A6      : 0x00000014  A7      : 0x0000000a  S2      : 0x00000000  S3      : 0x3fc920b0  
S4      : 0x00000027  S5      : 0x00000014  S6      : 0x00000000  S7      : 0x00000000  
S8      : 0x00000000  S9      : 0x00000000  S10     : 0x00000000  S11     : 0x00000000  
T3      : 0x00000000  T4      : 0x00000000  T5      : 0x00000000  T6      : 0x00000000  
MSTATUS : 0x00001889  MTVEC   : 0x40380001  MCAUSE  : 0xdeadc0de  MTVAL   : 0xdeadc0de  
MHARTID : 0x00000000  
Please enable CONFIG_ESP_SYSTEM_USE_FRAME_POINTER option to have a full backtrace.
[1;31mE (115450) task_wdt: Task watchdog got triggered. The following tasks/users did not reset the watchdog in time:[0m
[1;31mE (115450) task_wdt:  - IDLE (CPU 0)[0m
[1;31mE (115450) task_wdt: Tasks currently running:[0m
[1;31mE (115450) task_wdt: CPU 0: lvgl_task[0m
[1;31mE (115450) task_wdt: Print CPU 0 (current core) registers[0m
Core  0 register dump:
MEPC    : 0x42011e78  RA      : 0x42011e4e  SP      : 0x3fcacea0  GP      : 0x3fc8f600  
TP      : 0x3fcacfb0  T0      : 0x00000000  T1      : 0x40000000  T2      : 0x00000000  
S0/FP   : 0x3fc91d70  S1      : 0x3fc92098  A0      : 0x00000001  A1      : 0x00000000  
A2      : 0x3fc92cd4  A3      : 0x00000035  A4      : 0x3fc92c2c  A5      : 0x00000001  
A6      : 0x00000014  A7      : 0x0000000a  S2      : 0x00000000  S3      : 0x3fc920b0  
S4      : 0x00000027  S5      : 0x00000014  S6      : 0x00000000  S7      : 0x00000000  
S8      : 0x00000000  S9      : 0x00000000  S10     : 0x00000000  S11     : 0x00000000  
T3      : 0x00000000  T4      : 0x00000000  T5      : 0x00000000  T6      : 0x00000000  
MSTATUS : 0x00001889  MTVEC   : 0x40380001  MCAUSE  : 0xdeadc0de  MTVAL   : 0xdeadc0de  
MHARTID : 0x00000000  
Please enable CONFIG_ESP_SYSTEM_USE_FRAME_POINTER option to have a full backtrace.
[1;31mE (120450) task_wdt: Task watchdog got triggered. The following tasks/users did not reset the watchdog in time:[0m
[1;31mE (120450) task_wdt:  - IDLE (CPU 0)[0m
[1;31mE (120450) task_wdt: Tasks currently running:[0m
[1;31mE (120450) task_wdt: CPU 0: lvgl_task[0m
[1;31mE (120450) task_wdt: Print CPU 0 (current core) registers[0m
Core  0 register dump:
MEPC    : 0x42011e78  RA      : 0x42011e4e  SP      : 0x3fcacea0  GP      : 0x3fc8f600  
TP      : 0x3fcacfb0  T0      : 0x00000000  T1      : 0x40000000  T2      : 0x00000000  
S0/FP   : 0x3fc91d70  S1      : 0x3fc92098  A0      : 0x00000001  A1      : 0x00000000  
A2      : 0x3fc92cd4  A3      : 0x00000035  A4      : 0x3fc92c2c  A5      : 0x00000001  
A6      : 0x00000014  A7      : 0x0000000a  S2      : 0x00000000  S3      : 0x3fc920b0  
S4      : 0x00000027  S5      : 0x00000014  S6      : 0x00000000  S7      : 0x00000000  
S8      : 0x00000000  S9      : 0x00000000  S10     : 0x00000000  S11     : 0x00000000  
T3      : 0x00000000  T4      : 0x00000000  T5      : 0x00000000  T6      : 0x00000000  
MSTATUS : 0x00001889  MTVEC   : 0x40380001  MCAUSE  : 0xdeadc0de  MTVAL   : 0xdeadc0de  
MHARTID : 0x00000000  
Please enable CONFIG_ESP_SYSTEM_USE_FRAME_POINTER option to have a full backtrace.
[1;31mE (125450) task_wdt: Task watchdog got triggered. The following tasks/users did not reset the watchdog in time:[0m
[1;31mE (125450) task_wdt:  - IDLE (CPU 0)[0m
[1;31mE (125450) task_wdt: Tasks currently running:[0m
[1;31mE (125450) task_wdt: CPU 0: lvgl_task[0m
[1;31mE (125450) task_wdt: Print CPU 0 (current core) registers[0m
Core  0 register dump:
MEPC    : 0x42011e78  RA      : 0x42011e4e  SP      : 0x3fcacea0  GP      : 0x3fc8f600  
TP      : 0x3fcacfb0  T0      : 0x00000000  T1      : 0x40000000  T2      : 0x00000000  
S0/FP   : 0x3fc91d70  S1      : 0x3fc92098  A0      : 0x00000001  A1      : 0x00000000  
A2      : 0x3fc92cd4  A3      : 0x00000035  A4      : 0x3fc92c2c  A5      : 0x00000001  
A6      : 0x00000014  A7      : 0x0000000a  S2      : 0x00000000  S3      : 0x3fc920b0  
S4      : 0x00000027  S5      : 0x00000014  S6      : 0x00000000  S7      : 0x00000000  
S8      : 0x00000000  S9      : 0x00000000  S10     : 0x00000000  S11     : 0x00000000  
T3      : 0x00000000  T4      : 0x00000000  T5      : 0x00000000  T6      : 0x00000000  
MSTATUS : 0x00001889  MTVEC   : 0x40380001  MCAUSE  : 0xdeadc0de  MTVAL   : 0xdeadc0de  
MHARTID : 0x00000000  
Please enable CONFIG_ESP_SYSTEM_USE_FRAME_POINTER option to have a full backtrace.
[1;31mE (130450) task_wdt: Task watchdog got triggered. The following tasks/users did not reset the watchdog in time:[0m
[1;31mE (130450) task_wdt:  - IDLE (CPU 0)[0m
[1;31mE (130450) task_wdt: Tasks currently running:[0m
[1;31mE (130450) task_wdt: CPU 0: lvgl_task[0m
[1;31mE (130450) task_wdt: Print CPU 0 (current core) registers[0m
Core  0 register dump:
MEPC    : 0x42011e78  RA      : 0x42011e4e  SP      : 0x3fcacea0  GP      : 0x3fc8f600  
TP      : 0x3fcacfb0  T0      : 0x00000000  T1      : 0x40000000  T2      : 0x00000000  
S0/FP   : 0x3fc91d70  S1      : 0x3fc92098  A0      : 0x00000001  A1      : 0x00000000  
A2      : 0x3fc92cd4  A3      : 0x00000035  A4      : 0x3fc92c2c  A5      : 0x00000001  
A6      : 0x00000014  A7      : 0x0000000a  S2      : 0x00000000  S3      : 0x3fc920b0  
S4      : 0x00000027  S5      : 0x00000014  S6      : 0x00000000  S7      : 0x00000000  
S8      : 0x00000000  S9      : 0x00000000  S10     : 0x00000000  S11     : 0x00000000  
T3      : 0x00000000  T4      : 0x00000000  T5      : 0x00000000  T6      : 0x00000000  
MSTATUS : 0x00001889  MTVEC   : 0x40380001  MCAUSE  : 0xdeadc0de  MTVAL   : 0xdeadc0de  
MHARTID : 0x00000000  
Please enable CONFIG_ESP_SYSTEM_USE_FRAME_POINTER option to have a full backtrace.
[1;31mE (135450) task_wdt: Task watchdog got triggered. The following tasks/users did not reset the watchdog in time:[0m
[1;31mE (135450) task_wdt:  - IDLE (CPU 0)[0m
[1;31mE (135450) task_wdt: Tasks currently running:[0m
[1;31mE (135450) task_wdt: CPU 0: lvgl_task[0m
[1;31mE (135450) task_wdt: Print CPU 0 (current core) registers[0m
Core  0 register dump:
MEPC    : 0x42011e78  RA      : 0x42011e4e  SP      : 0x3fcacea0  GP      : 0x3fc8f600  
TP      : 0x3fcacfb0  T0      : 0x00000000  T1      : 0x40000000  T2      : 0x00000000  
S0/FP   : 0x3fc91d70  S1      : 0x3fc92098  A0      : 0x00000001  A1      : 0x00000000  
A2      : 0x3fc92cd4  A3      : 0x00000035  A4      : 0x3fc92c2c  A5      : 0x00000001  
A6      : 0x00000014  A7      : 0x0000000a  S2      : 0x00000000  S3      : 0x3fc920b0  
S4      : 0x00000027  S5      : 0x00000014  S6      : 0x00000000  S7      : 0x00000000  
S8      : 0x00000000  S9      : 0x00000000  S10     : 0x00000000  S11     : 0x00000000  
T3      : 0x00000000  T4      : 0x00000000  T5      : 0x00000000  T6      : 0x00000000  
MSTATUS : 0x00001889  MTVEC   : 0x40380001  MCAUSE  : 0xdeadc0de  MTVAL   : 0xdeadc0de  
MHARTID : 0x00000000  
Please enable CONFIG_ESP_SYSTEM_USE_FRAME_POINTER option to have a full backtrace.
[1;31mE (140450) task_wdt: Task watchdog got triggered. The following tasks/users did not reset the watchdog in time:[0m
[1;31mE (140450) task_wdt:  - IDLE (CPU 0)[0m
[1;31mE (140450) task_wdt: Tasks currently running:[0m
[1;31mE (140450) task_wdt: CPU 0: lvgl_task[0m
[1;31mE (140450) task_wdt: Print CPU 0 (current core) registers[0m
Core  0 register dump:
MEPC    : 0x42011e78  RA      : 0x42011e4e  SP      : 0x3fcacea0  GP      : 0x3fc8f600  
TP      : 0x3fcacfb0  T0      : 0x00000000  T1      : 0x40000000  T2      : 0x00000000  
S0/FP   : 0x3fc91d70  S1      : 0x3fc92098  A0      : 0x00000001  A1      : 0x00000000  
A2      : 0x3fc92cd4  A3      : 0x00000035  A4      : 0x3fc92c2c  A5      : 0x00000001  
A6      : 0x00000014  A7      : 0x0000000a  S2      : 0x00000000  S3      : 0x3fc920b0  
S4      : 0x00000027  S5      : 0x00000014  S6      : 0x00000000  S7      : 0x00000000  
S8      : 0x00000000  S9      : 0x00000000  S10     : 0x00000000  S11     : 0x00000000  
T3      : 0x00000000  T4      : 0x00000000  T5      : 0x00000000  T6      : 0x00000000  
MSTATUS : 0x00001889  MTVEC   : 0x40380001  MCAUSE  : 0xdeadc0de  MTVAL   : 0xdeadc0de  
MHARTID : 0x00000000  
Please enable CONFIG_ESP_SYSTEM_USE_FRAME_POINTER option to have a full backtrace.
[1;31mE (145450) task_wdt: Task watchdog got triggered. The following tasks/users did not reset the watchdog in time:[0m
[1;31mE (145450) task_wdt:  - IDLE (CPU 0)[0m
[1;31mE (145450) task_wdt: Tasks currently running:[0m
[1;31mE (145450) task_wdt: CPU 0: lvgl_task[0m
[1;31mE (145450) task_wdt: Print CPU 0 (current core) registers[0m
Core  0 register dump:
MEPC    : 0x42011e78  RA      : 0x42011e4e  SP      : 0x3fcacea0  GP      : 0x3fc8f600  
TP      : 0x3fcacfb0  T0      : 0x00000000  T1      : 0x40000000  T2      : 0x00000000  
S0/FP   : 0x3fc91d70  S1      : 0x3fc92098  A0      : 0x00000001  A1      : 0x00000000  
A2      : 0x3fc92cd4  A3      : 0x00000035  A4      : 0x3fc92c2c  A5      : 0x00000001  
A6      : 0x00000014  A7      : 0x0000000a  S2      : 0x00000000  S3      : 0x3fc920b0  
S4      : 0x00000027  S5      : 0x00000014  S6      : 0x00000000  S7      : 0x00000000  
S8      : 0x00000000  S9      : 0x00000000  S10     : 0x00000000  S11     : 0x00000000  
T3      : 0x00000000  T4      : 0x00000000  T5      : 0x00000000  T6      : 0x00000000  
MSTATUS : 0x00001889  MTVEC   : 0x40380001  MCAUSE  : 0xdeadc0de  MTVAL   : 0xdeadc0de  
MHARTID : 0x00000000  
Please enable CONFIG_ESP_SYSTEM_USE_FRAME_POINTER option to have a full backtrace.
[1;31mE (150450) task_wdt: Task watchdog got triggered. The following tasks/users did not reset the watchdog in time:[0m
[1;31mE (150450) task_wdt:  - IDLE (CPU 0)[0m
[1;31mE (150450) task_wdt: Tasks currently running:[0m
[1;31mE (150450) task_wdt: CPU 0: lvgl_task[0m
[1;31mE (150450) task_wdt: Print CPU 0 (current core) registers[0m
Core  0 register dump:
MEPC    : 0x42011e78  RA      : 0x42011e4e  SP      : 0x3fcacea0  GP      : 0x3fc8f600  
TP      : 0x3fcacfb0  T0      : 0x00000000  T1      : 0x40000000  T2      : 0x00000000  
S0/FP   : 0x3fc91d70  S1      : 0x3fc92098  A0      : 0x00000001  A1      : 0x00000000  
A2      : 0x3fc92cd4  A3      : 0x00000035  A4      : 0x3fc92c2c  A5      : 0x00000001  
A6      : 0x00000014  A7      : 0x0000000a  S2      : 0x00000000  S3      : 0x3fc920b0  
S4      : 0x00000027  S5      : 0x00000014  S6      : 0x00000000  S7      : 0x00000000  
S8      : 0x00000000  S9      : 0x00000000  S10     : 0x00000000  S11     : 0x00000000  
T3      : 0x00000000  T4      : 0x00000000  T5      : 0x00000000  T6      : 0x00000000  
MSTATUS : 0x00001889  MTVEC   : 0x40380001  MCAUSE  : 0xdeadc0de  MTVAL   : 0xdeadc0de  
MHARTID : 0x00000000  
Please enable CONFIG_ESP_SYSTEM_USE_FRAME_POINTER option to have a full backtrace.
[1;31mE (155450) task_wdt: Task watchdog got triggered. The following tasks/users did not reset the watchdog in time:[0m
[1;31mE (155450) task_wdt:  - IDLE (CPU 0)[0m
[1;31mE (155450) task_wdt: Tasks currently running:[0m
[1;31mE (155450) task_wdt: CPU 0: lvgl_task[0m
[1;31mE (155450) task_wdt: Print CPU 0 (current core) registers[0m
Core  0 register dump:
MEPC    : 0x42011e78  RA      : 0x42011e4e  SP      : 0x3fcacea0  GP      : 0x3fc8f600  
TP      : 0x3fcacfb0  T0      : 0x00000000  T1      : 0x40000000  T2      : 0x00000000  
S0/FP   : 0x3fc91d70  S1      : 0x3fc92098  A0      : 0x00000001  A1      : 0x00000000  
A2      : 0x3fc92cd4  A3      : 0x00000035  A4      : 0x3fc92c2c  A5      : 0x00000001  
A6      : 0x00000014  A7      : 0x0000000a  S2      : 0x00000000  S3      : 0x3fc920b0  
S4      : 0x00000027  S5      : 0x00000014  S6      : 0x00000000  S7      : 0x00000000  
S8      : 0x00000000  S9      : 0x00000000  S10     : 0x00000000  S11     : 0x00000000  
T3      : 0x00000000  T4      : 0x00000000  T5      : 0x00000000  T6      : 0x00000000  
MSTATUS : 0x00001889  MTVEC   : 0x40380001  MCAUSE  : 0xdeadc0de  MTVAL   : 0xdeadc0de  
MHARTID : 0x00000000  
Please enable CONFIG_ESP_SYSTEM_USE_FRAME_POINTER option to have a full backtrace.
[1;31mE (160450) task_wdt: Task watchdog got triggered. The following tasks/users did not reset the watchdog in time:[0m
[1;31mE (160450) task_wdt:  - IDLE (CPU 0)[0m
[1;31mE (160450) task_wdt: Tasks currently running:[0m
[1;31mE (160450) task_wdt: CPU 0: lvgl_task[0m
[1;31mE (160450) task_wdt: Print CPU 0 (current core) registers[0m
Core  0 register dump:
MEPC    : 0x42011e78  RA      : 0x42011e4e  SP      : 0x3fcacea0  GP      : 0x3fc8f600  
TP      : 0x3fcacfb0  T0      : 0x00000000  T1      : 0x40000000  T2      : 0x00000000  
S0/FP   : 0x3fc91d70  S1      : 0x3fc92098  A0      : 0x00000001  A1      : 0x00000000  
A2      : 0x3fc92cd4  A3      : 0x00000035  A4      : 0x3fc92c2c  A5      : 0x00000001  
A6      : 0x00000014  A7      : 0x0000000a  S2      : 0x00000000  S3      : 0x3fc920b0  
S4      : 0x00000027  S5      : 0x00000014  S6      : 0x00000000  S7      : 0x00000000  
S8      : 0x00000000  S9      : 0x00000000  S10     : 0x00000000  S11     : 0x00000000  
T3      : 0x00000000  T4      : 0x00000000  T5      : 0x00000000  T6      : 0x00000000  
MSTATUS : 0x00001889  MTVEC   : 0x40380001  MCAUSE  : 0xdeadc0de  MTVAL   : 0xdeadc0de  
MHARTID : 0x00000000  
Please enable CONFIG_ESP_SYSTEM_USE_FRAME_POINTER option to have a full backtrace.
[1;31mE (165450) task_wdt: Task watchdog got triggered. The following tasks/users did not reset the watchdog in time:[0m
[1;31mE (165450) task_wdt:  - IDLE (CPU 0)[0m
[1;31mE (165450) task_wdt: Tasks currently running:[0m
[1;31mE (165450) task_wdt: CPU 0: lvgl_task[0m
[1;31mE (165450) task_wdt: Print CPU 0 (current core) registers[0m
Core  0 register dump:
MEPC    : 0x42011e78  RA      : 0x42011e4e  SP      : 0x3fcacea0  GP      : 0x3fc8f600  
TP      : 0x3fcacfb0  T0      : 0x00000000  T1      : 0x40000000  T2      : 0x00000000  
S0/FP   : 0x3fc91d70  S1      : 0x3fc92098  A0      : 0x00000001  A1      : 0x00000000  
A2      : 0x3fc92cd4  A3      : 0x00000035  A4      : 0x3fc92c2c  A5      : 0x00000001  
A6      : 0x00000014  A7      : 0x0000000a  S2      : 0x00000000  S3      : 0x3fc920b0  
S4      : 0x00000027  S5      : 0x00000014  S6      : 0x00000000  S7      : 0x00000000  
S8      : 0x00000000  S9      : 0x00000000  S10     : 0x00000000  S11     : 0x00000000  
T3      : 0x00000000  T4      : 0x00000000  T5      : 0x00000000  T6      : 0x00000000  
MSTATUS : 0x00001889  MTVEC   : 0x40380001  MCAUSE  : 0xdeadc0de  MTVAL   : 0xdeadc0de  
MHARTID : 0x00000000  
Please enable CONFIG_ESP_SYSTEM_USE_FRAME_POINTER option to have a full backtrace.
[1;31mE (170450) task_wdt: Task watchdog got triggered. The following tasks/users did not reset the watchdog in time:[0m
[1;31mE (170450) task_wdt:  - IDLE (CPU 0)[0m
[1;31mE (170450) task_wdt: Tasks currently running:[0m
[1;31mE (170450) task_wdt: CPU 0: lvgl_task[0m
[1;31mE (170450) task_wdt: Print CPU 0 (current core) registers[0m
Core  0 register dump:
MEPC    : 0x42011e78  RA      : 0x42011e4e  SP      : 0x3fcacea0  GP      : 0x3fc8f600  
TP      : 0x3fcacfb0  T0      : 0x00000000  T1      : 0x40000000  T2      : 0x00000000  
S0/FP   : 0x3fc91d70  S1      : 0x3fc92098  A0      : 0x00000001  A1      : 0x00000000  
A2      : 0x3fc92cd4  A3      : 0x00000035  A4      : 0x3fc92c2c  A5      : 0x00000001  
A6      : 0x00000014  A7      : 0x0000000a  S2      : 0x00000000  S3      : 0x3fc920b0  
S4      : 0x00000027  S5      : 0x00000014  S6      : 0x00000000  S7      : 0x00000000  
S8      : 0x00000000  S9      : 0x00000000  S10     : 0x00000000  S11     : 0x00000000  
T3      : 0x00000000  T4      : 0x00000000  T5      : 0x00000000  T6      : 0x00000000  
MSTATUS : 0x00001889  MTVEC   : 0x40380001  MCAUSE  : 0xdeadc0de  MTVAL   : 0xdeadc0de  
MHARTID : 0x00000000  
Please enable CONFIG_ESP_SYSTEM_USE_FRAME_POINTER option to have a full backtrace.
[1;31mE (175450) task_wdt: Task watchdog got triggered. The following tasks/users did not reset the watchdog in time:[0m
[1;31mE (175450) task_wdt:  - IDLE (CPU 0)[0m
[1;31mE (175450) task_wdt: Tasks currently running:[0m
[1;31mE (175450) task_wdt: CPU 0: lvgl_task[0m
[1;31mE (175450) task_wdt: Print CPU 0 (current core) registers[0m
Core  0 register dump:
MEPC    : 0x42011e78  RA      : 0x42011e4e  SP      : 0x3fcacea0  GP      : 0x3fc8f600  
TP      : 0x3fcacfb0  T0      : 0x00000000  T1      : 0x40000000  T2      : 0x00000000  
S0/FP   : 0x3fc91d70  S1      : 0x3fc92098  A0      : 0x00000001  A1      : 0x00000000  
A2      : 0x3fc92cd4  A3      : 0x00000035  A4      : 0x3fc92c2c  A5      : 0x00000001  
A6      : 0x00000014  A7      : 0x0000000a  S2      : 0x00000000  S3      : 0x3fc920b0  
S4      : 0x00000027  S5      : 0x00000014  S6      : 0x00000000  S7      : 0x00000000  
S8      : 0x00000000  S9      : 0x00000000  S10     : 0x00000000  S11     : 0x00000000  
T3      : 0x00000000  T4      : 0x00000000  T5      : 0x00000000  T6      : 0x00000000  
MSTATUS : 0x00001889  MTVEC   : 0x40380001  MCAUSE  : 0xdeadc0de  MTVAL   : 0xdeadc0de  
MHARTID : 0x00000000  
Please enable CONFIG_ESP_SYSTEM_USE_FRAME_POINTER option to have a full backtrace.
[1;31mE (180450) task_wdt: Task watchdog got triggered. The following tasks/users did not reset the watchdog in time:[0m
[1;31mE (180450) task_wdt:  - IDLE (CPU 0)[0m
[1;31mE (180450) task_wdt: Tasks currently running:[0m
[1;31mE (180450) task_wdt: CPU 0: lvgl_task[0m
[1;31mE (180450) task_wdt: Print CPU 0 (current core) registers[0m
Core  0 register dump:
MEPC    : 0x42011e78  RA      : 0x42011e4e  SP      : 0x3fcacea0  GP      : 0x3fc8f600  
TP      : 0x3fcacfb0  T0      : 0x00000000  T1      : 0x40000000  T2      : 0x00000000  
S0/FP   : 0x3fc91d70  S1      : 0x3fc92098  A0      : 0x00000001  A1      : 0x00000000  
A2      : 0x3fc92cd4  A3      : 0x00000035  A4      : 0x3fc92c2c  A5      : 0x00000001  
A6      : 0x00000014  A7      : 0x0000000a  S2      : 0x00000000  S3      : 0x3fc920b0  
S4      : 0x00000027  S5      : 0x00000014  S6      : 0x00000000  S7      : 0x00000000  
S8      : 0x00000000  S9      : 0x00000000  S10     : 0x00000000  S11     : 0x00000000  
T3      : 0x00000000  T4      : 0x00000000  T5      : 0x00000000  T6      : 0x00000000  
MSTATUS : 0x00001889  MTVEC   : 0x40380001  MCAUSE  : 0xdeadc0de  MTVAL   : 0xdeadc0de  
MHARTID : 0x00000000  
Please enable CONFIG_ESP_SYSTEM_USE_FRAME_POINTER option to have a full backtrace.
[1;31mE (185450) task_wdt: Task watchdog got triggered. The following tasks/users did not reset the watchdog in time:[0m
[1;31mE (185450) task_wdt:  - IDLE (CPU 0)[0m
[1;31mE (185450) task_wdt: Tasks currently running:[0m
[1;31mE (185450) task_wdt: CPU 0: lvgl_task[0m
[1;31mE (185450) task_wdt: Print CPU 0 (current core) registers[0m
Core  0 register dump:
MEPC    : 0x42011e78  RA      : 0x42011e4e  SP      : 0x3fcacea0  GP      : 0x3fc8f600  
TP      : 0x3fcacfb0  T0      : 0x00000000  T1      : 0x40000000  T2      : 0x00000000  
S0/FP   : 0x3fc91d70  S1      : 0x3fc92098  A0      : 0x00000001  A1      : 0x00000000  
A2      : 0x3fc92cd4  A3      : 0x00000035  A4      : 0x3fc92c2c  A5      : 0x00000001  
A6      : 0x00000014  A7      : 0x0000000a  S2      : 0x00000000  S3      : 0x3fc920b0  
S4      : 0x00000027  S5      : 0x00000014  S6      : 0x00000000  S7      : 0x00000000  
S8      : 0x00000000  S9      : 0x00000000  S10     : 0x00000000  S11     : 0x00000000  
T3      : 0x00000000  T4      : 0x00000000  T5      : 0x00000000  T6      : 0x00000000  
MSTATUS : 0x00001889  MTVEC   : 0x40380001  MCAUSE  : 0xdeadc0de  MTVAL   : 0xdeadc0de  
MHARTID : 0x00000000  
Please enable CONFIG_ESP_SYSTEM_USE_FRAME_POINTER option to have a full backtrace.
[1;31mE (190450) task_wdt: Task watchdog got triggered. The following tasks/users did not reset the watchdog in time:[0m
[1;31mE (190450) task_wdt:  - IDLE (CPU 0)[0m
[1;31mE (190450) task_wdt: Tasks currently running:[0m
[1;31mE (190450) task_wdt: CPU 0: lvgl_task[0m
[1;31mE (190450) task_wdt: Print CPU 0 (current core) registers[0m
Core  0 register dump:
MEPC    : 0x42011e78  RA      : 0x42011e4e  SP      : 0x3fcacea0  GP      : 0x3fc8f600  
TP      : 0x3fcacfb0  T0      : 0x00000000  T1      : 0x40000000  T2      : 0x00000000  
S0/FP   : 0x3fc91d70  S1      : 0x3fc92098  A0      : 0x00000001  A1      : 0x00000000  
A2      : 0x3fc92cd4  A3      : 0x00000035  A4      : 0x3fc92c2c  A5      : 0x00000001  
A6      : 0x00000014  A7      : 0x0000000a  S2      : 0x00000000  S3      : 0x3fc920b0  
S4      : 0x00000027  S5      : 0x00000014  S6      : 0x00000000  S7      : 0x00000000  
S8      : 0x00000000  S9      : 0x00000000  S10     : 0x00000000  S11     : 0x00000000  
T3      : 0x00000000  T4      : 0x00000000  T5      : 0x00000000  T6      : 0x00000000  
MSTATUS : 0x00001889  MTVEC   : 0x40380001  MCAUSE  : 0xdeadc0de  MTVAL   : 0xdeadc0de  
MHARTID : 0x00000000  
Please enable CONFIG_ESP_SYSTEM_USE_FRAME_POINTER option to have a full backtrace.
[1;31mE (195450) task_wdt: Task watchdog got triggered. The following tasks/users did not reset the watchdog in time:[0m
[1;31mE (195450) task_wdt:  - IDLE (CPU 0)[0m
[1;31mE (195450) task_wdt: Tasks currently running:[0m
[1;31mE (195450) task_wdt: CPU 0: lvgl_task[0m
[1;31mE (195450) task_wdt: Print CPU 0 (current core) registers[0m
Core  0 register dump:
MEPC    : 0x42011e78  RA      : 0x42011e4e  SP      : 0x3fcacea0  GP      : 0x3fc8f600  
TP      : 0x3fcacfb0  T0      : 0x00000000  T1      : 0x40000000  T2      : 0x00000000  
S0/FP   : 0x3fc91d70  S1      : 0x3fc92098  A0      : 0x00000001  A1      : 0x00000000  
A2      : 0x3fc92cd4  A3      : 0x00000035  A4      : 0x3fc92c2c  A5      : 0x00000001  
A6      : 0x00000014  A7      : 0x0000000a  S2      : 0x00000000  S3      : 0x3fc920b0  
S4      : 0x00000027  S5      : 0x00000014  S6      : 0x00000000  S7      : 0x00000000  
S8      : 0x00000000  S9      : 0x00000000  S10     : 0x00000000  S11     : 0x00000000  
T3      : 0x00000000  T4      : 0x00000000  T5      : 0x00000000  T6      : 0x00000000  
MSTATUS : 0x00001889  MTVEC   : 0x40380001  MCAUSE  : 0xdeadc0de  MTVAL   : 0xdeadc0de  
MHARTID : 0x00000000  
Please enable CONFIG_ESP_SYSTEM_USE_FRAME_POINTER option to have a full backtrace.
[1;31mE (200450) task_wdt: Task watchdog got triggered. The following tasks/users did not reset the watchdog in time:[0m
[1;31mE (200450) task_wdt:  - IDLE (CPU 0)[0m
[1;31mE (200450) task_wdt: Tasks currently running:[0m
[1;31mE (200450) task_wdt: CPU 0: lvgl_task[0m
[1;31mE (200450) task_wdt: Print CPU 0 (current core) registers[0m
Core  0 register dump:
MEPC    : 0x42011e78  RA      : 0x42011e4e  SP      : 0x3fcacea0  GP      : 0x3fc8f600  
TP      : 0x3fcacfb0  T0      : 0x00000000  T1      : 0x40000000  T2      : 0x00000000  
S0/FP   : 0x3fc91d70  S1      : 0x3fc92098  A0      : 0x00000001  A1      : 0x00000000  
A2      : 0x3fc92cd4  A3      : 0x00000035  A4      : 0x3fc92c2c  A5      : 0x00000001  
A6      : 0x00000014  A7      : 0x0000000a  S2      : 0x00000000  S3      : 0x3fc920b0  
S4      : 0x00000027  S5      : 0x00000014  S6      : 0x00000000  S7      : 0x00000000  
S8      : 0x00000000  S9      : 0x00000000  S10     : 0x00000000  S11     : 0x00000000  
T3      : 0x00000000  T4      : 0x00000000  T5      : 0x00000000  T6      : 0x00000000  
MSTATUS : 0x00001889  MTVEC   : 0x40380001  MCAUSE  : 0xdeadc0de  MTVAL   : 0xdeadc0de  
MHARTID : 0x00000000  
Please enable CONFIG_ESP_SYSTEM_USE_FRAME_POINTER option to have a full backtrace.
[1;31mE (205450) task_wdt: Task watchdog got triggered. The following tasks/users did not reset the watchdog in time:[0m
[1;31mE (205450) task_wdt:  - IDLE (CPU 0)[0m
[1;31mE (205450) task_wdt: Tasks currently running:[0m
[1;31mE (205450) task_wdt: CPU 0: lvgl_task[0m
[1;31mE (205450) task_wdt: Print CPU 0 (current core) registers[0m
Core  0 register dump:
MEPC    : 0x42011e78  RA      : 0x42011e4e  SP      : 0x3fcacea0  GP      : 0x3fc8f600  
TP      : 0x3fcacfb0  T0      : 0x00000000  T1      : 0x40000000  T2      : 0x00000000  
S0/FP   : 0x3fc91d70  S1      : 0x3fc92098  A0      : 0x00000001  A1      : 0x00000000  
A2      : 0x3fc92cd4  A3      : 0x00000035  A4      : 0x3fc92c2c  A5      : 0x00000001  
A6      : 0x00000014  A7      : 0x0000000a  S2      : 0x00000000  S3      : 0x3fc920b0  
S4      : 0x00000027  S5      : 0x00000014  S6      : 0x00000000  S7      : 0x00000000  
S8      : 0x00000000  S9      : 0x00000000  S10     : 0x00000000  S11     : 0x00000000  
T3      : 0x00000000  T4      : 0x00000000  T5      : 0x00000000  T6      : 0x00000000  
MSTATUS : 0x00001889  MTVEC   : 0x40380001  MCAUSE  : 0xdeadc0de  MTVAL   : 0xdeadc0de  
MHARTID : 0x00000000  
Please enable CONFIG_ESP_SYSTEM_USE_FRAME_POINTER option to have a full backtrace.
[1;31mE (210450) task_wdt: Task watchdog got triggered. The following tasks/users did not reset the watchdog in time:[0m
[1;31mE (210450) task_wdt:  - IDLE (CPU 0)[0m
[1;31mE (210450) task_wdt: Tasks currently running:[0m
[1;31mE (210450) task_wdt: CPU 0: lvgl_task[0m
[1;31mE (210450) task_wdt: Print CPU 0 (current core) registers[0m
Core  0 register dump:
MEPC    : 0x42011e78  RA      : 0x42011e4e  SP      : 0x3fcacea0  GP      : 0x3fc8f600  
TP      : 0x3fcacfb0  T0      : 0x00000000  T1      : 0x40000000  T2      : 0x00000000  
S0/FP   : 0x3fc91d70  S1      : 0x3fc92098  A0      : 0x00000001  A1      : 0x00000000  
A2      : 0x3fc92cd4  A3      : 0x00000035  A4      : 0x3fc92c2c  A5      : 0x00000001  
A6      : 0x00000014  A7      : 0x0000000a  S2      : 0x00000000  S3      : 0x3fc920b0  
S4      : 0x00000027  S5      : 0x00000014  S6      : 0x00000000  S7      : 0x00000000  
S8      : 0x00000000  S9      : 0x00000000  S10     : 0x00000000  S11     : 0x00000000  
T3      : 0x00000000  T4      : 0x00000000  T5      : 0x00000000  T6      : 0x00000000  
MSTATUS : 0x00001889  MTVEC   : 0x40380001  MCAUSE  : 0xdeadc0de  MTVAL   : 0xdeadc0de  
MHARTID : 0x00000000  
Please enable CONFIG_ESP_SYSTEM_USE_FRAME_POINTER option to have a full backtrace.
[1;31mE (215450) task_wdt: Task watchdog got triggered. The following tasks/users did not reset the watchdog in time:[0m
[1;31mE (215450) task_wdt:  - IDLE (CPU 0)[0m
[1;31mE (215450) task_wdt: Tasks currently running:[0m
[1;31mE (215450) task_wdt: CPU 0: lvgl_task[0m
[1;31mE (215450) task_wdt: Print CPU 0 (current core) registers[0m
Core  0 register dump:
MEPC    : 0x42011e78  RA      : 0x42011e4e  SP      : 0x3fcacea0  GP      : 0x3fc8f600  
TP      : 0x3fcacfb0  T0      : 0x00000000  T1      : 0x40000000  T2      : 0x00000000  
S0/FP   : 0x3fc91d70  S1      : 0x3fc92098  A0      : 0x00000001  A1      : 0x00000000  
A2      : 0x3fc92cd4  A3      : 0x00000035  A4      : 0x3fc92c2c  A5      : 0x00000001  
A6      : 0x00000014  A7      : 0x0000000a  S2      : 0x00000000  S3      : 0x3fc920b0  
S4      : 0x00000027  S5      : 0x00000014  S6      : 0x00000000  S7      : 0x00000000  
S8      : 0x00000000  S9      : 0x00000000  S10     : 0x00000000  S11     : 0x00000000  
T3      : 0x00000000  T4      : 0x00000000  T5      : 0x00000000  T6      : 0x00000000  
MSTATUS : 0x00001889  MTVEC   : 0x40380001  MCAUSE  : 0xdeadc0de  MTVAL   : 0xdeadc0de  
MHARTID : 0x00000000  
Please enable CONFIG_ESP_SYSTEM_USE_FRAME_POINTER option to have a full backtrace.
[1;31mE (220450) task_wdt: Task watchdog got triggered. The following tasks/users did not reset the watchdog in time:[0m
[1;31mE (220450) task_wdt:  - IDLE (CPU 0)[0m
[1;31mE (220450) task_wdt: Tasks currently running:[0m
[1;31mE (220450) task_wdt: CPU 0: lvgl_task[0m
[1;31mE (220450) task_wdt: Print CPU 0 (current core) registers[0m
Core  0 register dump:
MEPC    : 0x42011e78  RA      : 0x42011e4e  SP      : 0x3fcacea0  GP      : 0x3fc8f600  
TP      : 0x3fcacfb0  T0      : 0x00000000  T1      : 0x40000000  T2      : 0x00000000  
S0/FP   : 0x3fc91d70  S1      : 0x3fc92098  A0      : 0x00000001  A1      : 0x00000000  
A2      : 0x3fc92cd4  A3      : 0x00000035  A4      : 0x3fc92c2c  A5      : 0x00000001  
A6      : 0x00000014  A7      : 0x0000000a  S2      : 0x00000000  S3      : 0x3fc920b0  
S4      : 0x00000027  S5      : 0x00000014  S6      : 0x00000000  S7      : 0x00000000  
S8      : 0x00000000  S9      : 0x00000000  S10     : 0x00000000  S11     : 0x00000000  
T3      : 0x00000000  T4      : 0x00000000  T5      : 0x00000000  T6      : 0x00000000  
MSTATUS : 0x00001889  MTVEC   : 0x40380001  MCAUSE  : 0xdeadc0de  MTVAL   : 0xdeadc0de  
MHARTID : 0x00000000  
Please enable CONFIG_ESP_SYSTEM_USE_FRAME_POINTER option to have a full backtrace.
[1;31mE (225450) task_wdt: Task watchdog got triggered. The following tasks/users did not reset the watchdog in time:[0m
[1;31mE (225450) task_wdt:  - IDLE (CPU 0)[0m
[1;31mE (225450) task_wdt: Tasks currently running:[0m
[1;31mE (225450) task_wdt: CPU 0: lvgl_task[0m
[1;31mE (225450) task_wdt: Print CPU 0 (current core) registers[0m
Core  0 register dump:
MEPC    : 0x42011e78  RA      : 0x42011e4e  SP      : 0x3fcacea0  GP      : 0x3fc8f600  
TP      : 0x3fcacfb0  T0      : 0x00000000  T1      : 0x40000000  T2      : 0x00000000  
S0/FP   : 0x3fc91d70  S1      : 0x3fc92098  A0      : 0x00000001  A1      : 0x00000000  
A2      : 0x3fc92cd4  A3      : 0x00000035  A4      : 0x3fc92c2c  A5      : 0x00000001  
A6      : 0x00000014  A7      : 0x0000000a  S2      : 0x00000000  S3      : 0x3fc920b0  
S4      : 0x00000027  S5      : 0x00000014  S6      : 0x00000000  S7      : 0x00000000  
S8      : 0x00000000  S9      : 0x00000000  S10     : 0x00000000  S11     : 0x00000000  
T3      : 0x00000000  T4      : 0x00000000  T5      : 0x00000000  T6      : 0x00000000  
MSTATUS : 0x00001889  MTVEC   : 0x40380001  MCAUSE  : 0xdeadc0de  MTVAL   : 0xdeadc0de  
MHARTID : 0x00000000  
Please enable CONFIG_ESP_SYSTEM_USE_FRAME_POINTER option to have a full backtrace.
[1;31mE (230450) task_wdt: Task watchdog got triggered. The following tasks/users did not reset the watchdog in time:[0m
[1;31mE (230450) task_wdt:  - IDLE (CPU 0)[0m
[1;31mE (230450) task_wdt: Tasks currently running:[0m
[1;31mE (230450) task_wdt: CPU 0: lvgl_task[0m
[1;31mE (230450) task_wdt: Print CPU 0 (current core) registers[0m
Core  0 register dump:
MEPC    : 0x42011e78  RA      : 0x42011e4e  SP      : 0x3fcacea0  GP      : 0x3fc8f600  
TP      : 0x3fcacfb0  T0      : 0x00000000  T1      : 0x40000000  T2      : 0x00000000  
S0/FP   : 0x3fc91d70  S1      : 0x3fc92098  A0      : 0x00000001  A1      : 0x00000000  
A2      : 0x3fc92cd4  A3      : 0x00000035  A4      : 0x3fc92c2c  A5      : 0x00000001  
A6      : 0x00000014  A7      : 0x0000000a  S2      : 0x00000000  S3      : 0x3fc920b0  
S4      : 0x00000027  S5      : 0x00000014  S6      : 0x00000000  S7      : 0x00000000  
S8      : 0x00000000  S9      : 0x00000000  S10     : 0x00000000  S11     : 0x00000000  
T3      : 0x00000000  T4      : 0x00000000  T5      : 0x00000000  T6      : 0x00000000  
MSTATUS : 0x00001889  MTVEC   : 0x40380001  MCAUSE  : 0xdeadc0de  MTVAL   : 0xdeadc0de  
MHARTID : 0x00000000  
Please enable CONFIG_ESP_SYSTEM_USE_FRAME_POINTER option to have a full backtrace.
[1;31mE (235450) task_wdt: Task watchdog got triggered. The following tasks/users did not reset the watchdog in time:[0m
[1;31mE (235450) task_wdt:  - IDLE (CPU 0)[0m
[1;31mE (235450) task_wdt: Tasks currently running:[0m
[1;31mE (235450) task_wdt: CPU 0: lvgl_task[0m
[1;31mE (235450) task_wdt: Print CPU 0 (current core) registers[0m
Core  0 register dump:
MEPC    : 0x42011e78  RA      : 0x42011e4e  SP      : 0x3fcacea0  GP      : 0x3fc8f600  
TP      : 0x3fcacfb0  T0      : 0x00000000  T1      : 0x40000000  T2      : 0x00000000  
S0/FP   : 0x3fc91d70  S1      : 0x3fc92098  A0      : 0x00000001  A1      : 0x00000000  
A2      : 0x3fc92cd4  A3      : 0x00000035  A4      : 0x3fc92c2c  A5      : 0x00000001  
A6      : 0x00000014  A7      : 0x0000000a  S2      : 0x00000000  S3      : 0x3fc920b0  
S4      : 0x00000027  S5      : 0x00000014  S6      : 0x00000000  S7      : 0x00000000  
S8      : 0x00000000  S9      : 0x00000000  S10     : 0x00000000  S11     : 0x00000000  
T3      : 0x00000000  T4      : 0x00000000  T5      : 0x00000000  T6      : 0x00000000  
MSTATUS : 0x00001889  MTVEC   : 0x40380001  MCAUSE  : 0xdeadc0de  MTVAL   : 0xdeadc0de  
MHARTID : 0x00000000  
Please enable CONFIG_ESP_SYSTEM_USE_FRAME_POINTER option to have a full backtrace.
[1;31mE (240450) task_wdt: Task watchdog got triggered. The following tasks/users did not reset the watchdog in time:[0m
[1;31mE (240450) task_wdt:  - IDLE (CPU 0)[0m
[1;31mE (240450) task_wdt: Tasks currently running:[0m
[1;31mE (240450) task_wdt: CPU 0: lvgl_task[0m
[1;31mE (240450) task_wdt: Print CPU 0 (current core) registers[0m
Core  0 register dump:
MEPC    : 0x42011e78  RA      : 0x42011e4e  SP      : 0x3fcacea0  GP      : 0x3fc8f600  
TP      : 0x3fcacfb0  T0      : 0x00000000  T1      : 0x40000000  T2      : 0x00000000  
S0/FP   : 0x3fc91d70  S1      : 0x3fc92098  A0      : 0x00000001  A1      : 0x00000000  
A2      : 0x3fc92cd4  A3      : 0x00000035  A4      : 0x3fc92c2c  A5      : 0x00000001  
A6      : 0x00000014  A7      : 0x0000000a  S2      : 0x00000000  S3      : 0x3fc920b0  
S4      : 0x00000027  S5      : 0x00000014  S6      : 0x00000000  S7      : 0x00000000  
S8      : 0x00000000  S9      : 0x00000000  S10     : 0x00000000  S11     : 0x00000000  
T3      : 0x00000000  T4      : 0x00000000  T5      : 0x00000000  T6      : 0x00000000  
MSTATUS : 0x00001889  MTVEC   : 0x40380001  MCAUSE  : 0xdeadc0de  MTVAL   : 0xdeadc0de  
MHARTID : 0x00000000  
Please enable CONFIG_ESP_SYSTEM_USE_FRAME_POINTER option to have a full backtrace.
[1;31mE (245450) task_wdt: Task watchdog got triggered. The following tasks/users did not reset the watchdog in time:[0m
[1;31mE (245450) task_wdt:  - IDLE (CPU 0)[0m
[1;31mE (245450) task_wdt: Tasks currently running:[0m
[1;31mE (245450) task_wdt: CPU 0: lvgl_task[0m
[1;31mE (245450) task_wdt: Print CPU 0 (current core) registers[0m
Core  0 register dump:
MEPC    : 0x42011e78  RA      : 0x42011e4e  SP      : 0x3fcacea0  GP      : 0x3fc8f600  
TP      : 0x3fcacfb0  T0      : 0x00000000  T1      : 0x40000000  T2      : 0x00000000  
S0/FP   : 0x3fc91d70  S1      : 0x3fc92098  A0      : 0x00000001  A1      : 0x00000000  
A2      : 0x3fc92cd4  A3      : 0x00000035  A4      : 0x3fc92c2c  A5      : 0x00000001  
A6      : 0x00000014  A7      : 0x0000000a  S2      : 0x00000000  S3      : 0x3fc920b0  
S4      : 0x00000027  S5      : 0x00000014  S6      : 0x00000000  S7      : 0x00000000  
S8      : 0x00000000  S9      : 0x00000000  S10     : 0x00000000  S11     : 0x00000000  
T3      : 0x00000000  T4      : 0x00000000  T5      : 0x00000000  T6      : 0x00000000  
MSTATUS : 0x00001889  MTVEC   : 0x40380001  MCAUSE  : 0xdeadc0de  MTVAL   : 0xdeadc0de  
MHARTID : 0x00000000  
Please enable CONFIG_ESP_SYSTEM_USE_FRAME_POINTER option to have a full backtrace.
[1;31mE (250450) task_wdt: Task watchdog got triggered. The following tasks/users did not reset the watchdog in time:[0m
[1;31mE (250450) task_wdt:  - IDLE (CPU 0)[0m
[1;31mE (250450) task_wdt: Tasks currently running:[0m
[1;31mE (250450) task_wdt: CPU 0: lvgl_task[0m
[1;31mE (250450) task_wdt: Print CPU 0 (current core) registers[0m
Core  0 register dump:
MEPC    : 0x42011e78  RA      : 0x42011e4e  SP      : 0x3fcacea0  GP      : 0x3fc8f600  
TP      : 0x3fcacfb0  T0      : 0x00000000  T1      : 0x40000000  T2      : 0x00000000  
S0/FP   : 0x3fc91d70  S1      : 0x3fc92098  A0      : 0x00000001  A1      : 0x00000000  
A2      : 0x3fc92cd4  A3      : 0x00000035  A4      : 0x3fc92c2c  A5      : 0x00000001  
A6      : 0x00000014  A7      : 0x0000000a  S2      : 0x00000000  S3      : 0x3fc920b0  
S4      : 0x00000027  S5      : 0x00000014  S6      : 0x00000000  S7      : 0x00000000  
S8      : 0x00000000  S9      : 0x00000000  S10     : 0x00000000  S11     : 0x00000000  
T3      : 0x00000000  T4      : 0x00000000  T5      : 0x00000000  T6      : 0x00000000  
MSTATUS : 0x00001889  MTVEC   : 0x40380001  MCAUSE  : 0xdeadc0de  MTVAL   : 0xdeadc0de  
MHARTID : 0x00000000  
Please enable CONFIG_ESP_SYSTEM_USE_FRAME_POINTER option to have a full backtrace.
[1;31mE (255450) task_wdt: Task watchdog got triggered. The following tasks/users did not reset the watchdog in time:[0m
[1;31mE (255450) task_wdt:  - IDLE (CPU 0)[0m
[1;31mE (255450) task_wdt: Tasks currently running:[0m
[1;31mE (255450) task_wdt: CPU 0: lvgl_task[0m
[1;31mE (255450) task_wdt: Print CPU 0 (current core) registers[0m
Core  0 register dump:
MEPC    : 0x42011e78  RA      : 0x42011e4e  SP      : 0x3fcacea0  GP      : 0x3fc8f600  
TP      : 0x3fcacfb0  T0      : 0x00000000  T1      : 0x40000000  T2      : 0x00000000  
S0/FP   : 0x3fc91d70  S1      : 0x3fc92098  A0      : 0x00000001  A1      : 0x00000000  
A2      : 0x3fc92cd4  A3      : 0x00000035  A4      : 0x3fc92c2c  A5      : 0x00000001  
A6      : 0x00000014  A7      : 0x0000000a  S2      : 0x00000000  S3      : 0x3fc920b0  
S4      : 0x00000027  S5      : 0x00000014  S6      : 0x00000000  S7      : 0x00000000  
S8      : 0x00000000  S9      : 0x00000000  S10     : 0x00000000  S11     : 0x00000000  
T3      : 0x00000000  T4      : 0x00000000  T5      : 0x00000000  T6      : 0x00000000  
MSTATUS : 0x00001889  MTVEC   : 0x40380001  MCAUSE  : 0xdeadc0de  MTVAL   : 0xdeadc0de  
MHARTID : 0x00000000  
Please enable CONFIG_ESP_SYSTEM_USE_FRAME_POINTER option to have a full backtrace.
[1;31mE (260450) task_wdt: Task watchdog got triggered. The following tasks/users did not reset the watchdog in time:[0m
[1;31mE (260450) task_wdt:  - IDLE (CPU 0)[0m
[1;31mE (260450) task_wdt: Tasks currently running:[0m
[1;31mE (260450) task_wdt: CPU 0: lvgl_task[0m
[1;31mE (260450) task_wdt: Print CPU 0 (current core) registers[0m
Core  0 register dump:
MEPC    : 0x42011e78  RA      : 0x42011e4e  SP      : 0x3fcacea0  GP      : 0x3fc8f600  
TP      : 0x3fcacfb0  T0      : 0x00000000  T1      : 0x40000000  T2      : 0x00000000  
S0/FP   : 0x3fc91d70  S1      : 0x3fc92098  A0      : 0x00000001  A1      : 0x00000000  
A2      : 0x3fc92cd4  A3      : 0x00000035  A4      : 0x3fc92c2c  A5      : 0x00000001  
A6      : 0x00000014  A7      : 0x0000000a  S2      : 0x00000000  S3      : 0x3fc920b0  
S4      : 0x00000027  S5      : 0x00000014  S6      : 0x00000000  S7      : 0x00000000  
S8      : 0x00000000  S9      : 0x00000000  S10     : 0x00000000  S11     : 0x00000000  
T3      : 0x00000000  T4      : 0x00000000  T5      : 0x00000000  T6      : 0x00000000  
MSTATUS : 0x00001889  MTVEC   : 0x40380001  MCAUSE  : 0xdeadc0de  MTVAL   : 0xdeadc0de  
MHARTID : 0x00000000  
Please enable CONFIG_ESP_SYSTEM_USE_FRAME_POINTER option to have a full backtrace.
[1;31mE (265450) task_wdt: Task watchdog got triggered. The following tasks/users did not reset the watchdog in time:[0m
[1;31mE (265450) task_wdt:  - IDLE (CPU 0)[0m
[1;31mE (265450) task_wdt: Tasks currently running:[0m
[1;31mE (265450) task_wdt: CPU 0: lvgl_task[0m
[1;31mE (265450) task_wdt: Print CPU 0 (current core) registers[0m
Core  0 register dump:
MEPC    : 0x42011e78  RA      : 0x42011e4e  SP      : 0x3fcacea0  GP      : 0x3fc8f600  
TP      : 0x3fcacfb0  T0      : 0x00000000  T1      : 0x40000000  T2      : 0x00000000  
S0/FP   : 0x3fc91d70  S1      : 0x3fc92098  A0      : 0x00000001  A1      : 0x00000000  
A2      : 0x3fc92cd4  A3      : 0x00000035  A4      : 0x3fc92c2c  A5      : 0x00000001  
A6      : 0x00000014  A7      : 0x0000000a  S2      : 0x00000000  S3      : 0x3fc920b0  
S4      : 0x00000027  S5      : 0x00000014  S6      : 0x00000000  S7      : 0x00000000  
S8      : 0x00000000  S9      : 0x00000000  S10     : 0x00000000  S11     : 0x00000000  
T3      : 0x00000000  T4      : 0x00000000  T5      : 0x00000000  T6      : 0x00000000  
MSTATUS : 0x00001889  MTVEC   : 0x40380001  MCAUSE  : 0xdeadc0de  MTVAL   : 0xdeadc0de  
MHARTID : 0x00000000  
Please enable CONFIG_ESP_SYSTEM_USE_FRAME_POINTER option to have a full backtrace.
[1;31mE (270450) task_wdt: Task watchdog got triggered. The following tasks/users did not reset the watchdog in time:[0m
[1;31mE (270450) task_wdt:  - IDLE (CPU 0)[0m
[1;31mE (270450) task_wdt: Tasks currently running:[0m
[1;31mE (270450) task_wdt: CPU 0: lvgl_task[0m
[1;31mE (270450) task_wdt: Print CPU 0 (current core) registers[0m
Core  0 register dump:
MEPC    : 0x42011e78  RA      : 0x42011e4e  SP      : 0x3fcacea0  GP      : 0x3fc8f600  
TP      : 0x3fcacfb0  T0      : 0x00000000  T1      : 0x40000000  T2      : 0x00000000  
S0/FP   : 0x3fc91d70  S1      : 0x3fc92098  A0      : 0x00000001  A1      : 0x00000000  
A2      : 0x3fc92cd4  A3      : 0x00000035  A4      : 0x3fc92c2c  A5      : 0x00000001  
A6      : 0x00000014  A7      : 0x0000000a  S2      : 0x00000000  S3      : 0x3fc920b0  
S4      : 0x00000027  S5      : 0x00000014  S6      : 0x00000000  S7      : 0x00000000  
S8      : 0x00000000  S9      : 0x00000000  S10     : 0x00000000  S11     : 0x00000000  
T3      : 0x00000000  T4      : 0x00000000  T5      : 0x00000000  T6      : 0x00000000  
MSTATUS : 0x00001889  MTVEC   : 0x40380001  MCAUSE  : 0xdeadc0de  MTVAL   : 0xdeadc0de  
MHARTID : 0x00000000  
Please enable CONFIG_ESP_SYSTEM_USE_FRAME_POINTER option to have a full backtrace.
[1;31mE (275450) task_wdt: Task watchdog got triggered. The following tasks/users did not reset the watchdog in time:[0m
[1;31mE (275450) task_wdt:  - IDLE (CPU 0)[0m
[1;31mE (275450) task_wdt: Tasks currently running:[0m
[1;31mE (275450) task_wdt: CPU 0: lvgl_task[0m
[1;31mE (275450) task_wdt: Print CPU 0 (current core) registers[0m
Core  0 register dump:
MEPC    : 0x42011e78  RA      : 0x42011e4e  SP      : 0x3fcacea0  GP      : 0x3fc8f600  
TP      : 0x3fcacfb0  T0      : 0x00000000  T1      : 0x40000000  T2      : 0x00000000  
S0/FP   : 0x3fc91d70  S1      : 0x3fc92098  A0      : 0x00000001  A1      : 0x00000000  
A2      : 0x3fc92cd4  A3      : 0x00000035  A4      : 0x3fc92c2c  A5      : 0x00000001  
A6      : 0x00000014  A7      : 0x0000000a  S2      : 0x00000000  S3      : 0x3fc920b0  
S4      : 0x00000027  S5      : 0x00000014  S6      : 0x00000000  S7      : 0x00000000  
S8      : 0x00000000  S9      : 0x00000000  S10     : 0x00000000  S11     : 0x00000000  
T3      : 0x00000000  T4      : 0x00000000  T5      : 0x00000000  T6      : 0x00000000  
MSTATUS : 0x00001889  MTVEC   : 0x40380001  MCAUSE  : 0xdeadc0de  MTVAL   : 0xdeadc0de  
MHARTID : 0x00000000  
Please enable CONFIG_ESP_SYSTEM_USE_FRAME_POINTER option to have a full backtrace.
[1;31mE (280450) task_wdt: Task watchdog got triggered. The following tasks/users did not reset the watchdog in time:[0m
[1;31mE (280450) task_wdt:  - IDLE (CPU 0)[0m
[1;31mE (280450) task_wdt: Tasks currently running:[0m
[1;31mE (280450) task_wdt: CPU 0: lvgl_task[0m
[1;31mE (280450) task_wdt: Print CPU 0 (current core) registers[0m
Core  0 register dump:
MEPC    : 0x42011e78  RA      : 0x42011e4e  SP      : 0x3fcacea0  GP      : 0x3fc8f600  
TP      : 0x3fcacfb0  T0      : 0x00000000  T1      : 0x40000000  T2      : 0x00000000  
S0/FP   : 0x3fc91d70  S1      : 0x3fc92098  A0      : 0x00000001  A1      : 0x00000000  
A2      : 0x3fc92cd4  A3      : 0x00000035  A4      : 0x3fc92c2c  A5      : 0x00000001  
A6      : 0x00000014  A7      : 0x0000000a  S2      : 0x00000000  S3      : 0x3fc920b0  
S4      : 0x00000027  S5      : 0x00000014  S6      : 0x00000000  S7      : 0x00000000  
S8      : 0x00000000  S9      : 0x00000000  S10     : 0x00000000  S11     : 0x00000000  
T3      : 0x00000000  T4      : 0x00000000  T5      : 0x00000000  T6      : 0x00000000  
MSTATUS : 0x00001889  MTVEC   : 0x40380001  MCAUSE  : 0xdeadc0de  MTVAL   : 0xdeadc0de  
MHARTID : 0x00000000  
Please enable CONFIG_ESP_SYSTEM_USE_FRAME_POINTER option to have a full backtrace.
[1;31mE (285450) task_wdt: Task watchdog got triggered. The following tasks/users did not reset the watchdog in time:[0m
[1;31mE (285450) task_wdt:  - IDLE (CPU 0)[0m
[1;31mE (285450) task_wdt: Tasks currently running:[0m
[1;31mE (285450) task_wdt: CPU 0: lvgl_task[0m
[1;31mE (285450) task_wdt: Print CPU 0 (current core) registers[0m
Core  0 register dump:
MEPC    : 0x42011e78  RA      : 0x42011e4e  SP      : 0x3fcacea0  GP      : 0x3fc8f600  
TP      : 0x3fcacfb0  T0      : 0x00000000  T1      : 0x40000000  T2      : 0x00000000  
S0/FP   : 0x3fc91d70  S1      : 0x3fc92098  A0      : 0x00000001  A1      : 0x00000000  
A2      : 0x3fc92cd4  A3      : 0x00000035  A4      : 0x3fc92c2c  A5      : 0x00000001  
A6      : 0x00000014  A7      : 0x0000000a  S2      : 0x00000000  S3      : 0x3fc920b0  
S4      : 0x00000027  S5      : 0x00000014  S6      : 0x00000000  S7      : 0x00000000  
S8      : 0x00000000  S9      : 0x00000000  S10     : 0x00000000  S11     : 0x00000000  
T3      : 0x00000000  T4      : 0x00000000  T5      : 0x00000000  T6      : 0x00000000  
MSTATUS : 0x00001889  MTVEC   : 0x40380001  MCAUSE  : 0xdeadc0de  MTVAL   : 0xdeadc0de  
MHARTID : 0x00000000  
Please enable CONFIG_ESP_SYSTEM_USE_FRAME_POINTER option to have a full backtrace.
[1;31mE (290450) task_wdt: Task watchdog got triggered. The following tasks/users did not reset the watchdog in time:[0m
[1;31mE (290450) task_wdt:  - IDLE (CPU 0)[0m
[1;31mE (290450) task_wdt: Tasks currently running:[0m
[1;31mE (290450) task_wdt: CPU 0: lvgl_task[0m
[1;31mE (290450) task_wdt: Print CPU 0 (current core) registers[0m
Core  0 register dump:
MEPC    : 0x42011e78  RA      : 0x42011e4e  SP      : 0x3fcacea0  GP      : 0x3fc8f600  
TP      : 0x3fcacfb0  T0      : 0x00000000  T1      : 0x40000000  T2      : 0x00000000  
S0/FP   : 0x3fc91d70  S1      : 0x3fc92098  A0      : 0x00000001  A1      : 0x00000000  
A2      : 0x3fc92cd4  A3      : 0x00000035  A4      : 0x3fc92c2c  A5      : 0x00000001  
A6      : 0x00000014  A7      : 0x0000000a  S2      : 0x00000000  S3      : 0x3fc920b0  
S4      : 0x00000027  S5      : 0x00000014  S6      : 0x00000000  S7      : 0x00000000  
S8      : 0x00000000  S9      : 0x00000000  S10     : 0x00000000  S11     : 0x00000000  
T3      : 0x00000000  T4      : 0x00000000  T5      : 0x00000000  T6      : 0x00000000  
MSTATUS : 0x00001889  MTVEC   : 0x40380001  MCAUSE  : 0xdeadc0de  MTVAL   : 0xdeadc0de  
MHARTID : 0x00000000  
Please enable CONFIG_ESP_SYSTEM_USE_FRAME_POINTER option to have a full backtrace.
[1;31mE (295450) task_wdt: Task watchdog got triggered. The following tasks/users did not reset the watchdog in time:[0m
[1;31mE (295450) task_wdt:  - IDLE (CPU 0)[0m
[1;31mE (295450) task_wdt: Tasks currently running:[0m
[1;31mE (295450) task_wdt: CPU 0: lvgl_task[0m
[1;31mE (295450) task_wdt: Print CPU 0 (current core) registers[0m
Core  0 register dump:
MEPC    : 0x42011e78  RA      : 0x42011e4e  SP      : 0x3fcacea0  GP      : 0x3fc8f600  
TP      : 0x3fcacfb0  T0      : 0x00000000  T1      : 0x40000000  T2      : 0x00000000  
S0/FP   : 0x3fc91d70  S1      : 0x3fc92098  A0      : 0x00000001  A1      : 0x00000000  
A2      : 0x3fc92cd4  A3      : 0x00000035  A4      : 0x3fc92c2c  A5      : 0x00000001  
A6      : 0x00000014  A7      : 0x0000000a  S2      : 0x00000000  S3      : 0x3fc920b0  
S4      : 0x00000027  S5      : 0x00000014  S6      : 0x00000000  S7      : 0x00000000  
S8      : 0x00000000  S9      : 0x00000000  S10     : 0x00000000  S11     : 0x00000000  
T3      : 0x00000000  T4      : 0x00000000  T5      : 0x00000000  T6      : 0x00000000  
MSTATUS : 0x00001889  MTVEC   : 0x40380001  MCAUSE  : 0xdeadc0de  MTVAL   : 0xdeadc0de  
MHARTID : 0x00000000  
Please enable CONFIG_ESP_SYSTEM_USE_FRAME_POINTER option to have a full backtrace.
[1;31mE (300450) task_wdt: Task watchdog got triggered. The following tasks/users did not reset the watchdog in time:[0m
[1;31mE (300450) task_wdt:  - IDLE (CPU 0)[0m
[1;31mE (300450) task_wdt: Tasks currently running:[0m
[1;31mE (300450) task_wdt: CPU 0: lvgl_task[0m
[1;31mE (300450) task_wdt: Print CPU 0 (current core) registers[0m
Core  0 register dump:
MEPC    : 0x42011e78  RA      : 0x42011e4e  SP      : 0x3fcacea0  GP      : 0x3fc8f600  
TP      : 0x3fcacfb0  T0      : 0x00000000  T1      : 0x40000000  T2      : 0x00000000  
S0/FP   : 0x3fc91d70  S1      : 0x3fc92098  A0      : 0x00000001  A1      : 0x00000000  
A2      : 0x3fc92cd4  A3      : 0x00000035  A4      : 0x3fc92c2c  A5      : 0x00000001  
A6      : 0x00000014  A7      : 0x0000000a  S2      : 0x00000000  S3      : 0x3fc920b0  
S4      : 0x00000027  S5      : 0x00000014  S6      : 0x00000000  S7      : 0x00000000  
S8      : 0x00000000  S9      : 0x00000000  S10     : 0x00000000  S11     : 0x00000000  
T3      : 0x00000000  T4      : 0x00000000  T5      : 0x00000000  T6      : 0x00000000  
MSTATUS : 0x00001889  MTVEC   : 0x40380001  MCAUSE  : 0xdeadc0de  MTVAL   : 0xdeadc0de  
MHARTID : 0x00000000  
Please enable CONFIG_ESP_SYSTEM_USE_FRAME_POINTER option to have a full backtrace.
[1;31mE (305450) task_wdt: Task watchdog got triggered. The following tasks/users did not reset the watchdog in time:[0m
[1;31mE (305450) task_wdt:  - IDLE (CPU 0)[0m
[1;31mE (305450) task_wdt: Tasks currently running:[0m
[1;31mE (305450) task_wdt: CPU 0: lvgl_task[0m
[1;31mE (305450) task_wdt: Print CPU 0 (current core) registers[0m
Core  0 register dump:
MEPC    : 0x42011e78  RA      : 0x42011e4e  SP      : 0x3fcacea0  GP      : 0x3fc8f600  
TP      : 0x3fcacfb0  T0      : 0x00000000  T1      : 0x40000000  T2      : 0x00000000  
S0/FP   : 0x3fc91d70  S1      : 0x3fc92098  A0      : 0x00000001  A1      : 0x00000000  
A2      : 0x3fc92cd4  A3      : 0x00000035  A4      : 0x3fc92c2c  A5      : 0x00000001  
A6      : 0x00000014  A7      : 0x0000000a  S2      : 0x00000000  S3      : 0x3fc920b0  
S4      : 0x00000027  S5      : 0x00000014  S6      : 0x00000000  S7      : 0x00000000  
S8      : 0x00000000  S9      : 0x00000000  S10     : 0x00000000  S11     : 0x00000000  
T3      : 0x00000000  T4      : 0x00000000  T5      : 0x00000000  T6      : 0x00000000  
MSTATUS : 0x00001889  MTVEC   : 0x40380001  MCAUSE  : 0xdeadc0de  MTVAL   : 0xdeadc0de  
MHARTID : 0x00000000  
Please enable CONFIG_ESP_SYSTEM_USE_FRAME_POINTER option to have a full backtrace.
[1;31mE (310450) task_wdt: Task watchdog got triggered. The following tasks/users did not reset the watchdog in time:[0m
[1;31mE (310450) task_wdt:  - IDLE (CPU 0)[0m
[1;31mE (310450) task_wdt: Tasks currently running:[0m
[1;31mE (310450) task_wdt: CPU 0: lvgl_task[0m
[1;31mE (310450) task_wdt: Print CPU 0 (current core) registers[0m
Core  0 register dump:
MEPC    : 0x42011e78  RA      : 0x42011e4e  SP      : 0x3fcacea0  GP      : 0x3fc8f600  
TP      : 0x3fcacfb0  T0      : 0x00000000  T1      : 0x40000000  T2      : 0x00000000  
S0/FP   : 0x3fc91d70  S1      : 0x3fc92098  A0      : 0x00000001  A1      : 0x00000000  
A2      : 0x3fc92cd4  A3      : 0x00000035  A4      : 0x3fc92c2c  A5      : 0x00000001  
A6      : 0x00000014  A7      : 0x0000000a  S2      : 0x00000000  S3      : 0x3fc920b0  
S4      : 0x00000027  S5      : 0x00000014  S6      : 0x00000000  S7      : 0x00000000  
S8      : 0x00000000  S9      : 0x00000000  S10     : 0x00000000  S11     : 0x00000000  
T3      : 0x00000000  T4      : 0x00000000  T5      : 0x00000000  T6      : 0x00000000  
MSTATUS : 0x00001889  MTVEC   : 0x40380001  MCAUSE  : 0xdeadc0de  MTVAL   : 0xdeadc0de  
MHARTID : 0x00000000  
Please enable CONFIG_ESP_SYSTEM_USE_FRAME_POINTER option to have a full backtrace.
[1;31mE (315450) task_wdt: Task watchdog got triggered. The following tasks/users did not reset the watchdog in time:[0m
[1;31mE (315450) task_wdt:  - IDLE (CPU 0)[0m
[1;31mE (315450) task_wdt: Tasks currently running:[0m
[1;31mE (315450) task_wdt: CPU 0: lvgl_task[0m
[1;31mE (315450) task_wdt: Print CPU 0 (current core) registers[0m
Core  0 register dump:
MEPC    : 0x42011e78  RA      : 0x42011e4e  SP      : 0x3fcacea0  GP      : 0x3fc8f600  
TP      : 0x3fcacfb0  T0      : 0x00000000  T1      : 0x40000000  T2      : 0x00000000  
S0/FP   : 0x3fc91d70  S1      : 0x3fc92098  A0      : 0x00000001  A1      : 0x00000000  
A2      : 0x3fc92cd4  A3      : 0x00000035  A4      : 0x3fc92c2c  A5      : 0x00000001  
A6      : 0x00000014  A7      : 0x0000000a  S2      : 0x00000000  S3      : 0x3fc920b0  
S4      : 0x00000027  S5      : 0x00000014  S6      : 0x00000000  S7      : 0x00000000  
S8      : 0x00000000  S9      : 0x00000000  S10     : 0x00000000  S11     : 0x00000000  
T3      : 0x00000000  T4      : 0x00000000  T5      : 0x00000000  T6      : 0x00000000  
MSTATUS : 0x00001889  MTVEC   : 0x40380001  MCAUSE  : 0xdeadc0de  MTVAL   : 0xdeadc0de  
MHARTID : 0x00000000  
Please enable CONFIG_ESP_SYSTEM_USE_FRAME_POINTER option to have a full backtrace.
[1;31mE (320450) task_wdt: Task watchdog got triggered. The following tasks/users did not reset the watchdog in time:[0m
[1;31mE (320450) task_wdt:  - IDLE (CPU 0)[0m
[1;31mE (320450) task_wdt: Tasks currently running:[0m
[1;31mE (320450) task_wdt: CPU 0: lvgl_task[0m
[1;31mE (320450) task_wdt: Print CPU 0 (current core) registers[0m
Core  0 register dump:
MEPC    : 0x42011e78  RA      : 0x42011e4e  SP      : 0x3fcacea0  GP      : 0x3fc8f600  
TP      : 0x3fcacfb0  T0      : 0x00000000  T1      : 0x40000000  T2      : 0x00000000  
S0/FP   : 0x3fc91d70  S1      : 0x3fc92098  A0      : 0x00000001  A1      : 0x00000000  
A2      : 0x3fc92cd4  A3      : 0x00000035  A4      : 0x3fc92c2c  A5      : 0x00000001  
A6      : 0x00000014  A7      : 0x0000000a  S2      : 0x00000000  S3      : 0x3fc920b0  
S4      : 0x00000027  S5      : 0x00000014  S6      : 0x00000000  S7      : 0x00000000  
S8      : 0x00000000  S9      : 0x00000000  S10     : 0x00000000  S11     : 0x00000000  
T3      : 0x00000000  T4      : 0x00000000  T5      : 0x00000000  T6      : 0x00000000  
MSTATUS : 0x00001889  MTVEC   : 0x40380001  MCAUSE  : 0xdeadc0de  MTVAL   : 0xdeadc0de  
MHARTID : 0x00000000  
Please enable CONFIG_ESP_SYSTEM_USE_FRAME_POINTER option to have a full backtrace.
[1;31mE (325450) task_wdt: Task watchdog got triggered. The following tasks/users did not reset the watchdog in time:[0m
[1;31mE (325450) task_wdt:  - IDLE (CPU 0)[0m
[1;31mE (325450) task_wdt: Tasks currently running:[0m
[1;31mE (325450) task_wdt: CPU 0: lvgl_task[0m
[1;31mE (325450) task_wdt: Print CPU 0 (current core) registers[0m
Core  0 register dump:
MEPC    : 0x42011e78  RA      : 0x42011e4e  SP      : 0x3fcacea0  GP      : 0x3fc8f600  
TP      : 0x3fcacfb0  T0      : 0x00000000  T1      : 0x40000000  T2      : 0x00000000  
S0/FP   : 0x3fc91d70  S1      : 0x3fc92098  A0      : 0x00000001  A1      : 0x00000000  
A2      : 0x3fc92cd4  A3      : 0x00000035  A4      : 0x3fc92c2c  A5      : 0x00000001  
A6      : 0x00000014  A7      : 0x0000000a  S2      : 0x00000000  S3      : 0x3fc920b0  
S4      : 0x00000027  S5      : 0x00000014  S6      : 0x00000000  S7      : 0x00000000  
S8      : 0x00000000  S9      : 0x00000000  S10     : 0x00000000  S11     : 0x00000000  
T3      : 0x00000000  T4      : 0x00000000  T5      : 0x00000000  T6      : 0x00000000  
MSTATUS : 0x00001889  MTVEC   : 0x40380001  MCAUSE  : 0xdeadc0de  MTVAL   : 0xdeadc0de  
MHARTID : 0x00000000  
Please enable CONFIG_ESP_SYSTEM_USE_FRAME_POINTER option to have a full backtrace.
[1;31mE (330450) task_wdt: Task watchdog got triggered. The following tasks/users did not reset the watchdog in time:[0m
[1;31mE (330450) task_wdt:  - IDLE (CPU 0)[0m
[1;31mE (330450) task_wdt: Tasks currently running:[0m
[1;31mE (330450) task_wdt: CPU 0: lvgl_task[0m
[1;31mE (330450) task_wdt: Print CPU 0 (current core) registers[0m
Core  0 register dump:
MEPC    : 0x42011e78  RA      : 0x42011e4e  SP      : 0x3fcacea0  GP      : 0x3fc8f600  
TP      : 0x3fcacfb0  T0      : 0x00000000  T1      : 0x40000000  T2      : 0x00000000  
S0/FP   : 0x3fc91d70  S1      : 0x3fc92098  A0      : 0x00000001  A1      : 0x00000000  
A2      : 0x3fc92cd4  A3      : 0x00000035  A4      : 0x3fc92c2c  A5      : 0x00000001  
A6      : 0x00000014  A7      : 0x0000000a  S2      : 0x00000000  S3      : 0x3fc920b0  
S4      : 0x00000027  S5      : 0x00000014  S6      : 0x00000000  S7      : 0x00000000  
S8      : 0x00000000  S9      : 0x00000000  S10     : 0x00000000  S11     : 0x00000000  
T3      : 0x00000000  T4      : 0x00000000  T5      : 0x00000000  T6      : 0x00000000  
MSTATUS : 0x00001889  MTVEC   : 0x40380001  MCAUSE  : 0xdeadc0de  MTVAL   : 0xdeadc0de  
MHARTID : 0x00000000  
Please enable CONFIG_ESP_SYSTEM_USE_FRAME_POINTER option to have a full backtrace.
[1;31mE (335450) task_wdt: Task watchdog got triggered. The following tasks/users did not reset the watchdog in time:[0m
[1;31mE (335450) task_wdt:  - IDLE (CPU 0)[0m
[1;31mE (335450) task_wdt: Tasks currently running:[0m
[1;31mE (335450) task_wdt: CPU 0: lvgl_task[0m
[1;31mE (335450) task_wdt: Print CPU 0 (current core) registers[0m
Core  0 register dump:
MEPC    : 0x42011e78  RA      : 0x42011e4e  SP      : 0x3fcacea0  GP      : 0x3fc8f600  
TP      : 0x3fcacfb0  T0      : 0x00000000  T1      : 0x40000000  T2      : 0x00000000  
S0/FP   : 0x3fc91d70  S1      : 0x3fc92098  A0      : 0x00000001  A1      : 0x00000000  
A2      : 0x3fc92cd4  A3      : 0x00000035  A4      : 0x3fc92c2c  A5      : 0x00000001  
A6      : 0x00000014  A7      : 0x0000000a  S2      : 0x00000000  S3      : 0x3fc920b0  
S4      : 0x00000027  S5      : 0x00000014  S6      : 0x00000000  S7      : 0x00000000  
S8      : 0x00000000  S9      : 0x00000000  S10     : 0x00000000  S11     : 0x00000000  
T3      : 0x00000000  T4      : 0x00000000  T5      : 0x00000000  T6      : 0x00000000  
MSTATUS : 0x00001889  MTVEC   : 0x40380001  MCAUSE  : 0xdeadc0de  MTVAL   : 0xdeadc0de  
MHARTID : 0x00000000  
Please enable CONFIG_ESP_SYSTEM_USE_FRAME_POINTER option to have a full backtrace.
[1;31mE (340450) task_wdt: Task watchdog got triggered. The following tasks/users did not reset the watchdog in time:[0m
[1;31mE (340450) task_wdt:  - IDLE (CPU 0)[0m
[1;31mE (340450) task_wdt: Tasks currently running:[0m
[1;31mE (340450) task_wdt: CPU 0: lvgl_task[0m
[1;31mE (340450) task_wdt: Print CPU 0 (current core) registers[0m
Core  0 register dump:
MEPC    : 0x42011e78  RA      : 0x42011e4e  SP      : 0x3fcacea0  GP      : 0x3fc8f600  
TP      : 0x3fcacfb0  T0      : 0x00000000  T1      : 0x40000000  T2      : 0x00000000  
S0/FP   : 0x3fc91d70  S1      : 0x3fc92098  A0      : 0x00000001  A1      : 0x00000000  
A2      : 0x3fc92cd4  A3      : 0x00000035  A4      : 0x3fc92c2c  A5      : 0x00000001  
A6      : 0x00000014  A7      : 0x0000000a  S2      : 0x00000000  S3      : 0x3fc920b0  
S4      : 0x00000027  S5      : 0x00000014  S6      : 0x00000000  S7      : 0x00000000  
S8      : 0x00000000  S9      : 0x00000000  S10     : 0x00000000  S11     : 0x00000000  
T3      : 0x00000000  T4      : 0x00000000  T5      : 0x00000000  T6      : 0x00000000  
MSTATUS : 0x00001889  MTVEC   : 0x40380001  MCAUSE  : 0xdeadc0de  MTVAL   : 0xdeadc0de  
MHARTID : 0x00000000  
Please enable CONFIG_ESP_SYSTEM_USE_FRAME_POINTER option to have a full backtrace.
[1;31mE (345450) task_wdt: Task watchdog got triggered. The following tasks/users did not reset the watchdog in time:[0m
[1;31mE (345450) task_wdt:  - IDLE (CPU 0)[0m
[1;31mE (345450) task_wdt: Tasks currently running:[0m
[1;31mE (345450) task_wdt: CPU 0: lvgl_task[0m
[1;31mE (345450) task_wdt: Print CPU 0 (current core) registers[0m
Core  0 register dump:
MEPC    : 0x42011e78  RA      : 0x42011e4e  SP      : 0x3fcacea0  GP      : 0x3fc8f600  
TP      : 0x3fcacfb0  T0      : 0x00000000  T1      : 0x40000000  T2      : 0x00000000  
S0/FP   : 0x3fc91d70  S1      : 0x3fc92098  A0      : 0x00000001  A1      : 0x00000000  
A2      : 0x3fc92cd4  A3      : 0x00000035  A4      : 0x3fc92c2c  A5      : 0x00000001  
A6      : 0x00000014  A7      : 0x0000000a  S2      : 0x00000000  S3      : 0x3fc920b0  
S4      : 0x00000027  S5      : 0x00000014  S6      : 0x00000000  S7      : 0x00000000  
S8      : 0x00000000  S9      : 0x00000000  S10     : 0x00000000  S11     : 0x00000000  
T3      : 0x00000000  T4      : 0x00000000  T5      : 0x00000000  T6      : 0x00000000  
MSTATUS : 0x00001889  MTVEC   : 0x40380001  MCAUSE  : 0xdeadc0de  MTVAL   : 0xdeadc0de  
MHARTID : 0x00000000  
Please enable CONFIG_ESP_SYSTEM_USE_FRAME_POINTER option to have a full backtrace.
[1;31mE (350450) task_wdt: Task watchdog got triggered. The following tasks/users did not reset the watchdog in time:[0m
[1;31mE (350450) task_wdt:  - IDLE (CPU 0)[0m
[1;31mE (350450) task_wdt: Tasks currently running:[0m
[1;31mE (350450) task_wdt: CPU 0: lvgl_task[0m
[1;31mE (350450) task_wdt: Print CPU 0 (current core) registers[0m
Core  0 register dump:
MEPC    : 0x42011e78  RA      : 0x42011e4e  SP      : 0x3fcacea0  GP      : 0x3fc8f600  
TP      : 0x3fcacfb0  T0      : 0x00000000  T1      : 0x40000000  T2      : 0x00000000  
S0/FP   : 0x3fc91d70  S1      : 0x3fc92098  A0      : 0x00000001  A1      : 0x00000000  
A2      : 0x3fc92cd4  A3      : 0x00000035  A4      : 0x3fc92c2c  A5      : 0x00000001  
A6      : 0x00000014  A7      : 0x0000000a  S2      : 0x00000000  S3      : 0x3fc920b0  
S4      : 0x00000027  S5      : 0x00000014  S6      : 0x00000000  S7      : 0x00000000  
S8      : 0x00000000  S9      : 0x00000000  S10     : 0x00000000  S11     : 0x00000000  
T3      : 0x00000000  T4      : 0x00000000  T5      : 0x00000000  T6      : 0x00000000  
MSTATUS : 0x00001889  MTVEC   : 0x40380001  MCAUSE  : 0xdeadc0de  MTVAL   : 0xdeadc0de  
MHARTID : 0x00000000  
Please enable CONFIG_ESP_SYSTEM_USE_FRAME_POINTER option to have a full backtrace.
[1;31mE (355450) task_wdt: Task watchdog got triggered. The following tasks/users did not reset the watchdog in time:[0m
[1;31mE (355450) task_wdt:  - IDLE (CPU 0)[0m
[1;31mE (355450) task_wdt: Tasks currently running:[0m
[1;31mE (355450) task_wdt: CPU 0: lvgl_task[0m
[1;31mE (355450) task_wdt: Print CPU 0 (current core) registers[0m
Core  0 register dump:
MEPC    : 0x42011e78  RA      : 0x42011e4e  SP      : 0x3fcacea0  GP      : 0x3fc8f600  
TP      : 0x3fcacfb0  T0      : 0x00000000  T1      : 0x40000000  T2      : 0x00000000  
S0/FP   : 0x3fc91d70  S1      : 0x3fc92098  A0      : 0x00000001  A1      : 0x00000000  
A2      : 0x3fc92cd4  A3      : 0x00000035  A4      : 0x3fc92c2c  A5      : 0x00000001  
A6      : 0x00000014  A7      : 0x0000000a  S2      : 0x00000000  S3      : 0x3fc920b0  
S4      : 0x00000027  S5      : 0x00000014  S6      : 0x00000000  S7      : 0x00000000  
S8      : 0x00000000  S9      : 0x00000000  S10     : 0x00000000  S11     : 0x00000000  
T3      : 0x00000000  T4      : 0x00000000  T5      : 0x00000000  T6      : 0x00000000  
MSTATUS : 0x00001889  MTVEC   : 0x40380001  MCAUSE  : 0xdeadc0de  MTVAL   : 0xdeadc0de  
MHARTID : 0x00000000  
Please enable CONFIG_ESP_SYSTEM_USE_FRAME_POINTER option to have a full backtrace.
[1;31mE (360450) task_wdt: Task watchdog got triggered. The following tasks/users did not reset the watchdog in time:[0m
[1;31mE (360450) task_wdt:  - IDLE (CPU 0)[0m
[1;31mE (360450) task_wdt: Tasks currently running:[0m
[1;31mE (360450) task_wdt: CPU 0: lvgl_task[0m
[1;31mE (360450) task_wdt: Print CPU 0 (current core) registers[0m
Core  0 register dump:
MEPC    : 0x42011e78  RA      : 0x42011e4e  SP      : 0x3fcacea0  GP      : 0x3fc8f600  
TP      : 0x3fcacfb0  T0      : 0x00000000  T1      : 0x40000000  T2      : 0x00000000  
S0/FP   : 0x3fc91d70  S1      : 0x3fc92098  A0      : 0x00000001  A1      : 0x00000000  
A2      : 0x3fc92cd4  A3      : 0x00000035  A4      : 0x3fc92c2c  A5      : 0x00000001  
A6      : 0x00000014  A7      : 0x0000000a  S2      : 0x00000000  S3      : 0x3fc920b0  
S4      : 0x00000027  S5      : 0x00000014  S6      : 0x00000000  S7      : 0x00000000  
S8      : 0x00000000  S9      : 0x00000000  S10     : 0x00000000  S11     : 0x00000000  
T3      : 0x00000000  T4      : 0x00000000  T5      : 0x00000000  T6      : 0x00000000  
MSTATUS : 0x00001889  MTVEC   : 0x40380001  MCAUSE  : 0xdeadc0de  MTVAL   : 0xdeadc0de  
MHARTID : 0x00000000  
Please enable CONFIG_ESP_SYSTEM_USE_FRAME_POINTER option to have a full backtrace.
[1;31mE (365450) task_wdt: Task watchdog got triggered. The following tasks/users did not reset the watchdog in time:[0m
[1;31mE (365450) task_wdt:  - IDLE (CPU 0)[0m
[1;31mE (365450) task_wdt: Tasks currently running:[0m
[1;31mE (365450) task_wdt: CPU 0: lvgl_task[0m
[1;31mE (365450) task_wdt: Print CPU 0 (current core) registers[0m
Core  0 register dump:
MEPC    : 0x42011e78  RA      : 0x42011e4e  SP      : 0x3fcacea0  GP      : 0x3fc8f600  
TP      : 0x3fcacfb0  T0      : 0x00000000  T1      : 0x40000000  T2      : 0x00000000  
S0/FP   : 0x3fc91d70  S1      : 0x3fc92098  A0      : 0x00000001  A1      : 0x00000000  
A2      : 0x3fc92cd4  A3      : 0x00000035  A4      : 0x3fc92c2c  A5      : 0x00000001  
A6      : 0x00000014  A7      : 0x0000000a  S2      : 0x00000000  S3      : 0x3fc920b0  
S4      : 0x00000027  S5      : 0x00000014  S6      : 0x00000000  S7      : 0x00000000  
S8      : 0x00000000  S9      : 0x00000000  S10     : 0x00000000  S11     : 0x00000000  
T3      : 0x00000000  T4      : 0x00000000  T5      : 0x00000000  T6      : 0x00000000  
MSTATUS : 0x00001889  MTVEC   : 0x40380001  MCAUSE  : 0xdeadc0de  MTVAL   : 0xdeadc0de  
MHARTID : 0x00000000  
Please enable CONFIG_ESP_SYSTEM_USE_FRAME_POINTER option to have a full backtrace.
[1;31mE (370450) task_wdt: Task watchdog got triggered. The following tasks/users did not reset the watchdog in time:[0m
[1;31mE (370450) task_wdt:  - IDLE (CPU 0)[0m
[1;31mE (370450) task_wdt: Tasks currently running:[0m
[1;31mE (370450) task_wdt: CPU 0: lvgl_task[0m
[1;31mE (370450) task_wdt: Print CPU 0 (current core) registers[0m
Core  0 register dump:
MEPC    : 0x42011e78  RA      : 0x42011e4e  SP      : 0x3fcacea0  GP      : 0x3fc8f600  
TP      : 0x3fcacfb0  T0      : 0x00000000  T1      : 0x40000000  T2      : 0x00000000  
S0/FP   : 0x3fc91d70  S1      : 0x3fc92098  A0      : 0x00000001  A1      : 0x00000000  
A2      : 0x3fc92cd4  A3      : 0x00000035  A4      : 0x3fc92c2c  A5      : 0x00000001  
A6      : 0x00000014  A7      : 0x0000000a  S2      : 0x00000000  S3      : 0x3fc920b0  
S4      : 0x00000027  S5      : 0x00000014  S6      : 0x00000000  S7      : 0x00000000  
S8      : 0x00000000  S9      : 0x00000000  S10     : 0x00000000  S11     : 0x00000000  
T3      : 0x00000000  T4      : 0x00000000  T5      : 0x00000000  T6      : 0x00000000  
MSTATUS : 0x00001889  MTVEC   : 0x40380001  MCAUSE  : 0xdeadc0de  MTVAL   : 0xdeadc0de  
MHARTID : 0x00000000  
Please enable CONFIG_ESP_SYSTEM_USE_FRAME_POINTER option to have a full backtrace.
[1;31mE (375450) task_wdt: Task watchdog got triggered. The following tasks/users did not reset the watchdog in time:[0m
[1;31mE (375450) task_wdt:  - IDLE (CPU 0)[0m
[1;31mE (375450) task_wdt: Tasks currently running:[0m
[1;31mE (375450) task_wdt: CPU 0: lvgl_task[0m
[1;31mE (375450) task_wdt: Print CPU 0 (current core) registers[0m
Core  0 register dump:
MEPC    : 0x42011e78  RA      : 0x42011e4e  SP      : 0x3fcacea0  GP      : 0x3fc8f600  
TP      : 0x3fcacfb0  T0      : 0x00000000  T1      : 0x40000000  T2      : 0x00000000  
S0/FP   : 0x3fc91d70  S1      : 0x3fc92098  A0      : 0x00000001  A1      : 0x00000000  
A2      : 0x3fc92cd4  A3      : 0x00000035  A4      : 0x3fc92c2c  A5      : 0x00000001  
A6      : 0x00000014  A7      : 0x0000000a  S2      : 0x00000000  S3      : 0x3fc920b0  
S4      : 0x00000027  S5      : 0x00000014  S6      : 0x00000000  S7      : 0x00000000  
S8      : 0x00000000  S9      : 0x00000000  S10     : 0x00000000  S11     : 0x00000000  
T3      : 0x00000000  T4      : 0x00000000  T5      : 0x00000000  T6      : 0x00000000  
MSTATUS : 0x00001889  MTVEC   : 0x40380001  MCAUSE  : 0xdeadc0de  MTVAL   : 0xdeadc0de  
MHARTID : 0x00000000  
Please enable CONFIG_ESP_SYSTEM_USE_FRAME_POINTER option to have a full backtrace.
[1;31mE (380450) task_wdt: Task watchdog got triggered. The following tasks/users did not reset the watchdog in time:[0m
[1;31mE (380450) task_wdt:  - IDLE (CPU 0)[0m
[1;31mE (380450) task_wdt: Tasks currently running:[0m
[1;31mE (380450) task_wdt: CPU 0: lvgl_task[0m
[1;31mE (380450) task_wdt: Print CPU 0 (current core) registers[0m
Core  0 register dump:
MEPC    : 0x42011e78  RA      : 0x42011e4e  SP      : 0x3fcacea0  GP      : 0x3fc8f600  
TP      : 0x3fcacfb0  T0      : 0x00000000  T1      : 0x40000000  T2      : 0x00000000  
S0/FP   : 0x3fc91d70  S1      : 0x3fc92098  A0      : 0x00000001  A1      : 0x00000000  
A2      : 0x3fc92cd4  A3      : 0x00000035  A4      : 0x3fc92c2c  A5      : 0x00000001  
A6      : 0x00000014  A7      : 0x0000000a  S2      : 0x00000000  S3      : 0x3fc920b0  
S4      : 0x00000027  S5      : 0x00000014  S6      : 0x00000000  S7      : 0x00000000  
S8      : 0x00000000  S9      : 0x00000000  S10     : 0x00000000  S11     : 0x00000000  
T3      : 0x00000000  T4      : 0x00000000  T5      : 0x00000000  T6      : 0x00000000  
MSTATUS : 0x00001889  MTVEC   : 0x40380001  MCAUSE  : 0xdeadc0de  MTVAL   : 0xdeadc0de  
MHARTID : 0x00000000  
Please enable CONFIG_ESP_SYSTEM_USE_FRAME_POINTER option to have a full backtrace.
[1;31mE (385450) task_wdt: Task watchdog got triggered. The following tasks/users did not reset the watchdog in time:[0m
[1;31mE (385450) task_wdt:  - IDLE (CPU 0)[0m
[1;31mE (385450) task_wdt: Tasks currently running:[0m
[1;31mE (385450) task_wdt: CPU 0: lvgl_task[0m
[1;31mE (385450) task_wdt: Print CPU 0 (current core) registers[0m
Core  0 register dump:
MEPC    : 0x42011e78  RA      : 0x42011e4e  SP      : 0x3fcacea0  GP      : 0x3fc8f600  
TP      : 0x3fcacfb0  T0      : 0x00000000  T1      : 0x40000000  T2      : 0x00000000  
S0/FP   : 0x3fc91d70  S1      : 0x3fc92098  A0      : 0x00000001  A1      : 0x00000000  
A2      : 0x3fc92cd4  A3      : 0x00000035  A4      : 0x3fc92c2c  A5      : 0x00000001  
A6      : 0x00000014  A7      : 0x0000000a  S2      : 0x00000000  S3      : 0x3fc920b0  
S4      : 0x00000027  S5      : 0x00000014  S6      : 0x00000000  S7      : 0x00000000  
S8      : 0x00000000  S9      : 0x00000000  S10     : 0x00000000  S11     : 0x00000000  
T3      : 0x00000000  T4      : 0x00000000  T5      : 0x00000000  T6      : 0x00000000  
MSTATUS : 0x00001889  MTVEC   : 0x40380001  MCAUSE  : 0xdeadc0de  MTVAL   : 0xdeadc0de  
MHARTID : 0x00000000  
Please enable CONFIG_ESP_SYSTEM_USE_FRAME_POINTER option to have a full backtrace.
[1;31mE (390450) task_wdt: Task watchdog got triggered. The following tasks/users did not reset the watchdog in time:[0m
[1;31mE (390450) task_wdt:  - IDLE (CPU 0)[0m
[1;31mE (390450) task_wdt: Tasks currently running:[0m
[1;31mE (390450) task_wdt: CPU 0: lvgl_task[0m
[1;31mE (390450) task_wdt: Print CPU 0 (current core) registers[0m
Core  0 register dump:
MEPC    : 0x42011e78  RA      : 0x42011e4e  SP      : 0x3fcacea0  GP      : 0x3fc8f600  
TP      : 0x3fcacfb0  T0      : 0x00000000  T1      : 0x40000000  T2      : 0x00000000  
S0/FP   : 0x3fc91d70  S1      : 0x3fc92098  A0      : 0x00000001  A1      : 0x00000000  
A2      : 0x3fc92cd4  A3      : 0x00000035  A4      : 0x3fc92c2c  A5      : 0x00000001  
A6      : 0x00000014  A7      : 0x0000000a  S2      : 0x00000000  S3      : 0x3fc920b0  
S4      : 0x00000027  S5      : 0x00000014  S6      : 0x00000000  S7      : 0x00000000  
S8      : 0x00000000  S9      : 0x00000000  S10     : 0x00000000  S11     : 0x00000000  
T3      : 0x00000000  T4      : 0x00000000  T5      : 0x00000000  T6      : 0x00000000  
MSTATUS : 0x00001889  MTVEC   : 0x40380001  MCAUSE  : 0xdeadc0de  MTVAL   : 0xdeadc0de  
MHARTID : 0x00000000  
Please enable CONFIG_ESP_SYSTEM_USE_FRAME_POINTER option to have a full backtrace.
[1;31mE (395450) task_wdt: Task watchdog got triggered. The following tasks/users did not reset the watchdog in time:[0m
[1;31mE (395450) task_wdt:  - IDLE (CPU 0)[0m
[1;31mE (395450) task_wdt: Tasks currently running:[0m
[1;31mE (395450) task_wdt: CPU 0: lvgl_task[0m
[1;31mE (395450) task_wdt: Print CPU 0 (current core) registers[0m
Core  0 register dump:
MEPC    : 0x42011e78  RA      : 0x42011e4e  SP      : 0x3fcacea0  GP      : 0x3fc8f600  
TP      : 0x3fcacfb0  T0      : 0x00000000  T1      : 0x40000000  T2      : 0x00000000  
S0/FP   : 0x3fc91d70  S1      : 0x3fc92098  A0      : 0x00000001  A1      : 0x00000000  
A2      : 0x3fc92cd4  A3      : 0x00000035  A4      : 0x3fc92c2c  A5      : 0x00000001  
A6      : 0x00000014  A7      : 0x0000000a  S2      : 0x00000000  S3      : 0x3fc920b0  
S4      : 0x00000027  S5      : 0x00000014  S6      : 0x00000000  S7      : 0x00000000  
S8      : 0x00000000  S9      : 0x00000000  S10     : 0x00000000  S11     : 0x00000000  
T3      : 0x00000000  T4      : 0x00000000  T5      : 0x00000000  T6      : 0x00000000  
MSTATUS : 0x00001889  MTVEC   : 0x40380001  MCAUSE  : 0xdeadc0de  MTVAL   : 0xdeadc0de  
MHARTID : 0x00000000  
Please enable CONFIG_ESP_SYSTEM_USE_FRAME_POINTER option to have a full backtrace.
[1;31mE (400450) task_wdt: Task watchdog got triggered. The following tasks/users did not reset the watchdog in time:[0m
[1;31mE (400450) task_wdt:  - IDLE (CPU 0)[0m
[1;31mE (400450) task_wdt: Tasks currently running:[0m
[1;31mE (400450) task_wdt: CPU 0: lvgl_task[0m
[1;31mE (400450) task_wdt: Print CPU 0 (current core) registers[0m
Core  0 register dump:
MEPC    : 0x42011e78  RA      : 0x42011e4e  SP      : 0x3fcacea0  GP      : 0x3fc8f600  
TP      : 0x3fcacfb0  T0      : 0x00000000  T1      : 0x40000000  T2      : 0x00000000  
S0/FP   : 0x3fc91d70  S1      : 0x3fc92098  A0      : 0x00000001  A1      : 0x00000000  
A2      : 0x3fc92cd4  A3      : 0x00000035  A4      : 0x3fc92c2c  A5      : 0x00000001  
A6      : 0x00000014  A7      : 0x0000000a  S2      : 0x00000000  S3      : 0x3fc920b0  
S4      : 0x00000027  S5      : 0x00000014  S6      : 0x00000000  S7      : 0x00000000  
S8      : 0x00000000  S9      : 0x00000000  S10     : 0x00000000  S11     : 0x00000000  
T3      : 0x00000000  T4      : 0x00000000  T5      : 0x00000000  T6      : 0x00000000  
MSTATUS : 0x00001889  MTVEC   : 0x40380001  MCAUSE  : 0xdeadc0de  MTVAL   : 0xdeadc0de  
MHARTID : 0x00000000  
Please enable CONFIG_ESP_SYSTEM_USE_FRAME_POINTER option to have a full backtrace.
[1;31mE (405450) task_wdt: Task watchdog got triggered. The following tasks/users did not reset the watchdog in time:[0m
[1;31mE (405450) task_wdt:  - IDLE (CPU 0)[0m
[1;31mE (405450) task_wdt: Tasks currently running:[0m
[1;31mE (405450) task_wdt: CPU 0: lvgl_task[0m
[1;31mE (405450) task_wdt: Print CPU 0 (current core) registers[0m
Core  0 register dump:
MEPC    : 0x42011e78  RA      : 0x42011e4e  SP      : 0x3fcacea0  GP      : 0x3fc8f600  
TP      : 0x3fcacfb0  T0      : 0x00000000  T1      : 0x40000000  T2      : 0x00000000  
S0/FP   : 0x3fc91d70  S1      : 0x3fc92098  A0      : 0x00000001  A1      : 0x00000000  
A2      : 0x3fc92cd4  A3      : 0x00000035  A4      : 0x3fc92c2c  A5      : 0x00000001  
A6      : 0x00000014  A7      : 0x0000000a  S2      : 0x00000000  S3      : 0x3fc920b0  
S4      : 0x00000027  S5      : 0x00000014  S6      : 0x00000000  S7      : 0x00000000  
S8      : 0x00000000  S9      : 0x00000000  S10     : 0x00000000  S11     : 0x00000000  
T3      : 0x00000000  T4      : 0x00000000  T5      : 0x00000000  T6      : 0x00000000  
MSTATUS : 0x00001889  MTVEC   : 0x40380001  MCAUSE  : 0xdeadc0de  MTVAL   : 0xdeadc0de  
MHARTID : 0x00000000  
Please enable CONFIG_ESP_SYSTEM_USE_FRAME_POINTER option to have a full backtrace.
[1;31mE (410450) task_wdt: Task watchdog got triggered. The following tasks/users did not reset the watchdog in time:[0m
[1;31mE (410450) task_wdt:  - IDLE (CPU 0)[0m
[1;31mE (410450) task_wdt: Tasks currently running:[0m
[1;31mE (410450) task_wdt: CPU 0: lvgl_task[0m
[1;31mE (410450) task_wdt: Print CPU 0 (current core) registers[0m
Core  0 register dump:
MEPC    : 0x42011e78  RA      : 0x42011e4e  SP      : 0x3fcacea0  GP      : 0x3fc8f600  
TP      : 0x3fcacfb0  T0      : 0x00000000  T1      : 0x40000000  T2      : 0x00000000  
S0/FP   : 0x3fc91d70  S1      : 0x3fc92098  A0      : 0x00000001  A1      : 0x00000000  
A2      : 0x3fc92cd4  A3      : 0x00000035  A4      : 0x3fc92c2c  A5      : 0x00000001  
A6      : 0x00000014  A7      : 0x0000000a  S2      : 0x00000000  S3      : 0x3fc920b0  
S4      : 0x00000027  S5      : 0x00000014  S6      : 0x00000000  S7      : 0x00000000  
S8      : 0x00000000  S9      : 0x00000000  S10     : 0x00000000  S11     : 0x00000000  
T3      : 0x00000000  T4      : 0x00000000  T5      : 0x00000000  T6      : 0x00000000  
MSTATUS : 0x00001889  MTVEC   : 0x40380001  MCAUSE  : 0xdeadc0de  MTVAL   : 0xdeadc0de  
MHARTID : 0x00000000  
Please enable CONFIG_ESP_SYSTEM_USE_FRAME_POINTER option to have a full backtrace.
[1;31mE (415450) task_wdt: Task watchdog got triggered. The following tasks/users did not reset the watchdog in time:[0m
[1;31mE (415450) task_wdt:  - IDLE (CPU 0)[0m
[1;31mE (415450) task_wdt: Tasks currently running:[0m
[1;31mE (415450) task_wdt: CPU 0: lvgl_task[0m
[1;31mE (415450) task_wdt: Print CPU 0 (current core) registers[0m
Core  0 register dump:
MEPC    : 0x42011e78  RA      : 0x42011e4e  SP      : 0x3fcacea0  GP      : 0x3fc8f600  
TP      : 0x3fcacfb0  T0      : 0x00000000  T1      : 0x40000000  T2      : 0x00000000  
S0/FP   : 0x3fc91d70  S1      : 0x3fc92098  A0      : 0x00000001  A1      : 0x00000000  
A2      : 0x3fc92cd4  A3      : 0x00000035  A4      : 0x3fc92c2c  A5      : 0x00000001  
A6      : 0x00000014  A7      : 0x0000000a  S2      : 0x00000000  S3      : 0x3fc920b0  
S4      : 0x00000027  S5      : 0x00000014  S6      : 0x00000000  S7      : 0x00000000  
S8      : 0x00000000  S9      : 0x00000000  S10     : 0x00000000  S11     : 0x00000000  
T3      : 0x00000000  T4      : 0x00000000  T5      : 0x00000000  T6      : 0x00000000  
MSTATUS : 0x00001889  MTVEC   : 0x40380001  MCAUSE  : 0xdeadc0de  MTVAL   : 0xdeadc0de  
MHARTID : 0x00000000  
Please enable CONFIG_ESP_SYSTEM_USE_FRAME_POINTER option to have a full backtrace.
[1;31mE (420450) task_wdt: Task watchdog got triggered. The following tasks/users did not reset the watchdog in time:[0m
[1;31mE (420450) task_wdt:  - IDLE (CPU 0)[0m
[1;31mE (420450) task_wdt: Tasks currently running:[0m
[1;31mE (420450) task_wdt: CPU 0: lvgl_task[0m
[1;31mE (420450) task_wdt: Print CPU 0 (current core) registers[0m
Core  0 register dump:
MEPC    : 0x42011e78  RA      : 0x42011e4e  SP      : 0x3fcacea0  GP      : 0x3fc8f600  
TP      : 0x3fcacfb0  T0      : 0x00000000  T1      : 0x40000000  T2      : 0x00000000  
S0/FP   : 0x3fc91d70  S1      : 0x3fc92098  A0      : 0x00000001  A1      : 0x00000000  
A2      : 0x3fc92cd4  A3      : 0x00000035  A4      : 0x3fc92c2c  A5      : 0x00000001  
A6      : 0x00000014  A7      : 0x0000000a  S2      : 0x00000000  S3      : 0x3fc920b0  
S4      : 0x00000027  S5      : 0x00000014  S6      : 0x00000000  S7      : 0x00000000  
S8      : 0x00000000  S9      : 0x00000000  S10     : 0x00000000  S11     : 0x00000000  
T3      : 0x00000000  T4      : 0x00000000  T5      : 0x00000000  T6      : 0x00000000  
MSTATUS : 0x00001889  MTVEC   : 0x40380001  MCAUSE  : 0xdeadc0de  MTVAL   : 0xdeadc0de  
MHARTID : 0x00000000  
Please enable CONFIG_ESP_SYSTEM_USE_FRAME_POINTER option to have a full backtrace.
[1;31mE (425450) task_wdt: Task watchdog got triggered. The following tasks/users did not reset the watchdog in time:[0m
[1;31mE (425450) task_wdt:  - IDLE (CPU 0)[0m
[1;31mE (425450) task_wdt: Tasks currently running:[0m
[1;31mE (425450) task_wdt: CPU 0: lvgl_task[0m
[1;31mE (425450) task_wdt: Print CPU 0 (current core) registers[0m
Core  0 register dump:
MEPC    : 0x42011e78  RA      : 0x42011e4e  SP      : 0x3fcacea0  GP      : 0x3fc8f600  
TP      : 0x3fcacfb0  T0      : 0x00000000  T1      : 0x40000000  T2      : 0x00000000  
S0/FP   : 0x3fc91d70  S1      : 0x3fc92098  A0      : 0x00000001  A1      : 0x00000000  
A2      : 0x3fc92cd4  A3      : 0x00000035  A4      : 0x3fc92c2c  A5      : 0x00000001  
A6      : 0x00000014  A7      : 0x0000000a  S2      : 0x00000000  S3      : 0x3fc920b0  
S4      : 0x00000027  S5      : 0x00000014  S6      : 0x00000000  S7      : 0x00000000  
S8      : 0x00000000  S9      : 0x00000000  S10     : 0x00000000  S11     : 0x00000000  
T3      : 0x00000000  T4      : 0x00000000  T5      : 0x00000000  T6      : 0x00000000  
MSTATUS : 0x00001889  MTVEC   : 0x40380001  MCAUSE  : 0xdeadc0de  MTVAL   : 0xdeadc0de  
MHARTID : 0x00000000  
Please enable CONFIG_ESP_SYSTEM_USE_FRAME_POINTER option to have a full backtrace.
[1;31mE (430450) task_wdt: Task watchdog got triggered. The following tasks/users did not reset the watchdog in time:[0m
[1;31mE (430450) task_wdt:  - IDLE (CPU 0)[0m
[1;31mE (430450) task_wdt: Tasks currently running:[0m
[1;31mE (430450) task_wdt: CPU 0: lvgl_task[0m
[1;31mE (430450) task_wdt: Print CPU 0 (current core) registers[0m
Core  0 register dump:
MEPC    : 0x42011e78  RA      : 0x42011e4e  SP      : 0x3fcacea0  GP      : 0x3fc8f600  
TP      : 0x3fcacfb0  T0      : 0x00000000  T1      : 0x40000000  T2      : 0x00000000  
S0/FP   : 0x3fc91d70  S1      : 0x3fc92098  A0      : 0x00000001  A1      : 0x00000000  
A2      : 0x3fc92cd4  A3      : 0x00000035  A4      : 0x3fc92c2c  A5      : 0x00000001  
A6      : 0x00000014  A7      : 0x0000000a  S2      : 0x00000000  S3      : 0x3fc920b0  
S4      : 0x00000027  S5      : 0x00000014  S6      : 0x00000000  S7      : 0x00000000  
S8      : 0x00000000  S9      : 0x00000000  S10     : 0x00000000  S11     : 0x00000000  
T3      : 0x00000000  T4      : 0x00000000  T5      : 0x00000000  T6      : 0x00000000  
MSTATUS : 0x00001889  MTVEC   : 0x40380001  MCAUSE  : 0xdeadc0de  MTVAL   : 0xdeadc0de  
MHARTID : 0x00000000  
Please enable CONFIG_ESP_SYSTEM_USE_FRAME_POINTER option to have a full backtrace.
[1;31mE (435450) task_wdt: Task watchdog got triggered. The following tasks/users did not reset the watchdog in time:[0m
[1;31mE (435450) task_wdt:  - IDLE (CPU 0)[0m
[1;31mE (435450) task_wdt: Tasks currently running:[0m
[1;31mE (435450) task_wdt: CPU 0: lvgl_task[0m
[1;31mE (435450) task_wdt: Print CPU 0 (current core) registers[0m
Core  0 register dump:
MEPC    : 0x42011e78  RA      : 0x42011e4e  SP      : 0x3fcacea0  GP      : 0x3fc8f600  
TP      : 0x3fcacfb0  T0      : 0x00000000  T1      : 0x40000000  T2      : 0x00000000  
S0/FP   : 0x3fc91d70  S1      : 0x3fc92098  A0      : 0x00000001  A1      : 0x00000000  
A2      : 0x3fc92cd4  A3      : 0x00000035  A4      : 0x3fc92c2c  A5      : 0x00000001  
A6      : 0x00000014  A7      : 0x0000000a  S2      : 0x00000000  S3      : 0x3fc920b0  
S4      : 0x00000027  S5      : 0x00000014  S6      : 0x00000000  S7      : 0x00000000  
S8      : 0x00000000  S9      : 0x00000000  S10     : 0x00000000  S11     : 0x00000000  
T3      : 0x00000000  T4      : 0x00000000  T5      : 0x00000000  T6      : 0x00000000  
MSTATUS : 0x00001889  MTVEC   : 0x40380001  MCAUSE  : 0xdeadc0de  MTVAL   : 0xdeadc0de  
MHARTID : 0x00000000  
Please enable CONFIG_ESP_SYSTEM_USE_FRAME_POINTER option to have a full backtrace.
[1;31mE (440450) task_wdt: Task watchdog got triggered. The following tasks/users did not reset the watchdog in time:[0m
[1;31mE (440450) task_wdt:  - IDLE (CPU 0)[0m
[1;31mE (440450) task_wdt: Tasks currently running:[0m
[1;31mE (440450) task_wdt: CPU 0: lvgl_task[0m
[1;31mE (440450) task_wdt: Print CPU 0 (current core) registers[0m
Core  0 register dump:
MEPC    : 0x42011e78  RA      : 0x42011e4e  SP      : 0x3fcacea0  GP      : 0x3fc8f600  
TP      : 0x3fcacfb0  T0      : 0x00000000  T1      : 0x40000000  T2      : 0x00000000  
S0/FP   : 0x3fc91d70  S1      : 0x3fc92098  A0      : 0x00000001  A1      : 0x00000000  
A2      : 0x3fc92cd4  A3      : 0x00000035  A4      : 0x3fc92c2c  A5      : 0x00000001  
A6      : 0x00000014  A7      : 0x0000000a  S2      : 0x00000000  S3      : 0x3fc920b0  
S4      : 0x00000027  S5      : 0x00000014  S6      : 0x00000000  S7      : 0x00000000  
S8      : 0x00000000  S9      : 0x00000000  S10     : 0x00000000  S11     : 0x00000000  
T3      : 0x00000000  T4      : 0x00000000  T5      : 0x00000000  T6      : 0x00000000  
MSTATUS : 0x00001889  MTVEC   : 0x40380001  MCAUSE  : 0xdeadc0de  MTVAL   : 0xdeadc0de  
MHARTID : 0x00000000  
Please enable CONFIG_ESP_SYSTEM_USE_FRAME_POINTER option to have a full backtrace.
[1;31mE (445450) task_wdt: Task watchdog got triggered. The following tasks/users did not reset the watchdog in time:[0m
[1;31mE (445450) task_wdt:  - IDLE (CPU 0)[0m
[1;31mE (445450) task_wdt: Tasks currently running:[0m
[1;31mE (445450) task_wdt: CPU 0: lvgl_task[0m
[1;31mE (445450) task_wdt: Print CPU 0 (current core) registers[0m
Core  0 register dump:
MEPC    : 0x42011e78  RA      : 0x42011e4e  SP      : 0x3fcacea0  GP      : 0x3fc8f600  
TP      : 0x3fcacfb0  T0      : 0x00000000  T1      : 0x40000000  T2      : 0x00000000  
S0/FP   : 0x3fc91d70  S1      : 0x3fc92098  A0      : 0x00000001  A1      : 0x00000000  
A2      : 0x3fc92cd4  A3      : 0x00000035  A4      : 0x3fc92c2c  A5      : 0x00000001  
A6      : 0x00000014  A7      : 0x0000000a  S2      : 0x00000000  S3      : 0x3fc920b0  
S4      : 0x00000027  S5      : 0x00000014  S6      : 0x00000000  S7      : 0x00000000  
S8      : 0x00000000  S9      : 0x00000000  S10     : 0x00000000  S11     : 0x00000000  
T3      : 0x00000000  T4      : 0x00000000  T5      : 0x00000000  T6      : 0x00000000  
MSTATUS : 0x00001889  MTVEC   : 0x40380001  MCAUSE  : 0xdeadc0de  MTVAL   : 0xdeadc0de  
MHARTID : 0x00000000  
Please enable CONFIG_ESP_SYSTEM_USE_FRAME_POINTER option to have a full backtrace.
[1;31mE (450450) task_wdt: Task watchdog got triggered. The following tasks/users did not reset the watchdog in time:[0m
[1;31mE (450450) task_wdt:  - IDLE (CPU 0)[0m
[1;31mE (450450) task_wdt: Tasks currently running:[0m
[1;31mE (450450) task_wdt: CPU 0: lvgl_task[0m
[1;31mE (450450) task_wdt: Print CPU 0 (current core) registers[0m
Core  0 register dump:
MEPC    : 0x42011e78  RA      : 0x42011e4e  SP      : 0x3fcacea0  GP      : 0x3fc8f600  
TP      : 0x3fcacfb0  T0      : 0x00000000  T1      : 0x40000000  T2      : 0x00000000  
S0/FP   : 0x3fc91d70  S1      : 0x3fc92098  A0      : 0x00000001  A1      : 0x00000000  
A2      : 0x3fc92cd4  A3      : 0x00000035  A4      : 0x3fc92c2c  A5      : 0x00000001  
A6      : 0x00000014  A7      : 0x0000000a  S2      : 0x00000000  S3      : 0x3fc920b0  
S4      : 0x00000027  S5      : 0x00000014  S6      : 0x00000000  S7      : 0x00000000  
S8      : 0x00000000  S9      : 0x00000000  S10     : 0x00000000  S11     : 0x00000000  
T3      : 0x00000000  T4      : 0x00000000  T5      : 0x00000000  T6      : 0x00000000  
MSTATUS : 0x00001889  MTVEC   : 0x40380001  MCAUSE  : 0xdeadc0de  MTVAL   : 0xdeadc0de  
MHARTID : 0x00000000  
Please enable CONFIG_ESP_SYSTEM_USE_FRAME_POINTER option to have a full backtrace.
[1;31mE (455450) task_wdt: Task watchdog got triggered. The following tasks/users did not reset the watchdog in time:[0m
[1;31mE (455450) task_wdt:  - IDLE (CPU 0)[0m
[1;31mE (455450) task_wdt: Tasks currently running:[0m
[1;31mE (455450) task_wdt: CPU 0: lvgl_task[0m
[1;31mE (455450) task_wdt: Print CPU 0 (current core) registers[0m
Core  0 register dump:
MEPC    : 0x42011e78  RA      : 0x42011e4e  SP      : 0x3fcacea0  GP      : 0x3fc8f600  
TP      : 0x3fcacfb0  T0      : 0x00000000  T1      : 0x40000000  T2      : 0x00000000  
S0/FP   : 0x3fc91d70  S1      : 0x3fc92098  A0      : 0x00000001  A1      : 0x00000000  
A2      : 0x3fc92cd4  A3      : 0x00000035  A4      : 0x3fc92c2c  A5      : 0x00000001  
A6      : 0x00000014  A7      : 0x0000000a  S2      : 0x00000000  S3      : 0x3fc920b0  
S4      : 0x00000027  S5      : 0x00000014  S6      : 0x00000000  S7      : 0x00000000  
S8      : 0x00000000  S9      : 0x00000000  S10     : 0x00000000  S11     : 0x00000000  
T3      : 0x00000000  T4      : 0x00000000  T5      : 0x00000000  T6      : 0x00000000  
MSTATUS : 0x00001889  MTVEC   : 0x40380001  MCAUSE  : 0xdeadc0de  MTVAL   : 0xdeadc0de  
MHARTID : 0x00000000  
Please enable CONFIG_ESP_SYSTEM_USE_FRAME_POINTER option to have a full backtrace.
[1;31mE (460450) task_wdt: Task watchdog got triggered. The following tasks/users did not reset the watchdog in time:[0m
[1;31mE (460450) task_wdt:  - IDLE (CPU 0)[0m
[1;31mE (460450) task_wdt: Tasks currently running:[0m
[1;31mE (460450) task_wdt: CPU 0: lvgl_task[0m
[1;31mE (460450) task_wdt: Print CPU 0 (current core) registers[0m
Core  0 register dump:
MEPC    : 0x42011e78  RA      : 0x42011e4e  SP      : 0x3fcacea0  GP      : 0x3fc8f600  
TP      : 0x3fcacfb0  T0      : 0x00000000  T1      : 0x40000000  T2      : 0x00000000  
S0/FP   : 0x3fc91d70  S1      : 0x3fc92098  A0      : 0x00000001  A1      : 0x00000000  
A2      : 0x3fc92cd4  A3      : 0x00000035  A4      : 0x3fc92c2c  A5      : 0x00000001  
A6      : 0x00000014  A7      : 0x0000000a  S2      : 0x00000000  S3      : 0x3fc920b0  
S4      : 0x00000027  S5      : 0x00000014  S6      : 0x00000000  S7      : 0x00000000  
S8      : 0x00000000  S9      : 0x00000000  S10     : 0x00000000  S11     : 0x00000000  
T3      : 0x00000000  T4      : 0x00000000  T5      : 0x00000000  T6      : 0x00000000  
MSTATUS : 0x00001889  MTVEC   : 0x40380001  MCAUSE  : 0xdeadc0de  MTVAL   : 0xdeadc0de  
MHARTID : 0x00000000  
Please enable CONFIG_ESP_SYSTEM_USE_FRAME_POINTER option to have a full backtrace.
[1;31mE (465450) task_wdt: Task watchdog got triggered. The following tasks/users did not reset the watchdog in time:[0m
[1;31mE (465450) task_wdt:  - IDLE (CPU 0)[0m
[1;31mE (465450) task_wdt: Tasks currently running:[0m
[1;31mE (465450) task_wdt: CPU 0: lvgl_task[0m
[1;31mE (465450) task_wdt: Print CPU 0 (current core) registers[0m
Core  0 register dump:
MEPC    : 0x42011e78  RA      : 0x42011e4e  SP      : 0x3fcacea0  GP      : 0x3fc8f600  
TP      : 0x3fcacfb0  T0      : 0x00000000  T1      : 0x40000000  T2      : 0x00000000  
S0/FP   : 0x3fc91d70  S1      : 0x3fc92098  A0      : 0x00000001  A1      : 0x00000000  
A2      : 0x3fc92cd4  A3      : 0x00000035  A4      : 0x3fc92c2c  A5      : 0x00000001  
A6      : 0x00000014  A7      : 0x0000000a  S2      : 0x00000000  S3      : 0x3fc920b0  
S4      : 0x00000027  S5      : 0x00000014  S6      : 0x00000000  S7      : 0x00000000  
S8      : 0x00000000  S9      : 0x00000000  S10     : 0x00000000  S11     : 0x00000000  
T3      : 0x00000000  T4      : 0x00000000  T5      : 0x00000000  T6      : 0x00000000  
MSTATUS : 0x00001889  MTVEC   : 0x40380001  MCAUSE  : 0xdeadc0de  MTVAL   : 0xdeadc0de  
MHARTID : 0x00000000  
Please enable CONFIG_ESP_SYSTEM_USE_FRAME_POINTER option to have a full backtrace.
[1;31mE (470450) task_wdt: Task watchdog got triggered. The following tasks/users did not reset the watchdog in time:[0m
[1;31mE (470450) task_wdt:  - IDLE (CPU 0)[0m
[1;31mE (470450) task_wdt: Tasks currently running:[0m
[1;31mE (470450) task_wdt: CPU 0: lvgl_task[0m
[1;31mE (470450) task_wdt: Print CPU 0 (current core) registers[0m
Core  0 register dump:
MEPC    : 0x42011e78  RA      : 0x42011e4e  SP      : 0x3fcacea0  GP      : 0x3fc8f600  
TP      : 0x3fcacfb0  T0      : 0x00000000  T1      : 0x40000000  T2      : 0x00000000  
S0/FP   : 0x3fc91d70  S1      : 0x3fc92098  A0      : 0x00000001  A1      : 0x00000000  
A2      : 0x3fc92cd4  A3      : 0x00000035  A4      : 0x3fc92c2c  A5      : 0x00000001  
A6      : 0x00000014  A7      : 0x0000000a  S2      : 0x00000000  S3      : 0x3fc920b0  
S4      : 0x00000027  S5      : 0x00000014  S6      : 0x00000000  S7      : 0x00000000  
S8      : 0x00000000  S9      : 0x00000000  S10     : 0x00000000  S11     : 0x00000000  
T3      : 0x00000000  T4      : 0x00000000  T5      : 0x00000000  T6      : 0x00000000  
MSTATUS : 0x00001889  MTVEC   : 0x40380001  MCAUSE  : 0xdeadc0de  MTVAL   : 0xdeadc0de  
MHARTID : 0x00000000  
Please enable CONFIG_ESP_SYSTEM_USE_FRAME_POINTER option to have a full backtrace.
[1;31mE (475450) task_wdt: Task watchdog got triggered. The following tasks/users did not reset the watchdog in time:[0m
[1;31mE (475450) task_wdt:  - IDLE (CPU 0)[0m
[1;31mE (475450) task_wdt: Tasks currently running:[0m
[1;31mE (475450) task_wdt: CPU 0: lvgl_task[0m
[1;31mE (475450) task_wdt: Print CPU 0 (current core) registers[0m
Core  0 register dump:
MEPC    : 0x42011e78  RA      : 0x42011e4e  SP      : 0x3fcacea0  GP      : 0x3fc8f600  
TP      : 0x3fcacfb0  T0      : 0x00000000  T1      : 0x40000000  T2      : 0x00000000  
S0/FP   : 0x3fc91d70  S1      : 0x3fc92098  A0      : 0x00000001  A1      : 0x00000000  
A2      : 0x3fc92cd4  A3      : 0x00000035  A4      : 0x3fc92c2c  A5      : 0x00000001  
A6      : 0x00000014  A7      : 0x0000000a  S2      : 0x00000000  S3      : 0x3fc920b0  
S4      : 0x00000027  S5      : 0x00000014  S6      : 0x00000000  S7      : 0x00000000  
S8      : 0x00000000  S9      : 0x00000000  S10     : 0x00000000  S11     : 0x00000000  
T3      : 0x00000000  T4      : 0x00000000  T5      : 0x00000000  T6      : 0x00000000  
MSTATUS : 0x00001889  MTVEC   : 0x40380001  MCAUSE  : 0xdeadc0de  MTVAL   : 0xdeadc0de  
MHARTID : 0x00000000  
Please enable CONFIG_ESP_SYSTEM_USE_FRAME_POINTER option to have a full backtrace.
[1;31mE (480450) task_wdt: Task watchdog got triggered. The following tasks/users did not reset the watchdog in time:[0m
[1;31mE (480450) task_wdt:  - IDLE (CPU 0)[0m
[1;31mE (480450) task_wdt: Tasks currently running:[0m
[1;31mE (480450) task_wdt: CPU 0: lvgl_task[0m
[1;31mE (480450) task_wdt: Print CPU 0 (current core) registers[0m
Core  0 register dump:
MEPC    : 0x42011e78  RA      : 0x42011e4e  SP      : 0x3fcacea0  GP      : 0x3fc8f600  
TP      : 0x3fcacfb0  T0      : 0x00000000  T1      : 0x40000000  T2      : 0x00000000  
S0/FP   : 0x3fc91d70  S1      : 0x3fc92098  A0      : 0x00000001  A1      : 0x00000000  
A2      : 0x3fc92cd4  A3      : 0x00000035  A4      : 0x3fc92c2c  A5      : 0x00000001  
A6      : 0x00000014  A7      : 0x0000000a  S2      : 0x00000000  S3      : 0x3fc920b0  
S4      : 0x00000027  S5      : 0x00000014  S6      : 0x00000000  S7      : 0x00000000  
S8      : 0x00000000  S9      : 0x00000000  S10     : 0x00000000  S11     : 0x00000000  
T3      : 0x00000000  T4      : 0x00000000  T5      : 0x00000000  T6      : 0x00000000  
MSTATUS : 0x00001889  MTVEC   : 0x40380001  MCAUSE  : 0xdeadc0de  MTVAL   : 0xdeadc0de  
MHARTID : 0x00000000  
Please enable CONFIG_ESP_SYSTEM_USE_FRAME_POINTER option to have a full backtrace.
[1;31mE (485450) task_wdt: Task watchdog got triggered. The following tasks/users did not reset the watchdog in time:[0m
[1;31mE (485450) task_wdt:  - IDLE (CPU 0)[0m
[1;31mE (485450) task_wdt: Tasks currently running:[0m
[1;31mE (485450) task_wdt: CPU 0: lvgl_task[0m
[1;31mE (485450) task_wdt: Print CPU 0 (current core) registers[0m
Core  0 register dump:
MEPC    : 0x42011e78  RA      : 0x42011e4e  SP      : 0x3fcacea0  GP      : 0x3fc8f600  
TP      : 0x3fcacfb0  T0      : 0x00000000  T1      : 0x40000000  T2      : 0x00000000  
S0/FP   : 0x3fc91d70  S1      : 0x3fc92098  A0      : 0x00000001  A1      : 0x00000000  
A2      : 0x3fc92cd4  A3      : 0x00000035  A4      : 0x3fc92c2c  A5      : 0x00000001  
A6      : 0x00000014  A7      : 0x0000000a  S2      : 0x00000000  S3      : 0x3fc920b0  
S4      : 0x00000027  S5      : 0x00000014  S6      : 0x00000000  S7      : 0x00000000  
S8      : 0x00000000  S9      : 0x00000000  S10     : 0x00000000  S11     : 0x00000000  
T3      : 0x00000000  T4      : 0x00000000  T5      : 0x00000000  T6      : 0x00000000  
MSTATUS : 0x00001889  MTVEC   : 0x40380001  MCAUSE  : 0xdeadc0de  MTVAL   : 0xdeadc0de  
MHARTID : 0x00000000  
Please enable CONFIG_ESP_SYSTEM_USE_FRAME_POINTER option to have a full backtrace.
[1;31mE (490450) task_wdt: Task watchdog got triggered. The following tasks/users did not reset the watchdog in time:[0m
[1;31mE (490450) task_wdt:  - IDLE (CPU 0)[0m
[1;31mE (490450) task_wdt: Tasks currently running:[0m
[1;31mE (490450) task_wdt: CPU 0: lvgl_task[0m
[1;31mE (490450) task_wdt: Print CPU 0 (current core) registers[0m
Core  0 register dump:
MEPC    : 0x42011e78  RA      : 0x42011e4e  SP      : 0x3fcacea0  GP      : 0x3fc8f600  
TP      : 0x3fcacfb0  T0      : 0x00000000  T1      : 0x40000000  T2      : 0x00000000  
S0/FP   : 0x3fc91d70  S1      : 0x3fc92098  A0      : 0x00000001  A1      : 0x00000000  
A2      : 0x3fc92cd4  A3      : 0x00000035  A4      : 0x3fc92c2c  A5      : 0x00000001  
A6      : 0x00000014  A7      : 0x0000000a  S2      : 0x00000000  S3      : 0x3fc920b0  
S4      : 0x00000027  S5      : 0x00000014  S6      : 0x00000000  S7      : 0x00000000  
S8      : 0x00000000  S9      : 0x00000000  S10     : 0x00000000  S11     : 0x00000000  
T3      : 0x00000000  T4      : 0x00000000  T5      : 0x00000000  T6      : 0x00000000  
MSTATUS : 0x00001889  MTVEC   : 0x40380001  MCAUSE  : 0xdeadc0de  MTVAL   : 0xdeadc0de  
MHARTID : 0x00000000  
Please enable CONFIG_ESP_SYSTEM_USE_FRAME_POINTER option to have a full backtrace.
[1;31mE (495450) task_wdt: Task watchdog got triggered. The following tasks/users did not reset the watchdog in time:[0m
[1;31mE (495450) task_wdt:  - IDLE (CPU 0)[0m
[1;31mE (495450) task_wdt: Tasks currently running:[0m
[1;31mE (495450) task_wdt: CPU 0: lvgl_task[0m
[1;31mE (495450) task_wdt: Print CPU 0 (current core) registers[0m
Core  0 register dump:
MEPC    : 0x42011e78  RA      : 0x42011e4e  SP      : 0x3fcacea0  GP      : 0x3fc8f600  
TP      : 0x3fcacfb0  T0      : 0x00000000  T1      : 0x40000000  T2      : 0x00000000  
S0/FP   : 0x3fc91d70  S1      : 0x3fc92098  A0      : 0x00000001  A1      : 0x00000000  
A2      : 0x3fc92cd4  A3      : 0x00000035  A4      : 0x3fc92c2c  A5      : 0x00000001  
A6      : 0x00000014  A7      : 0x0000000a  S2      : 0x00000000  S3      : 0x3fc920b0  
S4      : 0x00000027  S5      : 0x00000014  S6      : 0x00000000  S7      : 0x00000000  
S8      : 0x00000000  S9      : 0x00000000  S10     : 0x00000000  S11     : 0x00000000  
T3      : 0x00000000  T4      : 0x00000000  T5      : 0x00000000  T6      : 0x00000000  
MSTATUS : 0x00001889  MTVEC   : 0x40380001  MCAUSE  : 0xdeadc0de  MTVAL   : 0xdeadc0de  
MHARTID : 0x00000000  
Please enable CONFIG_ESP_SYSTEM_USE_FRAME_POINTER option to have a full backtrace.
[1;31mE (500450) task_wdt: Task watchdog got triggered. The following tasks/users did not reset the watchdog in time:[0m
[1;31mE (500450) task_wdt:  - IDLE (CPU 0)[0m
[1;31mE (500450) task_wdt: Tasks currently running:[0m
[1;31mE (500450) task_wdt: CPU 0: lvgl_task[0m
[1;31mE (500450) task_wdt: Print CPU 0 (current core) registers[0m
Core  0 register dump:
MEPC    : 0x42011e78  RA      : 0x42011e4e  SP      : 0x3fcacea0  GP      : 0x3fc8f600  
TP      : 0x3fcacfb0  T0      : 0x00000000  T1      : 0x40000000  T2      : 0x00000000  
S0/FP   : 0x3fc91d70  S1      : 0x3fc92098  A0      : 0x00000001  A1      : 0x00000000  
A2      : 0x3fc92cd4  A3      : 0x00000035  A4      : 0x3fc92c2c  A5      : 0x00000001  
A6      : 0x00000014  A7      : 0x0000000a  S2      : 0x00000000  S3      : 0x3fc920b0  
S4      : 0x00000027  S5      : 0x00000014  S6      : 0x00000000  S7      : 0x00000000  
S8      : 0x00000000  S9      : 0x00000000  S10     : 0x00000000  S11     : 0x00000000  
T3      : 0x00000000  T4      : 0x00000000  T5      : 0x00000000  T6      : 0x00000000  
MSTATUS : 0x00001889  MTVEC   : 0x40380001  MCAUSE  : 0xdeadc0de  MTVAL   : 0xdeadc0de  
MHARTID : 0x00000000  
Please enable CONFIG_ESP_SYSTEM_USE_FRAME_POINTER option to have a full backtrace.
[1;31mE (505450) task_wdt: Task watchdog got triggered. The following tasks/users did not reset the watchdog in time:[0m
[1;31mE (505450) task_wdt:  - IDLE (CPU 0)[0m
[1;31mE (505450) task_wdt: Tasks currently running:[0m
[1;31mE (505450) task_wdt: CPU 0: lvgl_task[0m
[1;31mE (505450) task_wdt: Print CPU 0 (current core) registers[0m
Core  0 register dump:
MEPC    : 0x42011e78  RA      : 0x42011e4e  SP      : 0x3fcacea0  GP      : 0x3fc8f600  
TP      : 0x3fcacfb0  T0      : 0x00000000  T1      : 0x40000000  T2      : 0x00000000  
S0/FP   : 0x3fc91d70  S1      : 0x3fc92098  A0      : 0x00000001  A1      : 0x00000000  
A2      : 0x3fc92cd4  A3      : 0x00000035  A4      : 0x3fc92c2c  A5      : 0x00000001  
A6      : 0x00000014  A7      : 0x0000000a  S2      : 0x00000000  S3      : 0x3fc920b0  
S4      : 0x00000027  S5      : 0x00000014  S6      : 0x00000000  S7      : 0x00000000  
S8      : 0x00000000  S9      : 0x00000000  S10     : 0x00000000  S11     : 0x00000000  
T3      : 0x00000000  T4      : 0x00000000  T5      : 0x00000000  T6      : 0x00000000  
MSTATUS : 0x00001889  MTVEC   : 0x40380001  MCAUSE  : 0xdeadc0de  MTVAL   : 0xdeadc0de  
MHARTID : 0x00000000  
Please enable CONFIG_ESP_SYSTEM_USE_FRAME_POINTER option to have a full backtrace.
[1;31mE (510450) task_wdt: Task watchdog got triggered. The following tasks/users did not reset the watchdog in time:[0m
[1;31mE (510450) task_wdt:  - IDLE (CPU 0)[0m
[1;31mE (510450) task_wdt: Tasks currently running:[0m
[1;31mE (510450) task_wdt: CPU 0: lvgl_task[0m
[1;31mE (510450) task_wdt: Print CPU 0 (current core) registers[0m
Core  0 register dump:
MEPC    : 0x42011e78  RA      : 0x42011e4e  SP      : 0x3fcacea0  GP      : 0x3fc8f600  
TP      : 0x3fcacfb0  T0      : 0x00000000  T1      : 0x40000000  T2      : 0x00000000  
S0/FP   : 0x3fc91d70  S1      : 0x3fc92098  A0      : 0x00000001  A1      : 0x00000000  
A2      : 0x3fc92cd4  A3      : 0x00000035  A4      : 0x3fc92c2c  A5      : 0x00000001  
A6      : 0x00000014  A7      : 0x0000000a  S2      : 0x00000000  S3      : 0x3fc920b0  
S4      : 0x00000027  S5      : 0x00000014  S6      : 0x00000000  S7      : 0x00000000  
S8      : 0x00000000  S9      : 0x00000000  S10     : 0x00000000  S11     : 0x00000000  
T3      : 0x00000000  T4      : 0x00000000  T5      : 0x00000000  T6      : 0x00000000  
MSTATUS : 0x00001889  MTVEC   : 0x40380001  MCAUSE  : 0xdeadc0de  MTVAL   : 0xdeadc0de  
MHARTID : 0x00000000  
Please enable CONFIG_ESP_SYSTEM_USE_FRAME_POINTER option to have a full backtrace.
[1;31mE (515450) task_wdt: Task watchdog got triggered. The following tasks/users did not reset the watchdog in time:[0m
[1;31mE (515450) task_wdt:  - IDLE (CPU 0)[0m
[1;31mE (515450) task_wdt: Tasks currently running:[0m
[1;31mE (515450) task_wdt: CPU 0: lvgl_task[0m
[1;31mE (515450) task_wdt: Print CPU 0 (current core) registers[0m
Core  0 register dump:
MEPC    : 0x42011e78  RA      : 0x42011e4e  SP      : 0x3fcacea0  GP      : 0x3fc8f600  
TP      : 0x3fcacfb0  T0      : 0x00000000  T1      : 0x40000000  T2      : 0x00000000  
S0/FP   : 0x3fc91d70  S1      : 0x3fc92098  A0      : 0x00000001  A1      : 0x00000000  
A2      : 0x3fc92cd4  A3      : 0x00000035  A4      : 0x3fc92c2c  A5      : 0x00000001  
A6      : 0x00000014  A7      : 0x0000000a  S2      : 0x00000000  S3      : 0x3fc920b0  
S4      : 0x00000027  S5      : 0x00000014  S6      : 0x00000000  S7      : 0x00000000  
S8      : 0x00000000  S9      : 0x00000000  S10     : 0x00000000  S11     : 0x00000000  
T3      : 0x00000000  T4      : 0x00000000  T5      : 0x00000000  T6      : 0x00000000  
MSTATUS : 0x00001889  MTVEC   : 0x40380001  MCAUSE  : 0xdeadc0de  MTVAL   : 0xdeadc0de  
MHARTID : 0x00000000  
Please enable CONFIG_ESP_SYSTEM_USE_FRAME_POINTER option to have a full backtrace.
[1;31mE (520450) task_wdt: Task watchdog got triggered. The following tasks/users did not reset the watchdog in time:[0m
[1;31mE (520450) task_wdt:  - IDLE (CPU 0)[0m
[1;31mE (520450) task_wdt: Tasks currently running:[0m
[1;31mE (520450) task_wdt: CPU 0: lvgl_task[0m
[1;31mE (520450) task_wdt: Print CPU 0 (current core) registers[0m
Core  0 register dump:
MEPC    : 0x42011e78  RA      : 0x42011e4e  SP      : 0x3fcacea0  GP      : 0x3fc8f600  
TP      : 0x3fcacfb0  T0      : 0x00000000  T1      : 0x40000000  T2      : 0x00000000  
S0/FP   : 0x3fc91d70  S1      : 0x3fc92098  A0      : 0x00000001  A1      : 0x00000000  
A2      : 0x3fc92cd4  A3      : 0x00000035  A4      : 0x3fc92c2c  A5      : 0x00000001  
A6      : 0x00000014  A7      : 0x0000000a  S2      : 0x00000000  S3      : 0x3fc920b0  
S4      : 0x00000027  S5      : 0x00000014  S6      : 0x00000000  S7      : 0x00000000  
S8      : 0x00000000  S9      : 0x00000000  S10     : 0x00000000  S11     : 0x00000000  
T3      : 0x00000000  T4      : 0x00000000  T5      : 0x00000000  T6      : 0x00000000  
MSTATUS : 0x00001889  MTVEC   : 0x40380001  MCAUSE  : 0xdeadc0de  MTVAL   : 0xdeadc0de  
MHARTID : 0x00000000  
Please enable CONFIG_ESP_SYSTEM_USE_FRAME_POINTER option to have a full backtrace.
[1;31mE (525450) task_wdt: Task watchdog got triggered. The following tasks/users did not reset the watchdog in time:[0m
[1;31mE (525450) task_wdt:  - IDLE (CPU 0)[0m
[1;31mE (525450) task_wdt: Tasks currently running:[0m
[1;31mE (525450) task_wdt: CPU 0: lvgl_task[0m
[1;31mE (525450) task_wdt: Print CPU 0 (current core) registers[0m
Core  0 register dump:
MEPC    : 0x42011e78  RA      : 0x42011e4e  SP      : 0x3fcacea0  GP      : 0x3fc8f600  
TP      : 0x3fcacfb0  T0      : 0x00000000  T1      : 0x40000000  T2      : 0x00000000  
S0/FP   : 0x3fc91d70  S1      : 0x3fc92098  A0      : 0x00000001  A1      : 0x00000000  
A2      : 0x3fc92cd4  A3      : 0x00000035  A4      : 0x3fc92c2c  A5      : 0x00000001  
A6      : 0x00000014  A7      : 0x0000000a  S2      : 0x00000000  S3      : 0x3fc920b0  
S4      : 0x00000027  S5      : 0x00000014  S6      : 0x00000000  S7      : 0x00000000  
S8      : 0x00000000  S9      : 0x00000000  S10     : 0x00000000  S11     : 0x00000000  
T3      : 0x00000000  T4      : 0x00000000  T5      : 0x00000000  T6      : 0x00000000  
MSTATUS : 0x00001889  MTVEC   : 0x40380001  MCAUSE  : 0xdeadc0de  MTVAL   : 0xdeadc0de  
MHARTID : 0x00000000  
Please enable CONFIG_ESP_SYSTEM_USE_FRAME_POINTER option to have a full backtrace.
[1;31mE (530450) task_wdt: Task watchdog got triggered. The following tasks/users did not reset the watchdog in time:[0m
[1;31mE (530450) task_wdt:  - IDLE (CPU 0)[0m
[1;31mE (530450) task_wdt: Tasks currently running:[0m
[1;31mE (530450) task_wdt: CPU 0: lvgl_task[0m
[1;31mE (530450) task_wdt: Print CPU 0 (current core) registers[0m
Core  0 register dump:
MEPC    : 0x42011e78  RA      : 0x42011e4e  SP      : 0x3fcacea0  GP      : 0x3fc8f600  
TP      : 0x3fcacfb0  T0      : 0x00000000  T1      : 0x40000000  T2      : 0x00000000  
S0/FP   : 0x3fc91d70  S1      : 0x3fc92098  A0      : 0x00000001  A1      : 0x00000000  
A2      : 0x3fc92cd4  A3      : 0x00000035  A4      : 0x3fc92c2c  A5      : 0x00000001  
A6      : 0x00000014  A7      : 0x0000000a  S2      : 0x00000000  S3      : 0x3fc920b0  
S4      : 0x00000027  S5      : 0x00000014  S6      : 0x00000000  S7      : 0x00000000  
S8      : 0x00000000  S9      : 0x00000000  S10     : 0x00000000  S11     : 0x00000000  
T3      : 0x00000000  T4      : 0x00000000  T5      : 0x00000000  T6      : 0x00000000  
MSTATUS : 0x00001889  MTVEC   : 0x40380001  MCAUSE  : 0xdeadc0de  MTVAL   : 0xdeadc0de  
MHARTID : 0x00000000  
Please enable CONFIG_ESP_SYSTEM_USE_FRAME_POINTER option to have a full backtrace.
[1;31mE (535450) task_wdt: Task watchdog got triggered. The following tasks/users did not reset the watchdog in time:[0m
[1;31mE (535450) task_wdt:  - IDLE (CPU 0)[0m
[1;31mE (535450) task_wdt: Tasks currently running:[0m
[1;31mE (535450) task_wdt: CPU 0: lvgl_task[0m
[1;31mE (535450) task_wdt: Print CPU 0 (current core) registers[0m
Core  0 register dump:
MEPC    : 0x42011e78  RA      : 0x42011e4e  SP      : 0x3fcacea0  GP      : 0x3fc8f600  
TP      : 0x3fcacfb0  T0      : 0x00000000  T1      : 0x40000000  T2      : 0x00000000  
S0/FP   : 0x3fc91d70  S1      : 0x3fc92098  A0      : 0x00000001  A1      : 0x00000000  
A2      : 0x3fc92cd4  A3      : 0x00000035  A4      : 0x3fc92c2c  A5      : 0x00000001  
A6      : 0x00000014  A7      : 0x0000000a  S2      : 0x00000000  S3      : 0x3fc920b0  
S4      : 0x00000027  S5      : 0x00000014  S6      : 0x00000000  S7      : 0x00000000  
S8      : 0x00000000  S9      : 0x00000000  S10     : 0x00000000  S11     : 0x00000000  
T3      : 0x00000000  T4      : 0x00000000  T5      : 0x00000000  T6      : 0x00000000  
MSTATUS : 0x00001889  MTVEC   : 0x40380001  MCAUSE  : 0xdeadc0de  MTVAL   : 0xdeadc0de  
MHARTID : 0x00000000  
Please enable CONFIG_ESP_SYSTEM_USE_FRAME_POINTER option to have a full backtrace.
[1;31mE (540450) task_wdt: Task watchdog got triggered. The following tasks/users did not reset the watchdog in time:[0m
[1;31mE (540450) task_wdt:  - IDLE (CPU 0)[0m
[1;31mE (540450) task_wdt: Tasks currently running:[0m
[1;31mE (540450) task_wdt: CPU 0: lvgl_task[0m
[1;31mE (540450) task_wdt: Print CPU 0 (current core) registers[0m
Core  0 register dump:
MEPC    : 0x42011e78  RA      : 0x42011e4e  SP      : 0x3fcacea0  GP      : 0x3fc8f600  
TP      : 0x3fcacfb0  T0      : 0x00000000  T1      : 0x40000000  T2      : 0x00000000  
S0/FP   : 0x3fc91d70  S1      : 0x3fc92098  A0      : 0x00000001  A1      : 0x00000000  
A2      : 0x3fc92cd4  A3      : 0x00000035  A4      : 0x3fc92c2c  A5      : 0x00000001  
A6      : 0x00000014  A7      : 0x0000000a  S2      : 0x00000000  S3      : 0x3fc920b0  
S4      : 0x00000027  S5      : 0x00000014  S6      : 0x00000000  S7      : 0x00000000  
S8      : 0x00000000  S9      : 0x00000000  S10     : 0x00000000  S11     : 0x00000000  
T3      : 0x00000000  T4      : 0x00000000  T5      : 0x00000000  T6      : 0x00000000  
MSTATUS : 0x00001889  MTVEC   : 0x40380001  MCAUSE  : 0xdeadc0de  MTVAL   : 0xdeadc0de  
MHARTID : 0x00000000  
Please enable CONFIG_ESP_SYSTEM_USE_FRAME_POINTER option to have a full backtrace.
[1;31mE (545450) task_wdt: Task watchdog got triggered. The following tasks/users did not reset the watchdog in time:[0m
[1;31mE (545450) task_wdt:  - IDLE (CPU 0)[0m
[1;31mE (545450) task_wdt: Tasks currently running:[0m
[1;31mE (545450) task_wdt: CPU 0: lvgl_task[0m
[1;31mE (545450) task_wdt: Print CPU 0 (current core) registers[0m
Core  0 register dump:
MEPC    : 0x42011e78  RA      : 0x42011e4e  SP      : 0x3fcacea0  GP      : 0x3fc8f600  
TP      : 0x3fcacfb0  T0      : 0x00000000  T1      : 0x40000000  T2      : 0x00000000  
S0/FP   : 0x3fc91d70  S1      : 0x3fc92098  A0      : 0x00000001  A1      : 0x00000000  
A2      : 0x3fc92cd4  A3      : 0x00000035  A4      : 0x3fc92c2c  A5      : 0x00000001  
A6      : 0x00000014  A7      : 0x0000000a  S2      : 0x00000000  S3      : 0x3fc920b0  
S4      : 0x00000027  S5      : 0x00000014  S6      : 0x00000000  S7      : 0x00000000  
S8      : 0x00000000  S9      : 0x00000000  S10     : 0x00000000  S11     : 0x00000000  
T3      : 0x00000000  T4      : 0x00000000  T5      : 0x00000000  T6      : 0x00000000  
MSTATUS : 0x00001889  MTVEC   : 0x40380001  MCAUSE  : 0xdeadc0de  MTVAL   : 0xdeadc0de  
MHARTID : 0x00000000  
Please enable CONFIG_ESP_SYSTEM_USE_FRAME_POINTER option to have a full backtrace.
[1;31mE (550450) task_wdt: Task watchdog got triggered. The following tasks/users did not reset the watchdog in time:[0m
[1;31mE (550450) task_wdt:  - IDLE (CPU 0)[0m
[1;31mE (550450) task_wdt: Tasks currently running:[0m
[1;31mE (550450) task_wdt: CPU 0: lvgl_task[0m
[1;31mE (550450) task_wdt: Print CPU 0 (current core) registers[0m
Core  0 register dump:
MEPC    : 0x42011e78  RA      : 0x42011e4e  SP      : 0x3fcacea0  GP      : 0x3fc8f600  
TP      : 0x3fcacfb0  T0      : 0x00000000  T1      : 0x40000000  T2      : 0x00000000  
S0/FP   : 0x3fc91d70  S1      : 0x3fc92098  A0      : 0x00000001  A1      : 0x00000000  
A2      : 0x3fc92cd4  A3      : 0x00000035  A4      : 0x3fc92c2c  A5      : 0x00000001  
A6      : 0x00000014  A7      : 0x0000000a  S2      : 0x00000000  S3      : 0x3fc920b0  
S4      : 0x00000027  S5      : 0x00000014  S6      : 0x00000000  S7      : 0x00000000  
S8      : 0x00000000  S9      : 0x00000000  S10     : 0x00000000  S11     : 0x00000000  
T3      : 0x00000000  T4      : 0x00000000  T5      : 0x00000000  T6      : 0x00000000  
MSTATUS : 0x00001889  MTVEC   : 0x40380001  MCAUSE  : 0xdeadc0de  MTVAL   : 0xdeadc0de  
MHARTID : 0x00000000  
Please enable CONFIG_ESP_SYSTEM_USE_FRAME_POINTER option to have a full backtrace.
[1;31mE (555450) task_wdt: Task watchdog got triggered. The following tasks/users did not reset the watchdog in time:[0m
[1;31mE (555450) task_wdt:  - IDLE (CPU 0)[0m
[1;31mE (555450) task_wdt: Tasks currently running:[0m
[1;31mE (555450) task_wdt: CPU 0: lvgl_task[0m
[1;31mE (555450) task_wdt: Print CPU 0 (current core) registers[0m
Core  0 register dump:
MEPC    : 0x42011e78  RA      : 0x42011e4e  SP      : 0x3fcacea0  GP      : 0x3fc8f600  
TP      : 0x3fcacfb0  T0      : 0x00000000  T1      : 0x40000000  T2      : 0x00000000  
S0/FP   : 0x3fc91d70  S1      : 0x3fc92098  A0      : 0x00000001  A1      : 0x00000000  
A2      : 0x3fc92cd4  A3      : 0x00000035  A4      : 0x3fc92c2c  A5      : 0x00000001  
A6      : 0x00000014  A7      : 0x0000000a  S2      : 0x00000000  S3      : 0x3fc920b0  
S4      : 0x00000027  S5      : 0x00000014  S6      : 0x00000000  S7      : 0x00000000  
S8      : 0x00000000  S9      : 0x00000000  S10     : 0x00000000  S11     : 0x00000000  
T3      : 0x00000000  T4      : 0x00000000  T5      : 0x00000000  T6      : 0x00000000  
MSTATUS : 0x00001889  MTVEC   : 0x40380001  MCAUSE  : 0xdeadc0de  MTVAL   : 0xdeadc0de  
MHARTID : 0x00000000  
Please enable CONFIG_ESP_SYSTEM_USE_FRAME_POINTER option to have a full backtrace.
[1;31mE (560450) task_wdt: Task watchdog got triggered. The following tasks/users did not reset the watchdog in time:[0m
[1;31mE (560450) task_wdt:  - IDLE (CPU 0)[0m
[1;31mE (560450) task_wdt: Tasks currently running:[0m
[1;31mE (560450) task_wdt: CPU 0: lvgl_task[0m
[1;31mE (560450) task_wdt: Print CPU 0 (current core) registers[0m
Core  0 register dump:
MEPC    : 0x42011e78  RA      : 0x42011e4e  SP      : 0x3fcacea0  GP      : 0x3fc8f600  
TP      : 0x3fcacfb0  T0      : 0x00000000  T1      : 0x40000000  T2      : 0x00000000  
S0/FP   : 0x3fc91d70  S1      : 0x3fc92098  A0      : 0x00000001  A1      : 0x00000000  
A2      : 0x3fc92cd4  A3      : 0x00000035  A4      : 0x3fc92c2c  A5      : 0x00000001  
A6      : 0x00000014  A7      : 0x0000000a  S2      : 0x00000000  S3      : 0x3fc920b0  
S4      : 0x00000027  S5      : 0x00000014  S6      : 0x00000000  S7      : 0x00000000  
S8      : 0x00000000  S9      : 0x00000000  S10     : 0x00000000  S11     : 0x00000000  
T3      : 0x00000000  T4      : 0x00000000  T5      : 0x00000000  T6      : 0x00000000  
MSTATUS : 0x00001889  MTVEC   : 0x40380001  MCAUSE  : 0xdeadc0de  MTVAL   : 0xdeadc0de  
MHARTID : 0x00000000  
Please enable CONFIG_ESP_SYSTEM_USE_FRAME_POINTER option to have a full backtrace.
[1;31mE (565450) task_wdt: Task watchdog got triggered. The following tasks/users did not reset the watchdog in time:[0m
[1;31mE (565450) task_wdt:  - IDLE (CPU 0)[0m
[1;31mE (565450) task_wdt: Tasks currently running:[0m
[1;31mE (565450) task_wdt: CPU 0: lvgl_task[0m
[1;31mE (565450) task_wdt: Print CPU 0 (current core) registers[0m
Core  0 register dump:
MEPC    : 0x42011e78  RA      : 0x42011e4e  SP      : 0x3fcacea0  GP      : 0x3fc8f600  
TP      : 0x3fcacfb0  T0      : 0x00000000  T1      : 0x40000000  T2      : 0x00000000  
S0/FP   : 0x3fc91d70  S1      : 0x3fc92098  A0      : 0x00000001  A1      : 0x00000000  
A2      : 0x3fc92cd4  A3      : 0x00000035  A4      : 0x3fc92c2c  A5      : 0x00000001  
A6      : 0x00000014  A7      : 0x0000000a  S2      : 0x00000000  S3      : 0x3fc920b0  
S4      : 0x00000027  S5      : 0x00000014  S6      : 0x00000000  S7      : 0x00000000  
S8      : 0x00000000  S9      : 0x00000000  S10     : 0x00000000  S11     : 0x00000000  
T3      : 0x00000000  T4      : 0x00000000  T5      : 0x00000000  T6      : 0x00000000  
MSTATUS : 0x00001889  MTVEC   : 0x40380001  MCAUSE  : 0xdeadc0de  MTVAL   : 0xdeadc0de  
MHARTID : 0x00000000  
Please enable CONFIG_ESP_SYSTEM_USE_FRAME_POINTER option to have a full backtrace.
[1;31mE (570450) task_wdt: Task watchdog got triggered. The following tasks/users did not reset the watchdog in time:[0m
[1;31mE (570450) task_wdt:  - IDLE (CPU 0)[0m
[1;31mE (570450) task_wdt: Tasks currently running:[0m
[1;31mE (570450) task_wdt: CPU 0: lvgl_task[0m
[1;31mE (570450) task_wdt: Print CPU 0 (current core) registers[0m
Core  0 register dump:
MEPC    : 0x42011e78  RA      : 0x42011e4e  SP      : 0x3fcacea0  GP      : 0x3fc8f600  
TP      : 0x3fcacfb0  T0      : 0x00000000  T1      : 0x40000000  T2      : 0x00000000  
S0/FP   : 0x3fc91d70  S1      : 0x3fc92098  A0      : 0x00000001  A1      : 0x00000000  
A2      : 0x3fc92cd4  A3      : 0x00000035  A4      : 0x3fc92c2c  A5      : 0x00000001  
A6      : 0x00000014  A7      : 0x0000000a  S2      : 0x00000000  S3      : 0x3fc920b0  
S4      : 0x00000027  S5      : 0x00000014  S6      : 0x00000000  S7      : 0x00000000  
S8      : 0x00000000  S9      : 0x00000000  S10     : 0x00000000  S11     : 0x00000000  
T3      : 0x00000000  T4      : 0x00000000  T5      : 0x00000000  T6      : 0x00000000  
MSTATUS : 0x00001889  MTVEC   : 0x40380001  MCAUSE  : 0xdeadc0de  MTVAL   : 0xdeadc0de  
MHARTID : 0x00000000  
Please enable CONFIG_ESP_SYSTEM_USE_FRAME_POINTER option to have a full backtrace.
[1;31mE (575450) task_wdt: Task watchdog got triggered. The following tasks/users did not reset the watchdog in time:[0m
[1;31mE (575450) task_wdt:  - IDLE (CPU 0)[0m
[1;31mE (575450) task_wdt: Tasks currently running:[0m
[1;31mE (575450) task_wdt: CPU 0: lvgl_task[0m
[1;31mE (575450) task_wdt: Print CPU 0 (current core) registers[0m
Core  0 register dump:
MEPC    : 0x42011e78  RA      : 0x42011e4e  SP      : 0x3fcacea0  GP      : 0x3fc8f600  
TP      : 0x3fcacfb0  T0      : 0x00000000  T1      : 0x40000000  T2      : 0x00000000  
S0/FP   : 0x3fc91d70  S1      : 0x3fc92098  A0      : 0x00000001  A1      : 0x00000000  
A2      : 0x3fc92cd4  A3      : 0x00000035  A4      : 0x3fc92c2c  A5      : 0x00000001  
A6      : 0x00000014  A7      : 0x0000000a  S2      : 0x00000000  S3      : 0x3fc920b0  
S4      : 0x00000027  S5      : 0x00000014  S6      : 0x00000000  S7      : 0x00000000  
S8      : 0x00000000  S9      : 0x00000000  S10     : 0x00000000  S11     : 0x00000000  
T3      : 0x00000000  T4      : 0x00000000  T5      : 0x00000000  T6      : 0x00000000  
MSTATUS : 0x00001889  MTVEC   : 0x40380001  MCAUSE  : 0xdeadc0de  MTVAL   : 0xdeadc0de  
MHARTID : 0x00000000  
Please enable CONFIG_ESP_SYSTEM_USE_FRAME_POINTER option to have a full backtrace.
[1;31mE (580450) task_wdt: Task watchdog got triggered. The following tasks/users did not reset the watchdog in time:[0m
[1;31mE (580450) task_wdt:  - IDLE (CPU 0)[0m
[1;31mE (580450) task_wdt: Tasks currently running:[0m
[1;31mE (580450) task_wdt: CPU 0: lvgl_task[0m
[1;31mE (580450) task_wdt: Print CPU 0 (current core) registers[0m
Core  0 register dump:
MEPC    : 0x42011e78  RA      : 0x42011e4e  SP      : 0x3fcacea0  GP      : 0x3fc8f600  
TP      : 0x3fcacfb0  T0      : 0x00000000  T1      : 0x40000000  T2      : 0x00000000  
S0/FP   : 0x3fc91d70  S1      : 0x3fc92098  A0      : 0x00000001  A1      : 0x00000000  
A2      : 0x3fc92cd4  A3      : 0x00000035  A4      : 0x3fc92c2c  A5      : 0x00000001  
A6      : 0x00000014  A7      : 0x0000000a  S2      : 0x00000000  S3      : 0x3fc920b0  
S4      : 0x00000027  S5      : 0x00000014  S6      : 0x00000000  S7      : 0x00000000  
S8      : 0x00000000  S9      : 0x00000000  S10     : 0x00000000  S11     : 0x00000000  
T3      : 0x00000000  T4      : 0x00000000  T5      : 0x00000000  T6      : 0x00000000  
MSTATUS : 0x00001889  MTVEC   : 0x40380001  MCAUSE  : 0xdeadc0de  MTVAL   : 0xdeadc0de  
MHARTID : 0x00000000  
Please enable CONFIG_ESP_SYSTEM_USE_FRAME_POINTER option to have a full backtrace.
[1;31mE (585450) task_wdt: Task watchdog got triggered. The following tasks/users did not reset the watchdog in time:[0m
[1;31mE (585450) task_wdt:  - IDLE (CPU 0)[0m
[1;31mE (585450) task_wdt: Tasks currently running:[0m
[1;31mE (585450) task_wdt: CPU 0: lvgl_task[0m
[1;31mE (585450) task_wdt: Print CPU 0 (current core) registers[0m
Core  0 register dump:
MEPC    : 0x42011e78  RA      : 0x42011e4e  SP      : 0x3fcacea0  GP      : 0x3fc8f600  
TP      : 0x3fcacfb0  T0      : 0x00000000  T1      : 0x40000000  T2      : 0x00000000  
S0/FP   : 0x3fc91d70  S1      : 0x3fc92098  A0      : 0x00000001  A1      : 0x00000000  
A2      : 0x3fc92cd4  A3      : 0x00000035  A4      : 0x3fc92c2c  A5      : 0x00000001  
A6      : 0x00000014  A7      : 0x0000000a  S2      : 0x00000000  S3      : 0x3fc920b0  
S4      : 0x00000027  S5      : 0x00000014  S6      : 0x00000000  S7      : 0x00000000  
S8      : 0x00000000  S9      : 0x00000000  S10     : 0x00000000  S11     : 0x00000000  
T3      : 0x00000000  T4      : 0x00000000  T5      : 0x00000000  T6      : 0x00000000  
MSTATUS : 0x00001889  MTVEC   : 0x40380001  MCAUSE  : 0xdeadc0de  MTVAL   : 0xdeadc0de  
MHARTID : 0x00000000  
Please enable CONFIG_ESP_SYSTEM_USE_FRAME_POINTER option to have a full backtrace.
[1;31mE (590450) task_wdt: Task watchdog got triggered. The following tasks/users did not reset the watchdog in time:[0m
[1;31mE (590450) task_wdt:  - IDLE (CPU 0)[0m
[1;31mE (590450) task_wdt: Tasks currently running:[0m
[1;31mE (590450) task_wdt: CPU 0: lvgl_task[0m
[1;31mE (590450) task_wdt: Print CPU 0 (current core) registers[0m
Core  0 register dump:
MEPC    : 0x42011e78  RA      : 0x42011e4e  SP      : 0x3fcacea0  GP      : 0x3fc8f600  
TP      : 0x3fcacfb0  T0      : 0x00000000  T1      : 0x40000000  T2      : 0x00000000  
S0/FP   : 0x3fc91d70  S1      : 0x3fc92098  A0      : 0x00000001  A1      : 0x00000000  
A2      : 0x3fc92cd4  A3      : 0x00000035  A4      : 0x3fc92c2c  A5      : 0x00000001  
A6      : 0x00000014  A7      : 0x0000000a  S2      : 0x00000000  S3      : 0x3fc920b0  
S4      : 0x00000027  S5      : 0x00000014  S6      : 0x00000000  S7      : 0x00000000  
S8      : 0x00000000  S9      : 0x00000000  S10     : 0x00000000  S11     : 0x00000000  
T3      : 0x00000000  T4      : 0x00000000  T5      : 0x00000000  T6      : 0x00000000  
MSTATUS : 0x00001889  MTVEC   : 0x40380001  MCAUSE  : 0xdeadc0de  MTVAL   : 0xdeadc0de  
MHARTID : 0x00000000  
Please enable CONFIG_ESP_SYSTEM_USE_FRAME_POINTER option to have a full backtrace.
[1;31mE (595450) task_wdt: Task watchdog got triggered. The following tasks/users did not reset the watchdog in time:[0m
[1;31mE (595450) task_wdt:  - IDLE (CPU 0)[0m
[1;31mE (595450) task_wdt: Tasks currently running:[0m
[1;31mE (595450) task_wdt: CPU 0: lvgl_task[0m
[1;31mE (595450) task_wdt: Print CPU 0 (current core) registers[0m
Core  0 register dump:
MEPC    : 0x42011e78  RA      : 0x42011e4e  SP      : 0x3fcacea0  GP      : 0x3fc8f600  
TP      : 0x3fcacfb0  T0      : 0x00000000  T1      : 0x40000000  T2      : 0x00000000  
S0/FP   : 0x3fc91d70  S1      : 0x3fc92098  A0      : 0x00000001  A1      : 0x00000000  
A2      : 0x3fc92cd4  A3      : 0x00000035  A4      : 0x3fc92c2c  A5      : 0x00000001  
A6      : 0x00000014  A7      : 0x0000000a  S2      : 0x00000000  S3      : 0x3fc920b0  
S4      : 0x00000027  S5      : 0x00000014  S6      : 0x00000000  S7      : 0x00000000  
S8      : 0x00000000  S9      : 0x00000000  S10     : 0x00000000  S11     : 0x00000000  
T3      : 0x00000000  T4      : 0x00000000  T5      : 0x00000000  T6      : 0x00000000  
MSTATUS : 0x00001889  MTVEC   : 0x40380001  MCAUSE  : 0xdeadc0de  MTVAL   : 0xdeadc0de  
MHARTID : 0x00000000  
Please enable CONFIG_ESP_SYSTEM_USE_FRAME_POINTER option to have a full backtrace.
[1;31mE (600450) task_wdt: Task watchdog got triggered. The following tasks/users did not reset the watchdog in time:[0m
[1;31mE (600450) task_wdt:  - IDLE (CPU 0)[0m
[1;31mE (600450) task_wdt: Tasks currently running:[0m
[1;31mE (600450) task_wdt: CPU 0: lvgl_task[0m
[1;31mE (600450) task_wdt: Print CPU 0 (current core) registers[0m
Core  0 register dump:
MEPC    : 0x42011e78  RA      : 0x42011e4e  SP      : 0x3fcacea0  GP      : 0x3fc8f600  
TP      : 0x3fcacfb0  T0      : 0x00000000  T1      : 0x40000000  T2      : 0x00000000  
S0/FP   : 0x3fc91d70  S1      : 0x3fc92098  A0      : 0x00000001  A1      : 0x00000000  
A2      : 0x3fc92cd4  A3      : 0x00000035  A4      : 0x3fc92c2c  A5      : 0x00000001  
A6      : 0x00000014  A7      : 0x0000000a  S2      : 0x00000000  S3      : 0x3fc920b0  
S4      : 0x00000027  S5      : 0x00000014  S6      : 0x00000000  S7      : 0x00000000  
S8      : 0x00000000  S9      : 0x00000000  S10     : 0x00000000  S11     : 0x00000000  
T3      : 0x00000000  T4      : 0x00000000  T5      : 0x00000000  T6      : 0x00000000  
MSTATUS : 0x00001889  MTVEC   : 0x40380001  MCAUSE  : 0xdeadc0de  MTVAL   : 0xdeadc0de  
MHARTID : 0x00000000  
Please enable CONFIG_ESP_SYSTEM_USE_FRAME_POINTER option to have a full backtrace.
[1;31mE (605450) task_wdt: Task watchdog got triggered. The following tasks/users did not reset the watchdog in time:[0m
[1;31mE (605450) task_wdt:  - IDLE (CPU 0)[0m
[1;31mE (605450) task_wdt: Tasks currently running:[0m
[1;31mE (605450) task_wdt: CPU 0: lvgl_task[0m
[1;31mE (605450) task_wdt: Print CPU 0 (current core) registers[0m
Core  0 register dump:
MEPC    : 0x42011e78  RA      : 0x42011e4e  SP      : 0x3fcacea0  GP      : 0x3fc8f600  
TP      : 0x3fcacfb0  T0      : 0x00000000  T1      : 0x40000000  T2      : 0x00000000  
S0/FP   : 0x3fc91d70  S1      : 0x3fc92098  A0      : 0x00000001  A1      : 0x00000000  
A2      : 0x3fc92cd4  A3      : 0x00000035  A4      : 0x3fc92c2c  A5      : 0x00000001  
A6      : 0x00000014  A7      : 0x0000000a  S2      : 0x00000000  S3      : 0x3fc920b0  
S4      : 0x00000027  S5      : 0x00000014  S6      : 0x00000000  S7      : 0x00000000  
S8      : 0x00000000  S9      : 0x00000000  S10     : 0x00000000  S11     : 0x00000000  
T3      : 0x00000000  T4      : 0x00000000  T5      : 0x00000000  T6      : 0x00000000  
MSTATUS : 0x00001889  MTVEC   : 0x40380001  MCAUSE  : 0xdeadc0de  MTVAL   : 0xdeadc0de  
MHARTID : 0x00000000  
Please enable CONFIG_ESP_SYSTEM_USE_FRAME_POINTER option to have a full backtrace.
[1;31mE (610450) task_wdt: Task watchdog got triggered. The following tasks/users did not reset the watchdog in time:[0m
[1;31mE (610450) task_wdt:  - IDLE (CPU 0)[0m
[1;31mE (610450) task_wdt: Tasks currently running:[0m
[1;31mE (610450) task_wdt: CPU 0: lvgl_task[0m
[1;31mE (610450) task_wdt: Print CPU 0 (current core) registers[0m
Core  0 register dump:
MEPC    : 0x42011e78  RA      : 0x42011e4e  SP      : 0x3fcacea0  GP      : 0x3fc8f600  
TP      : 0x3fcacfb0  T0      : 0x00000000  T1      : 0x40000000  T2      : 0x00000000  
S0/FP   : 0x3fc91d70  S1      : 0x3fc92098  A0      : 0x00000001  A1      : 0x00000000  
A2      : 0x3fc92cd4  A3      : 0x00000035  A4      : 0x3fc92c2c  A5      : 0x00000001  
A6      : 0x00000014  A7      : 0x0000000a  S2      : 0x00000000  S3      : 0x3fc920b0  
S4      : 0x00000027  S5      : 0x00000014  S6      : 0x00000000  S7      : 0x00000000  
S8      : 0x00000000  S9      : 0x00000000  S10     : 0x00000000  S11     : 0x00000000  
T3      : 0x00000000  T4      : 0x00000000  T5      : 0x00000000  T6      : 0x00000000  
MSTATUS : 0x00001889  MTVEC   : 0x40380001  MCAUSE  : 0xdeadc0de  MTVAL   : 0xdeadc0de  
MHARTID : 0x00000000  
Please enable CONFIG_ESP_SYSTEM_USE_FRAME_POINTER option to have a full backtrace.
[1;31mE (615450) task_wdt: Task watchdog got triggered. The following tasks/users did not reset the watchdog in time:[0m
[1;31mE (615450) task_wdt:  - IDLE (CPU 0)[0m
[1;31mE (615450) task_wdt: Tasks currently running:[0m
[1;31mE (615450) task_wdt: CPU 0: lvgl_task[0m
[1;31mE (615450) task_wdt: Print CPU 0 (current core) registers[0m
Core  0 register dump:
MEPC    : 0x42011e78  RA      : 0x42011e4e  SP      : 0x3fcacea0  GP      : 0x3fc8f600  
TP      : 0x3fcacfb0  T0      : 0x00000000  T1      : 0x40000000  T2      : 0x00000000  
S0/FP   : 0x3fc91d70  S1      : 0x3fc92098  A0      : 0x00000001  A1      : 0x00000000  
A2      : 0x3fc92cd4  A3      : 0x00000035  A4      : 0x3fc92c2c  A5      : 0x00000001  
A6      : 0x00000014  A7      : 0x0000000a  S2      : 0x00000000  S3      : 0x3fc920b0  
S4      : 0x00000027  S5      : 0x00000014  S6      : 0x00000000  S7      : 0x00000000  
S8      : 0x00000000  S9      : 0x00000000  S10     : 0x00000000  S11     : 0x00000000  
T3      : 0x00000000  T4      : 0x00000000  T5      : 0x00000000  T6      : 0x00000000  
MSTATUS : 0x00001889  MTVEC   : 0x40380001  MCAUSE  : 0xdeadc0de  MTVAL   : 0xdeadc0de  
MHARTID : 0x00000000  
Please enable CONFIG_ESP_SYSTEM_USE_FRAME_POINTER option to have a full backtrace.
[1;31mE (620450) task_wdt: Task watchdog got triggered. The following tasks/users did not reset the watchdog in time:[0m
[1;31mE (620450) task_wdt:  - IDLE (CPU 0)[0m
[1;31mE (620450) task_wdt: Tasks currently running:[0m
[1;31mE (620450) task_wdt: CPU 0: lvgl_task[0m
[1;31mE (620450) task_wdt: Print CPU 0 (current core) registers[0m
Core  0 register dump:
MEPC    : 0x42011e78  RA      : 0x42011e4e  SP      : 0x3fcacea0  GP      : 0x3fc8f600  
TP      : 0x3fcacfb0  T0      : 0x00000000  T1      : 0x40000000  T2      : 0x00000000  
S0/FP   : 0x3fc91d70  S1      : 0x3fc92098  A0      : 0x00000001  A1      : 0x00000000  
A2      : 0x3fc92cd4  A3      : 0x00000035  A4      : 0x3fc92c2c  A5      : 0x00000001  
A6      : 0x00000014  A7      : 0x0000000a  S2      : 0x00000000  S3      : 0x3fc920b0  
S4      : 0x00000027  S5      : 0x00000014  S6      : 0x00000000  S7      : 0x00000000  
S8      : 0x00000000  S9      : 0x00000000  S10     : 0x00000000  S11     : 0x00000000  
T3      : 0x00000000  T4      : 0x00000000  T5      : 0x00000000  T6      : 0x00000000  
MSTATUS : 0x00001889  MTVEC   : 0x40380001  MCAUSE  : 0xdeadc0de  MTVAL   : 0xdeadc0de  
MHARTID : 0x00000000  
Please enable CONFIG_ESP_SYSTEM_USE_FRAME_POINTER option to have a full backtrace.
[1;31mE (625450) task_wdt: Task watchdog got triggered. The following tasks/users did not reset the watchdog in time:[0m
[1;31mE (625450) task_wdt:  - IDLE (CPU 0)[0m
[1;31mE (625450) task_wdt: Tasks currently running:[0m
[1;31mE (625450) task_wdt: CPU 0: lvgl_task[0m
[1;31mE (625450) task_wdt: Print CPU 0 (current core) registers[0m
Core  0 register dump:
MEPC    : 0x42011e78  RA      : 0x42011e4e  SP      : 0x3fcacea0  GP      : 0x3fc8f600  
TP      : 0x3fcacfb0  T0      : 0x00000000  T1      : 0x40000000  T2      : 0x00000000  
S0/FP   : 0x3fc91d70  S1      : 0x3fc92098  A0      : 0x00000001  A1      : 0x00000000  
A2      : 0x3fc92cd4  A3      : 0x00000035  A4      : 0x3fc92c2c  A5      : 0x00000001  
A6      : 0x00000014  A7      : 0x0000000a  S2      : 0x00000000  S3      : 0x3fc920b0  
S4      : 0x00000027  S5      : 0x00000014  S6      : 0x00000000  S7      : 0x00000000  
S8      : 0x00000000  S9      : 0x00000000  S10     : 0x00000000  S11     : 0x00000000  
T3      : 0x00000000  T4      : 0x00000000  T5      : 0x00000000  T6      : 0x00000000  
MSTATUS : 0x00001889  MTVEC   : 0x40380001  MCAUSE  : 0xdeadc0de  MTVAL   : 0xdeadc0de  
MHARTID : 0x00000000  
Please enable CONFIG_ESP_SYSTEM_USE_FRAME_POINTER option to have a full backtrace.
[1;31mE (630450) task_wdt: Task watchdog got triggered. The following tasks/users did not reset the watchdog in time:[0m
[1;31mE (630450) task_wdt:  - IDLE (CPU 0)[0m
[1;31mE (630450) task_wdt: Tasks currently running:[0m
[1;31mE (630450) task_wdt: CPU 0: lvgl_task[0m
[1;31mE (630450) task_wdt: Print CPU 0 (current core) registers[0m
Core  0 register dump:
MEPC    : 0x42011e78  RA      : 0x42011e4e  SP      : 0x3fcacea0  GP      : 0x3fc8f600  
TP      : 0x3fcacfb0  T0      : 0x00000000  T1      : 0x40000000  T2      : 0x00000000  
S0/FP   : 0x3fc91d70  S1      : 0x3fc92098  A0      : 0x00000001  A1      : 0x00000000  
A2      : 0x3fc92cd4  A3      : 0x00000035  A4      : 0x3fc92c2c  A5      : 0x00000001  
A6      : 0x00000014  A7      : 0x0000000a  S2      : 0x00000000  S3      : 0x3fc920b0  
S4      : 0x00000027  S5      : 0x00000014  S6      : 0x00000000  S7      : 0x00000000  
S8      : 0x00000000  S9      : 0x00000000  S10     : 0x00000000  S11     : 0x00000000  
T3      : 0x00000000  T4      : 0x00000000  T5      : 0x00000000  T6      : 0x00000000  
MSTATUS : 0x00001889  MTVEC   : 0x40380001  MCAUSE  : 0xdeadc0de  MTVAL   : 0xdeadc0de  
MHARTID : 0x00000000  
Please enable CONFIG_ESP_SYSTEM_USE_FRAME_POINTER option to have a full backtrace.
[1;31mE (635450) task_wdt: Task watchdog got triggered. The following tasks/users did not reset the watchdog in time:[0m
[1;31mE (635450) task_wdt:  - IDLE (CPU 0)[0m
[1;31mE (635450) task_wdt: Tasks currently running:[0m
[1;31mE (635450) task_wdt: CPU 0: lvgl_task[0m
[1;31mE (635450) task_wdt: Print CPU 0 (current core) registers[0m
Core  0 register dump:
MEPC    : 0x42011e78  RA      : 0x42011e4e  SP      : 0x3fcacea0  GP      : 0x3fc8f600  
TP      : 0x3fcacfb0  T0      : 0x00000000  T1      : 0x40000000  T2      : 0x00000000  
S0/FP   : 0x3fc91d70  S1      : 0x3fc92098  A0      : 0x00000001  A1      : 0x00000000  
A2      : 0x3fc92cd4  A3      : 0x00000035  A4      : 0x3fc92c2c  A5      : 0x00000001  
A6      : 0x00000014  A7      : 0x0000000a  S2      : 0x00000000  S3      : 0x3fc920b0  
S4      : 0x00000027  S5      : 0x00000014  S6      : 0x00000000  S7      : 0x00000000  
S8      : 0x00000000  S9      : 0x00000000  S10     : 0x00000000  S11     : 0x00000000  
T3      : 0x00000000  T4      : 0x00000000  T5      : 0x00000000  T6      : 0x00000000  
MSTATUS : 0x00001889  MTVEC   : 0x40380001  MCAUSE  : 0xdeadc0de  MTVAL   : 0xdeadc0de  
MHARTID : 0x00000000  
Please enable CONFIG_ESP_SYSTEM_USE_FRAME_POINTER option to have a full backtrace.
[1;31mE (640450) task_wdt: Task watchdog got triggered. The following tasks/users did not reset the watchdog in time:[0m
[1;31mE (640450) task_wdt:  - IDLE (CPU 0)[0m
[1;31mE (640450) task_wdt: Tasks currently running:[0m
[1;31mE (640450) task_wdt: CPU 0: lvgl_task[0m
[1;31mE (640450) task_wdt: Print CPU 0 (current core) registers[0m
Core  0 register dump:
MEPC    : 0x42011e78  RA      : 0x42011e4e  SP      : 0x3fcacea0  GP      : 0x3fc8f600  
TP      : 0x3fcacfb0  T0      : 0x00000000  T1      : 0x40000000  T2      : 0x00000000  
S0/FP   : 0x3fc91d70  S1      : 0x3fc92098  A0      : 0x00000001  A1      : 0x00000000  
A2      : 0x3fc92cd4  A3      : 0x00000035  A4      : 0x3fc92c2c  A5      : 0x00000001  
A6      : 0x00000014  A7      : 0x0000000a  S2      : 0x00000000  S3      : 0x3fc920b0  
S4      : 0x00000027  S5      : 0x00000014  S6      : 0x00000000  S7      : 0x00000000  
S8      : 0x00000000  S9      : 0x00000000  S10     : 0x00000000  S11     : 0x00000000  
T3      : 0x00000000  T4      : 0x00000000  T5      : 0x00000000  T6      : 0x00000000  
MSTATUS : 0x00001889  MTVEC   : 0x40380001  MCAUSE  : 0xdeadc0de  MTVAL   : 0xdeadc0de  
MHARTID : 0x00000000  
Please enable CONFIG_ESP_SYSTEM_USE_FRAME_POINTER option to have a full backtrace.
[1;31mE (645450) task_wdt: Task watchdog got triggered. The following tasks/users did not reset the watchdog in time:[0m
[1;31mE (645450) task_wdt:  - IDLE (CPU 0)[0m
[1;31mE (645450) task_wdt: Tasks currently running:[0m
[1;31mE (645450) task_wdt: CPU 0: lvgl_task[0m
[1;31mE (645450) task_wdt: Print CPU 0 (current core) registers[0m
Core  0 register dump:
MEPC    : 0x42011e78  RA      : 0x42011e4e  SP      : 0x3fcacea0  GP      : 0x3fc8f600  
TP      : 0x3fcacfb0  T0      : 0x00000000  T1      : 0x40000000  T2      : 0x00000000  
S0/FP   : 0x3fc91d70  S1      : 0x3fc92098  A0      : 0x00000001  A1      : 0x00000000  
A2      : 0x3fc92cd4  A3      : 0x00000035  A4      : 0x3fc92c2c  A5      : 0x00000001  
A6      : 0x00000014  A7      : 0x0000000a  S2      : 0x00000000  S3      : 0x3fc920b0  
S4      : 0x00000027  S5      : 0x00000014  S6      : 0x00000000  S7      : 0x00000000  
S8      : 0x00000000  S9      : 0x00000000  S10     : 0x00000000  S11     : 0x00000000  
T3      : 0x00000000  T4      : 0x00000000  T5      : 0x00000000  T6      : 0x00000000  
MSTATUS : 0x00001889  MTVEC   : 0x40380001  MCAUSE  : 0xdeadc0de  MTVAL   : 0xdeadc0de  
MHARTID : 0x00000000  
Please enable CONFIG_ESP_SYSTEM_USE_FRAME_POINTER option to have a full backtrace.
[1;31mE (650450) task_wdt: Task watchdog got triggered. The following tasks/users did not reset the watchdog in time:[0m
[1;31mE (650450) task_wdt:  - IDLE (CPU 0)[0m
[1;31mE (650450) task_wdt: Tasks currently running:[0m
[1;31mE (650450) task_wdt: CPU 0: lvgl_task[0m
[1;31mE (650450) task_wdt: Print CPU 0 (current core) registers[0m
Core  0 register dump:
MEPC    : 0x42011e78  RA      : 0x42011e4e  SP      : 0x3fcacea0  GP      : 0x3fc8f600  
TP      : 0x3fcacfb0  T0      : 0x00000000  T1      : 0x40000000  T2      : 0x00000000  
S0/FP   : 0x3fc91d70  S1      : 0x3fc92098  A0      : 0x00000001  A1      : 0x00000000  
A2      : 0x3fc92cd4  A3      : 0x00000035  A4      : 0x3fc92c2c  A5      : 0x00000001  
A6      : 0x00000014  A7      : 0x0000000a  S2      : 0x00000000  S3      : 0x3fc920b0  
S4      : 0x00000027  S5      : 0x00000014  S6      : 0x00000000  S7      : 0x00000000  
S8      : 0x00000000  S9      : 0x00000000  S10     : 0x00000000  S11     : 0x00000000  
T3      : 0x00000000  T4      : 0x00000000  T5      : 0x00000000  T6      : 0x00000000  
MSTATUS : 0x00001889  MTVEC   : 0x40380001  MCAUSE  : 0xdeadc0de  MTVAL   : 0xdeadc0de  
MHARTID : 0x00000000  
Please enable CONFIG_ESP_SYSTEM_USE_FRAME_POINTER option to have a full backtrace.
[1;31mE (655450) task_wdt: Task watchdog got triggered. The following tasks/users did not reset the watchdog in time:[0m
[1;31mE (655450) task_wdt:  - IDLE (CPU 0)[0m
[1;31mE (655450) task_wdt: Tasks currently running:[0m
[1;31mE (655450) task_wdt: CPU 0: lvgl_task[0m
[1;31mE (655450) task_wdt: Print CPU 0 (current core) registers[0m
Core  0 register dump:
MEPC    : 0x42011e78  RA      : 0x42011e4e  SP      : 0x3fcacea0  GP      : 0x3fc8f600  
TP      : 0x3fcacfb0  T0      : 0x00000000  T1      : 0x40000000  T2      : 0x00000000  
S0/FP   : 0x3fc91d70  S1      : 0x3fc92098  A0      : 0x00000001  A1      : 0x00000000  
A2      : 0x3fc92cd4  A3      : 0x00000035  A4      : 0x3fc92c2c  A5      : 0x00000001  
A6      : 0x00000014  A7      : 0x0000000a  S2      : 0x00000000  S3      : 0x3fc920b0  
S4      : 0x00000027  S5      : 0x00000014  S6      : 0x00000000  S7      : 0x00000000  
S8      : 0x00000000  S9      : 0x00000000  S10     : 0x00000000  S11     : 0x00000000  
T3      : 0x00000000  T4      : 0x00000000  T5      : 0x00000000  T6      : 0x00000000  
MSTATUS : 0x00001889  MTVEC   : 0x40380001  MCAUSE  : 0xdeadc0de  MTVAL   : 0xdeadc0de  
MHARTID : 0x00000000  
Please enable CONFIG_ESP_SYSTEM_USE_FRAME_POINTER option to have a full backtrace.
[1;31mE (660450) task_wdt: Task watchdog got triggered. The following tasks/users did not reset the watchdog in time:[0m
[1;31mE (660450) task_wdt:  - IDLE (CPU 0)[0m
[1;31mE (660450) task_wdt: Tasks currently running:[0m
[1;31mE (660450) task_wdt: CPU 0: lvgl_task[0m
[1;31mE (660450) task_wdt: Print CPU 0 (current core) registers[0m
Core  0 register dump:
MEPC    : 0x42011e78  RA      : 0x42011e4e  SP      : 0x3fcacea0  GP      : 0x3fc8f600  
TP      : 0x3fcacfb0  T0      : 0x00000000  T1      : 0x40000000  T2      : 0x00000000  
S0/FP   : 0x3fc91d70  S1      : 0x3fc92098  A0      : 0x00000001  A1      : 0x00000000  
A2      : 0x3fc92cd4  A3      : 0x00000035  A4      : 0x3fc92c2c  A5      : 0x00000001  
A6      : 0x00000014  A7      : 0x0000000a  S2      : 0x00000000  S3      : 0x3fc920b0  
S4      : 0x00000027  S5      : 0x00000014  S6      : 0x00000000  S7      : 0x00000000  
S8      : 0x00000000  S9      : 0x00000000  S10     : 0x00000000  S11     : 0x00000000  
T3      : 0x00000000  T4      : 0x00000000  T5      : 0x00000000  T6      : 0x00000000  
MSTATUS : 0x00001889  MTVEC   : 0x40380001  MCAUSE  : 0xdeadc0de  MTVAL   : 0xdeadc0de  
MHARTID : 0x00000000  
Please enable CONFIG_ESP_SYSTEM_USE_FRAME_POINTER option to have a full backtrace.
[1;31mE (665450) task_wdt: Task watchdog got triggered. The following tasks/users did not reset the watchdog in time:[0m
[1;31mE (665450) task_wdt:  - IDLE (CPU 0)[0m
[1;31mE (665450) task_wdt: Tasks currently running:[0m
[1;31mE (665450) task_wdt: CPU 0: lvgl_task[0m
[1;31mE (665450) task_wdt: Print CPU 0 (current core) registers[0m
Core  0 register dump:
MEPC    : 0x42011e78  RA      : 0x42011e4e  SP      : 0x3fcacea0  GP      : 0x3fc8f600  
TP      : 0x3fcacfb0  T0      : 0x00000000  T1      : 0x40000000  T2      : 0x00000000  
S0/FP   : 0x3fc91d70  S1      : 0x3fc92098  A0      : 0x00000001  A1      : 0x00000000  
A2      : 0x3fc92cd4  A3      : 0x00000035  A4      : 0x3fc92c2c  A5      : 0x00000001  
A6      : 0x00000014  A7      : 0x0000000a  S2      : 0x00000000  S3      : 0x3fc920b0  
S4      : 0x00000027  S5      : 0x00000014  S6      : 0x00000000  S7      : 0x00000000  
S8      : 0x00000000  S9      : 0x00000000  S10     : 0x00000000  S11     : 0x00000000  
T3      : 0x00000000  T4      : 0x00000000  T5      : 0x00000000  T6      : 0x00000000  
MSTATUS : 0x00001889  MTVEC   : 0x40380001  MCAUSE  : 0xdeadc0de  MTVAL   : 0xdeadc0de  
MHARTID : 0x00000000  
Please enable CONFIG_ESP_SYSTEM_USE_FRAME_POINTER option to have a full backtrace.
[1;31mE (670450) task_wdt: Task watchdog got triggered. The following tasks/users did not reset the watchdog in time:[0m
[1;31mE (670450) task_wdt:  - IDLE (CPU 0)[0m
[1;31mE (670450) task_wdt: Tasks currently running:[0m
[1;31mE (670450) task_wdt: CPU 0: lvgl_task[0m
[1;31mE (670450) task_wdt: Print CPU 0 (current core) registers[0m
Core  0 register dump:
MEPC    : 0x42011e78  RA      : 0x42011e4e  SP      : 0x3fcacea0  GP      : 0x3fc8f600  
TP      : 0x3fcacfb0  T0      : 0x00000000  T1      : 0x40000000  T2      : 0x00000000  
S0/FP   : 0x3fc91d70  S1      : 0x3fc92098  A0      : 0x00000001  A1      : 0x00000000  
A2      : 0x3fc92cd4  A3      : 0x00000035  A4      : 0x3fc92c2c  A5      : 0x00000001  
A6      : 0x00000014  A7      : 0x0000000a  S2      : 0x00000000  S3      : 0x3fc920b0  
S4      : 0x00000027  S5      : 0x00000014  S6      : 0x00000000  S7      : 0x00000000  
S8      : 0x00000000  S9      : 0x00000000  S10     : 0x00000000  S11     : 0x00000000  
T3      : 0x00000000  T4      : 0x00000000  T5      : 0x00000000  T6      : 0x00000000  
MSTATUS : 0x00001889  MTVEC   : 0x40380001  MCAUSE  : 0xdeadc0de  MTVAL   : 0xdeadc0de  
MHARTID : 0x00000000  
Please enable CONFIG_ESP_SYSTEM_USE_FRAME_POINTER option to have a full backtrace.
[1;31mE (675450) task_wdt: Task watchdog got triggered. The following tasks/users did not reset the watchdog in time:[0m
[1;31mE (675450) task_wdt:  - IDLE (CPU 0)[0m
[1;31mE (675450) task_wdt: Tasks currently running:[0m
[1;31mE (675450) task_wdt: CPU 0: lvgl_task[0m
[1;31mE (675450) task_wdt: Print CPU 0 (current core) registers[0m
Core  0 register dump:
MEPC    : 0x42011e78  RA      : 0x42011e4e  SP      : 0x3fcacea0  GP      : 0x3fc8f600  
TP      : 0x3fcacfb0  T0      : 0x00000000  T1      : 0x40000000  T2      : 0x00000000  
S0/FP   : 0x3fc91d70  S1      : 0x3fc92098  A0      : 0x00000001  A1      : 0x00000000  
A2      : 0x3fc92cd4  A3      : 0x00000035  A4      : 0x3fc92c2c  A5      : 0x00000001  
A6      : 0x00000014  A7      : 0x0000000a  S2      : 0x00000000  S3      : 0x3fc920b0  
S4      : 0x00000027  S5      : 0x00000014  S6      : 0x00000000  S7      : 0x00000000  
S8      : 0x00000000  S9      : 0x00000000  S10     : 0x00000000  S11     : 0x00000000  
T3      : 0x00000000  T4      : 0x00000000  T5      : 0x00000000  T6      : 0x00000000  
MSTATUS : 0x00001889  MTVEC   : 0x40380001  MCAUSE  : 0xdeadc0de  MTVAL   : 0xdeadc0de  
MHARTID : 0x00000000  
Please enable CONFIG_ESP_SYSTEM_USE_FRAME_POINTER option to have a full backtrace.
[1;31mE (680450) task_wdt: Task watchdog got triggered. The following tasks/users did not reset the watchdog in time:[0m
[1;31mE (680450) task_wdt:  - IDLE (CPU 0)[0m
[1;31mE (680450) task_wdt: Tasks currently running:[0m
[1;31mE (680450) task_wdt: CPU 0: lvgl_task[0m
[1;31mE (680450) task_wdt: Print CPU 0 (current core) registers[0m
Core  0 register dump:
MEPC    : 0x42011e78  RA      : 0x42011e4e  SP      : 0x3fcacea0  GP      : 0x3fc8f600  
TP      : 0x3fcacfb0  T0      : 0x00000000  T1      : 0x40000000  T2      : 0x00000000  
S0/FP   : 0x3fc91d70  S1      : 0x3fc92098  A0      : 0x00000001  A1      : 0x00000000  
A2      : 0x3fc92cd4  A3      : 0x00000035  A4      : 0x3fc92c2c  A5      : 0x00000001  
A6      : 0x00000014  A7      : 0x0000000a  S2      : 0x00000000  S3      : 0x3fc920b0  
S4      : 0x00000027  S5      : 0x00000014  S6      : 0x00000000  S7      : 0x00000000  
S8      : 0x00000000  S9      : 0x00000000  S10     : 0x00000000  S11     : 0x00000000  
T3      : 0x00000000  T4      : 0x00000000  T5      : 0x00000000  T6      : 0x00000000  
MSTATUS : 0x00001889  MTVEC   : 0x40380001  MCAUSE  : 0xdeadc0de  MTVAL   : 0xdeadc0de  
MHARTID : 0x00000000  
Please enable CONFIG_ESP_SYSTEM_USE_FRAME_POINTER option to have a full backtrace.
[1;31mE (685450) task_wdt: Task watchdog got triggered. The following tasks/users did not reset the watchdog in time:[0m
[1;31mE (685450) task_wdt:  - IDLE (CPU 0)[0m
[1;31mE (685450) task_wdt: Tasks currently running:[0m
[1;31mE (685450) task_wdt: CPU 0: lvgl_task[0m
[1;31mE (685450) task_wdt: Print CPU 0 (current core) registers[0m
Core  0 register dump:
MEPC    : 0x42011e78  RA      : 0x42011e4e  SP      : 0x3fcacea0  GP      : 0x3fc8f600  
TP      : 0x3fcacfb0  T0      : 0x00000000  T1      : 0x40000000  T2      : 0x00000000  
S0/FP   : 0x3fc91d70  S1      : 0x3fc92098  A0      : 0x00000001  A1      : 0x00000000  
A2      : 0x3fc92cd4  A3      : 0x00000035  A4      : 0x3fc92c2c  A5      : 0x00000001  
A6      : 0x00000014  A7      : 0x0000000a  S2      : 0x00000000  S3      : 0x3fc920b0  
S4      : 0x00000027  S5      : 0x00000014  S6      : 0x00000000  S7      : 0x00000000  
S8      : 0x00000000  S9      : 0x00000000  S10     : 0x00000000  S11     : 0x00000000  
T3      : 0x00000000  T4      : 0x00000000  T5      : 0x00000000  T6      : 0x00000000  
MSTATUS : 0x00001889  MTVEC   : 0x40380001  MCAUSE  : 0xdeadc0de  MTVAL   : 0xdeadc0de  
MHARTID : 0x00000000  
Please enable CONFIG_ESP_SYSTEM_USE_FRAME_POINTER option to have a full backtrace.
[1;31mE (690450) task_wdt: Task watchdog got triggered. The following tasks/users did not reset the watchdog in time:[0m
[1;31mE (690450) task_wdt:  - IDLE (CPU 0)[0m
[1;31mE (690450) task_wdt: Tasks currently running:[0m
[1;31mE (690450) task_wdt: CPU 0: lvgl_task[0m
[1;31mE (690450) task_wdt: Print CPU 0 (current core) registers[0m
Core  0 register dump:
MEPC    : 0x42011e78  RA      : 0x42011e4e  SP      : 0x3fcacea0  GP      : 0x3fc8f600  
TP      : 0x3fcacfb0  T0      : 0x00000000  T1      : 0x40000000  T2      : 0x00000000  
S0/FP   : 0x3fc91d70  S1      : 0x3fc92098  A0      : 0x00000001  A1      : 0x00000000  
A2      : 0x3fc92cd4  A3      : 0x00000035  A4      : 0x3fc92c2c  A5      : 0x00000001  
A6      : 0x00000014  A7      : 0x0000000a  S2      : 0x00000000  S3      : 0x3fc920b0  
S4      : 0x00000027  S5      : 0x00000014  S6      : 0x00000000  S7      : 0x00000000  
S8      : 0x00000000  S9      : 0x00000000  S10     : 0x00000000  S11     : 0x00000000  
T3      : 0x00000000  T4      : 0x00000000  T5      : 0x00000000  T6      : 0x00000000  
MSTATUS : 0x00001889  MTVEC   : 0x40380001  MCAUSE  : 0xdeadc0de  MTVAL   : 0xdeadc0de  
MHARTID : 0x00000000  
Please enable CONFIG_ESP_SYSTEM_USE_FRAME_POINTER option to have a full backtrace.
[1;31mE (695450) task_wdt: Task watchdog got triggered. The following tasks/users did not reset the watchdog in time:[0m
[1;31mE (695450) task_wdt:  - IDLE (CPU 0)[0m
[1;31mE (695450) task_wdt: Tasks currently running:[0m
[1;31mE (695450) task_wdt: CPU 0: lvgl_task[0m
[1;31mE (695450) task_wdt: Print CPU 0 (current core) registers[0m
Core  0 register dump:
MEPC    : 0x42011e78  RA      : 0x42011e4e  SP      : 0x3fcacea0  GP      : 0x3fc8f600  
TP      : 0x3fcacfb0  T0      : 0x00000000  T1      : 0x40000000  T2      : 0x00000000  
S0/FP   : 0x3fc91d70  S1      : 0x3fc92098  A0      : 0x00000001  A1      : 0x00000000  
A2      : 0x3fc92cd4  A3      : 0x00000035  A4      : 0x3fc92c2c  A5      : 0x00000001  
A6      : 0x00000014  A7      : 0x0000000a  S2      : 0x00000000  S3      : 0x3fc920b0  
S4      : 0x00000027  S5      : 0x00000014  S6      : 0x00000000  S7      : 0x00000000  
S8      : 0x00000000  S9      : 0x00000000  S10     : 0x00000000  S11     : 0x00000000  
T3      : 0x00000000  T4      : 0x00000000  T5      : 0x00000000  T6      : 0x00000000  
MSTATUS : 0x00001889  MTVEC   : 0x40380001  MCAUSE  : 0xdeadc0de  MTVAL   : 0xdeadc0de  
MHARTID : 0x00000000  
Please enable CONFIG_ESP_SYSTEM_USE_FRAME_POINTER option to have a full backtrace.
[1;31mE (700450) task_wdt: Task watchdog got triggered. The following tasks/users did not reset the watchdog in time:[0m
[1;31mE (700450) task_wdt:  - IDLE (CPU 0)[0m
[1;31mE (700450) task_wdt: Tasks currently running:[0m
[1;31mE (700450) task_wdt: CPU 0: lvgl_task[0m
[1;31mE (700450) task_wdt: Print CPU 0 (current core) registers[0m
Core  0 register dump:
MEPC    : 0x42011e78  RA      : 0x42011e4e  SP      : 0x3fcacea0  GP      : 0x3fc8f600  
TP      : 0x3fcacfb0  T0      : 0x00000000  T1      : 0x40000000  T2      : 0x00000000  
S0/FP   : 0x3fc91d70  S1      : 0x3fc92098  A0      : 0x00000001  A1      : 0x00000000  
A2      : 0x3fc92cd4  A3      : 0x00000035  A4      : 0x3fc92c2c  A5      : 0x00000001  
A6      : 0x00000014  A7      : 0x0000000a  S2      : 0x00000000  S3      : 0x3fc920b0  
S4      : 0x00000027  S5      : 0x00000014  S6      : 0x00000000  S7      : 0x00000000  
S8      : 0x00000000  S9      : 0x00000000  S10     : 0x00000000  S11     : 0x00000000  
T3      : 0x00000000  T4      : 0x00000000  T5      : 0x00000000  T6      : 0x00000000  
MSTATUS : 0x00001889  MTVEC   : 0x40380001  MCAUSE  : 0xdeadc0de  MTVAL   : 0xdeadc0de  
MHARTID : 0x00000000  
Please enable CONFIG_ESP_SYSTEM_USE_FRAME_POINTER option to have a full backtrace.
[1;31mE (705450) task_wdt: Task watchdog got triggered. The following tasks/users did not reset the watchdog in time:[0m
[1;31mE (705450) task_wdt:  - IDLE (CPU 0)[0m
[1;31mE (705450) task_wdt: Tasks currently running:[0m
[1;31mE (705450) task_wdt: CPU 0: lvgl_task[0m
[1;31mE (705450) task_wdt: Print CPU 0 (current core) registers[0m
Core  0 register dump:
MEPC    : 0x42011e78  RA      : 0x42011e4e  SP      : 0x3fcacea0  GP      : 0x3fc8f600  
TP      : 0x3fcacfb0  T0      : 0x00000000  T1      : 0x40000000  T2      : 0x00000000  
S0/FP   : 0x3fc91d70  S1      : 0x3fc92098  A0      : 0x00000001  A1      : 0x00000000  
A2      : 0x3fc92cd4  A3      : 0x00000035  A4      : 0x3fc92c2c  A5      : 0x00000001  
A6      : 0x00000014  A7      : 0x0000000a  S2      : 0x00000000  S3      : 0x3fc920b0  
S4      : 0x00000027  S5      : 0x00000014  S6      : 0x00000000  S7      : 0x00000000  
S8      : 0x00000000  S9      : 0x00000000  S10     : 0x00000000  S11     : 0x00000000  
T3      : 0x00000000  T4      : 0x00000000  T5      : 0x00000000  T6      : 0x00000000  
MSTATUS : 0x00001889  MTVEC   : 0x40380001  MCAUSE  : 0xdeadc0de  MTVAL   : 0xdeadc0de  
MHARTID : 0x00000000  
Please enable CONFIG_ESP_SYSTEM_USE_FRAME_POINTER option to have a full backtrace.
[1;31mE (710450) task_wdt: Task watchdog got triggered. The following tasks/users did not reset the watchdog in time:[0m
[1;31mE (710450) task_wdt:  - IDLE (CPU 0)[0m
[1;31mE (710450) task_wdt: Tasks currently running:[0m
[1;31mE (710450) task_wdt: CPU 0: lvgl_task[0m
[1;31mE (710450) task_wdt: Print CPU 0 (current core) registers[0m
Core  0 register dump:
MEPC    : 0x42011e78  RA      : 0x42011e4e  SP      : 0x3fcacea0  GP      : 0x3fc8f600  
TP      : 0x3fcacfb0  T0      : 0x00000000  T1      : 0x40000000  T2      : 0x00000000  
S0/FP   : 0x3fc91d70  S1      : 0x3fc92098  A0      : 0x00000001  A1      : 0x00000000  
A2      : 0x3fc92cd4  A3      : 0x00000035  A4      : 0x3fc92c2c  A5      : 0x00000001  
A6      : 0x00000014  A7      : 0x0000000a  S2      : 0x00000000  S3      : 0x3fc920b0  
S4      : 0x00000027  S5      : 0x00000014  S6      : 0x00000000  S7      : 0x00000000  
S8      : 0x00000000  S9      : 0x00000000  S10     : 0x00000000  S11     : 0x00000000  
T3      : 0x00000000  T4      : 0x00000000  T5      : 0x00000000  T6      : 0x00000000  
MSTATUS : 0x00001889  MTVEC   : 0x40380001  MCAUSE  : 0xdeadc0de  MTVAL   : 0xdeadc0de  
MHARTID : 0x00000000  
Please enable CONFIG_ESP_SYSTEM_USE_FRAME_POINTER option to have a full backtrace.
[1;31mE (715450) task_wdt: Task watchdog got triggered. The following tasks/users did not reset the watchdog in time:[0m
[1;31mE (715450) task_wdt:  - IDLE (CPU 0)[0m
[1;31mE (715450) task_wdt: Tasks currently running:[0m
[1;31mE (715450) task_wdt: CPU 0: lvgl_task[0m
[1;31mE (715450) task_wdt: Print CPU 0 (current core) registers[0m
Core  0 register dump:
MEPC    : 0x42011e78  RA      : 0x42011e4e  SP      : 0x3fcacea0  GP      : 0x3fc8f600  
TP      : 0x3fcacfb0  T0      : 0x00000000  T1      : 0x40000000  T2      : 0x00000000  
S0/FP   : 0x3fc91d70  S1      : 0x3fc92098  A0      : 0x00000001  A1      : 0x00000000  
A2      : 0x3fc92cd4  A3      : 0x00000035  A4      : 0x3fc92c2c  A5      : 0x00000001  
A6      : 0x00000014  A7      : 0x0000000a  S2      : 0x00000000  S3      : 0x3fc920b0  
S4      : 0x00000027  S5      : 0x00000014  S6      : 0x00000000  S7      : 0x00000000  
S8      : 0x00000000  S9      : 0x00000000  S10     : 0x00000000  S11     : 0x00000000  
T3      : 0x00000000  T4      : 0x00000000  T5      : 0x00000000  T6      : 0x00000000  
MSTATUS : 0x00001889  MTVEC   : 0x40380001  MCAUSE  : 0xdeadc0de  MTVAL   : 0xdeadc0de  
MHARTID : 0x00000000  
Please enable CONFIG_ESP_SYSTEM_USE_FRAME_POINTER option to have a full backtrace.
[1;31mE (720450) task_wdt: Task watchdog got triggered. The following tasks/users did not reset the watchdog in time:[0m
[1;31mE (720450) task_wdt:  - IDLE (CPU 0)[0m
[1;31mE (720450) task_wdt: Tasks currently running:[0m
[1;31mE (720450) task_wdt: CPU 0: lvgl_task[0m
[1;31mE (720450) task_wdt: Print CPU 0 (current core) registers[0m
Core  0 register dump:
MEPC    : 0x42011e78  RA      : 0x42011e4e  SP      : 0x3fcacea0  GP      : 0x3fc8f600  
TP      : 0x3fcacfb0  T0      : 0x00000000  T1      : 0x40000000  T2      : 0x00000000  
S0/FP   : 0x3fc91d70  S1      : 0x3fc92098  A0      : 0x00000001  A1      : 0x00000000  
A2      : 0x3fc92cd4  A3      : 0x00000035  A4      : 0x3fc92c2c  A5      : 0x00000001  
A6      : 0x00000014  A7      : 0x0000000a  S2      : 0x00000000  S3      : 0x3fc920b0  
S4      : 0x00000027  S5      : 0x00000014  S6      : 0x00000000  S7      : 0x00000000  
S8      : 0x00000000  S9      : 0x00000000  S10     : 0x00000000  S11     : 0x00000000  
T3      : 0x00000000  T4      : 0x00000000  T5      : 0x00000000  T6      : 0x00000000  
MSTATUS : 0x00001889  MTVEC   : 0x40380001  MCAUSE  : 0xdeadc0de  MTVAL   : 0xdeadc0de  
MHARTID : 0x00000000  
Please enable CONFIG_ESP_SYSTEM_USE_FRAME_POINTER option to have a full backtrace.
[1;31mE (725450) task_wdt: Task watchdog got triggered. The following tasks/users did not reset the watchdog in time:[0m
[1;31mE (725450) task_wdt:  - IDLE (CPU 0)[0m
[1;31mE (725450) task_wdt: Tasks currently running:[0m
[1;31mE (725450) task_wdt: CPU 0: lvgl_task[0m
[1;31mE (725450) task_wdt: Print CPU 0 (current core) registers[0m
Core  0 register dump:
MEPC    : 0x42011e78  RA      : 0x42011e4e  SP      : 0x3fcacea0  GP      : 0x3fc8f600  
TP      : 0x3fcacfb0  T0      : 0x00000000  T1      : 0x40000000  T2      : 0x00000000  
S0/FP   : 0x3fc91d70  S1      : 0x3fc92098  A0      : 0x00000001  A1      : 0x00000000  
A2      : 0x3fc92cd4  A3      : 0x00000035  A4      : 0x3fc92c2c  A5      : 0x00000001  
A6      : 0x00000014  A7      : 0x0000000a  S2      : 0x00000000  S3      : 0x3fc920b0  
S4      : 0x00000027  S5      : 0x00000014  S6      : 0x00000000  S7      : 0x00000000  
S8      : 0x00000000  S9      : 0x00000000  S10     : 0x00000000  S11     : 0x00000000  
T3      : 0x00000000  T4      : 0x00000000  T5      : 0x00000000  T6      : 0x00000000  
MSTATUS : 0x00001889  MTVEC   : 0x40380001  MCAUSE  : 0xdeadc0de  MTVAL   : 0xdeadc0de  
MHARTID : 0x00000000  
Please enable CONFIG_ESP_SYSTEM_USE_FRAME_POINTER option to have a full backtrace.
[1;31mE (730450) task_wdt: Task watchdog got triggered. The following tasks/users did not reset the watchdog in time:[0m
[1;31mE (730450) task_wdt:  - IDLE (CPU 0)[0m
[1;31mE (730450) task_wdt: Tasks currently running:[0m
[1;31mE (730450) task_wdt: CPU 0: lvgl_task[0m
[1;31mE (730450) task_wdt: Print CPU 0 (current core) registers[0m
Core  0 register dump:
MEPC    : 0x42011e78  RA      : 0x42011e4e  SP      : 0x3fcacea0  GP      : 0x3fc8f600  
TP      : 0x3fcacfb0  T0      : 0x00000000  T1      : 0x40000000  T2      : 0x00000000  
S0/FP   : 0x3fc91d70  S1      : 0x3fc92098  A0      : 0x00000001  A1      : 0x00000000  
A2      : 0x3fc92cd4  A3      : 0x00000035  A4      : 0x3fc92c2c  A5      : 0x00000001  
A6      : 0x00000014  A7      : 0x0000000a  S2      : 0x00000000  S3      : 0x3fc920b0  
S4      : 0x00000027  S5      : 0x00000014  S6      : 0x00000000  S7      : 0x00000000  
S8      : 0x00000000  S9      : 0x00000000  S10     : 0x00000000  S11     : 0x00000000  
T3      : 0x00000000  T4      : 0x00000000  T5      : 0x00000000  T6      : 0x00000000  
MSTATUS : 0x00001889  MTVEC   : 0x40380001  MCAUSE  : 0xdeadc0de  MTVAL   : 0xdeadc0de  
MHARTID : 0x00000000  
Please enable CONFIG_ESP_SYSTEM_USE_FRAME_POINTER option to have a full backtrace.
[1;31mE (735450) task_wdt: Task watchdog got triggered. The following tasks/users did not reset the watchdog in time:[0m
[1;31mE (735450) task_wdt:  - IDLE (CPU 0)[0m
[1;31mE (735450) task_wdt: Tasks currently running:[0m
[1;31mE (735450) task_wdt: CPU 0: lvgl_task[0m
[1;31mE (735450) task_wdt: Print CPU 0 (current core) registers[0m
Core  0 register dump:
MEPC    : 0x42011e78  RA      : 0x42011e4e  SP      : 0x3fcacea0  GP      : 0x3fc8f600  
TP      : 0x3fcacfb0  T0      : 0x00000000  T1      : 0x40000000  T2      : 0x00000000  
S0/FP   : 0x3fc91d70  S1      : 0x3fc92098  A0      : 0x00000001  A1      : 0x00000000  
A2      : 0x3fc92cd4  A3      : 0x00000035  A4      : 0x3fc92c2c  A5      : 0x00000001  
A6      : 0x00000014  A7      : 0x0000000a  S2      : 0x00000000  S3      : 0x3fc920b0  
S4      : 0x00000027  S5      : 0x00000014  S6      : 0x00000000  S7      : 0x00000000  
S8      : 0x00000000  S9      : 0x00000000  S10     : 0x00000000  S11     : 0x00000000  
T3      : 0x00000000  T4      : 0x00000000  T5      : 0x00000000  T6      : 0x00000000  
MSTATUS : 0x00001889  MTVEC   : 0x40380001  MCAUSE  : 0xdeadc0de  MTVAL   : 0xdeadc0de  
MHARTID : 0x00000000  
Please enable CONFIG_ESP_SYSTEM_USE_FRAME_POINTER option to have a full backtrace.
[1;31mE (740450) task_wdt: Task watchdog got triggered. The following tasks/users did not reset the watchdog in time:[0m
[1;31mE (740450) task_wdt:  - IDLE (CPU 0)[0m
[1;31mE (740450) task_wdt: Tasks currently running:[0m
[1;31mE (740450) task_wdt: CPU 0: lvgl_task[0m
[1;31mE (740450) task_wdt: Print CPU 0 (current core) registers[0m
Core  0 register dump:
MEPC    : 0x42011e78  RA      : 0x42011e4e  SP      : 0x3fcacea0  GP      : 0x3fc8f600  
TP      : 0x3fcacfb0  T0      : 0x00000000  T1      : 0x40000000  T2      : 0x00000000  
S0/FP   : 0x3fc91d70  S1      : 0x3fc92098  A0      : 0x00000001  A1      : 0x00000000  
A2      : 0x3fc92cd4  A3      : 0x00000035  A4      : 0x3fc92c2c  A5      : 0x00000001  
A6      : 0x00000014  A7      : 0x0000000a  S2      : 0x00000000  S3      : 0x3fc920b0  
S4      : 0x00000027  S5      : 0x00000014  S6      : 0x00000000  S7      : 0x00000000  
S8      : 0x00000000  S9      : 0x00000000  S10     : 0x00000000  S11     : 0x00000000  
T3      : 0x00000000  T4      : 0x00000000  T5      : 0x00000000  T6      : 0x00000000  
MSTATUS : 0x00001889  MTVEC   : 0x40380001  MCAUSE  : 0xdeadc0de  MTVAL   : 0xdeadc0de  
MHARTID : 0x00000000  
Please enable CONFIG_ESP_SYSTEM_USE_FRAME_POINTER option to have a full backtrace.
[1;31mE (745450) task_wdt: Task watchdog got triggered. The following tasks/users did not reset the watchdog in time:[0m
[1;31mE (745450) task_wdt:  - IDLE (CPU 0)[0m
[1;31mE (745450) task_wdt: Tasks currently running:[0m
[1;31mE (745450) task_wdt: CPU 0: lvgl_task[0m
[1;31mE (745450) task_wdt: Print CPU 0 (current core) registers[0m
Core  0 register dump:
MEPC    : 0x42011e78  RA      : 0x42011e4e  SP      : 0x3fcacea0  GP      : 0x3fc8f600  
TP      : 0x3fcacfb0  T0      : 0x00000000  T1      : 0x40000000  T2      : 0x00000000  
S0/FP   : 0x3fc91d70  S1      : 0x3fc92098  A0      : 0x00000001  A1      : 0x00000000  
A2      : 0x3fc92cd4  A3      : 0x00000035  A4      : 0x3fc92c2c  A5      : 0x00000001  
A6      : 0x00000014  A7      : 0x0000000a  S2      : 0x00000000  S3      : 0x3fc920b0  
S4      : 0x00000027  S5      : 0x00000014  S6      : 0x00000000  S7      : 0x00000000  
S8      : 0x00000000  S9      : 0x00000000  S10     : 0x00000000  S11     : 0x00000000  
T3      : 0x00000000  T4      : 0x00000000  T5      : 0x00000000  T6      : 0x00000000  
MSTATUS : 0x00001889  MTVEC   : 0x40380001  MCAUSE  : 0xdeadc0de  MTVAL   : 0xdeadc0de  
MHARTID : 0x00000000  
Please enable CONFIG_ESP_SYSTEM_USE_FRAME_POINTER option to have a full backtrace.
[1;31mE (750450) task_wdt: Task watchdog got triggered. The following tasks/users did not reset the watchdog in time:[0m
[1;31mE (750450) task_wdt:  - IDLE (CPU 0)[0m
[1;31mE (750450) task_wdt: Tasks currently running:[0m
[1;31mE (750450) task_wdt: CPU 0: lvgl_task[0m
[1;31mE (750450) task_wdt: Print CPU 0 (current core) registers[0m
Core  0 register dump:
MEPC    : 0x42011e78  RA      : 0x42011e4e  SP      : 0x3fcacea0  GP      : 0x3fc8f600  
TP      : 0x3fcacfb0  T0      : 0x00000000  T1      : 0x40000000  T2      : 0x00000000  
S0/FP   : 0x3fc91d70  S1      : 0x3fc92098  A0      : 0x00000001  A1      : 0x00000000  
A2      : 0x3fc92cd4  A3      : 0x00000035  A4      : 0x3fc92c2c  A5      : 0x00000001  
A6      : 0x00000014  A7      : 0x0000000a  S2      : 0x00000000  S3      : 0x3fc920b0  
S4      : 0x00000027  S5      : 0x00000014  S6      : 0x00000000  S7      : 0x00000000  
S8      : 0x00000000  S9      : 0x00000000  S10     : 0x00000000  S11     : 0x00000000  
T3      : 0x00000000  T4      : 0x00000000  T5      : 0x00000000  T6      : 0x00000000  
MSTATUS : 0x00001889  MTVEC   : 0x40380001  MCAUSE  : 0xdeadc0de  MTVAL   : 0xdeadc0de  
MHARTID : 0x00000000  
Please enable CONFIG_ESP_SYSTEM_USE_FRAME_POINTER option to have a full backtrace.
[1;31mE (755450) task_wdt: Task watchdog got triggered. The following tasks/users did not reset the watchdog in time:[0m
[1;31mE (755450) task_wdt:  - IDLE (CPU 0)[0m
[1;31mE (755450) task_wdt: Tasks currently running:[0m
[1;31mE (755450) task_wdt: CPU 0: lvgl_task[0m
[1;31mE (755450) task_wdt: Print CPU 0 (current core) registers[0m
Core  0 register dump:
MEPC    : 0x42011e78  RA      : 0x42011e4e  SP      : 0x3fcacea0  GP      : 0x3fc8f600  
TP      : 0x3fcacfb0  T0      : 0x00000000  T1      : 0x40000000  T2      : 0x00000000  
S0/FP   : 0x3fc91d70  S1      : 0x3fc92098  A0      : 0x00000001  A1      : 0x00000000  
A2      : 0x3fc92cd4  A3      : 0x00000035  A4      : 0x3fc92c2c  A5      : 0x00000001  
A6      : 0x00000014  A7      : 0x0000000a  S2      : 0x00000000  S3      : 0x3fc920b0  
S4      : 0x00000027  S5      : 0x00000014  S6      : 0x00000000  S7      : 0x00000000  
S8      : 0x00000000  S9      : 0x00000000  S10     : 0x00000000  S11     : 0x00000000  
T3      : 0x00000000  T4      : 0x00000000  T5      : 0x00000000  T6      : 0x00000000  
MSTATUS : 0x00001889  MTVEC   : 0x40380001  MCAUSE  : 0xdeadc0de  MTVAL   : 0xdeadc0de  
MHARTID : 0x00000000  
Please enable CONFIG_ESP_SYSTEM_USE_FRAME_POINTER option to have a full backtrace.
[1;31mE (760450) task_wdt: Task watchdog got triggered. The following tasks/users did not reset the watchdog in time:[0m
[1;31mE (760450) task_wdt:  - IDLE (CPU 0)[0m
[1;31mE (760450) task_wdt: Tasks currently running:[0m
[1;31mE (760450) task_wdt: CPU 0: lvgl_task[0m
[1;31mE (760450) task_wdt: Print CPU 0 (current core) registers[0m
Core  0 register dump:
MEPC    : 0x42011e78  RA      : 0x42011e4e  SP      : 0x3fcacea0  GP      : 0x3fc8f600  
TP      : 0x3fcacfb0  T0      : 0x00000000  T1      : 0x40000000  T2      : 0x00000000  
S0/FP   : 0x3fc91d70  S1      : 0x3fc92098  A0      : 0x00000001  A1      : 0x00000000  
A2      : 0x3fc92cd4  A3      : 0x00000035  A4      : 0x3fc92c2c  A5      : 0x00000001  
A6      : 0x00000014  A7      : 0x0000000a  S2      : 0x00000000  S3      : 0x3fc920b0  
S4      : 0x00000027  S5      : 0x00000014  S6      : 0x00000000  S7      : 0x00000000  
S8      : 0x00000000  S9      : 0x00000000  S10     : 0x00000000  S11     : 0x00000000  
T3      : 0x00000000  T4      : 0x00000000  T5      : 0x00000000  T6      : 0x00000000  
MSTATUS : 0x00001889  MTVEC   : 0x40380001  MCAUSE  : 0xdeadc0de  MTVAL   : 0xdeadc0de  
MHARTID : 0x00000000  
Please enable CONFIG_ESP_SYSTEM_USE_FRAME_POINTER option to have a full backtrace.
[1;31mE (765450) task_wdt: Task watchdog got triggered. The following tasks/users did not reset the watchdog in time:[0m
[1;31mE (765450) task_wdt:  - IDLE (CPU 0)[0m
[1;31mE (765450) task_wdt: Tasks currently running:[0m
[1;31mE (765450) task_wdt: CPU 0: lvgl_task[0m
[1;31mE (765450) task_wdt: Print CPU 0 (current core) registers[0m
Core  0 register dump:
MEPC    : 0x42011e78  RA      : 0x42011e4e  SP      : 0x3fcacea0  GP      : 0x3fc8f600  
TP      : 0x3fcacfb0  T0      : 0x00000000  T1      : 0x40000000  T2      : 0x00000000  
S0/FP   : 0x3fc91d70  S1      : 0x3fc92098  A0      : 0x00000001  A1      : 0x00000000  
A2      : 0x3fc92cd4  A3      : 0x00000035  A4      : 0x3fc92c2c  A5      : 0x00000001  
A6      : 0x00000014  A7      : 0x0000000a  S2      : 0x00000000  S3      : 0x3fc920b0  
S4      : 0x00000027  S5      : 0x00000014  S6      : 0x00000000  S7      : 0x00000000  
S8      : 0x00000000  S9      : 0x00000000  S10     : 0x00000000  S11     : 0x00000000  
T3      : 0x00000000  T4      : 0x00000000  T5      : 0x00000000  T6      : 0x00000000  
MSTATUS : 0x00001889  MTVEC   : 0x40380001  MCAUSE  : 0xdeadc0de  MTVAL   : 0xdeadc0de  
MHARTID : 0x00000000  
Please enable CONFIG_ESP_SYSTEM_USE_FRAME_POINTER option to have a full backtrace.
[1;31mE (770450) task_wdt: Task watchdog got triggered. The following tasks/users did not reset the watchdog in time:[0m
[1;31mE (770450) task_wdt:  - IDLE (CPU 0)[0m
[1;31mE (770450) task_wdt: Tasks currently running:[0m
[1;31mE (770450) task_wdt: CPU 0: lvgl_task[0m
[1;31mE (770450) task_wdt: Print CPU 0 (current core) registers[0m
Core  0 register dump:
MEPC    : 0x42011e78  RA      : 0x42011e4e  SP      : 0x3fcacea0  GP      : 0x3fc8f600  
TP      : 0x3fcacfb0  T0      : 0x00000000  T1      : 0x40000000  T2      : 0x00000000  
S0/FP   : 0x3fc91d70  S1      : 0x3fc92098  A0      : 0x00000001  A1      : 0x00000000  
A2      : 0x3fc92cd4  A3      : 0x00000035  A4      : 0x3fc92c2c  A5      : 0x00000001  
A6      : 0x00000014  A7      : 0x0000000a  S2      : 0x00000000  S3      : 0x3fc920b0  
S4      : 0x00000027  S5      : 0x00000014  S6      : 0x00000000  S7      : 0x00000000  
S8      : 0x00000000  S9      : 0x00000000  S10     : 0x00000000  S11     : 0x00000000  
T3      : 0x00000000  T4      : 0x00000000  T5      : 0x00000000  T6      : 0x00000000  
MSTATUS : 0x00001889  MTVEC   : 0x40380001  MCAUSE  : 0xdeadc0de  MTVAL   : 0xdeadc0de  
MHARTID : 0x00000000  
Please enable CONFIG_ESP_SYSTEM_USE_FRAME_POINTER option to have a full backtrace.
[1;31mE (775450) task_wdt: Task watchdog got triggered. The following tasks/users did not reset the watchdog in time:[0m
[1;31mE (775450) task_wdt:  - IDLE (CPU 0)[0m
[1;31mE (775450) task_wdt: Tasks currently running:[0m
[1;31mE (775450) task_wdt: CPU 0: lvgl_task[0m
[1;31mE (775450) task_wdt: Print CPU 0 (current core) registers[0m
Core  0 register dump:
MEPC    : 0x42011e78  RA      : 0x42011e4e  SP      : 0x3fcacea0  GP      : 0x3fc8f600  
TP      : 0x3fcacfb0  T0      : 0x00000000  T1      : 0x40000000  T2      : 0x00000000  
S0/FP   : 0x3fc91d70  S1      : 0x3fc92098  A0      : 0x00000001  A1      : 0x00000000  
A2      : 0x3fc92cd4  A3      : 0x00000035  A4      : 0x3fc92c2c  A5      : 0x00000001  
A6      : 0x00000014  A7      : 0x0000000a  S2      : 0x00000000  S3      : 0x3fc920b0  
S4      : 0x00000027  S5      : 0x00000014  S6      : 0x00000000  S7      : 0x00000000  
S8      : 0x00000000  S9      : 0x00000000  S10     : 0x00000000  S11     : 0x00000000  
T3      : 0x00000000  T4      : 0x00000000  T5      : 0x00000000  T6      : 0x00000000  
MSTATUS : 0x00001889  MTVEC   : 0x40380001  MCAUSE  : 0xdeadc0de  MTVAL   : 0xdeadc0de  
MHARTID : 0x00000000  
Please enable CONFIG_ESP_SYSTEM_USE_FRAME_POINTER option to have a full backtrace.
[1;31mE (780450) task_wdt: Task watchdog got triggered. The following tasks/users did not reset the watchdog in time:[0m
[1;31mE (780450) task_wdt:  - IDLE (CPU 0)[0m
[1;31mE (780450) task_wdt: Tasks currently running:[0m
[1;31mE (780450) task_wdt: CPU 0: lvgl_task[0m
[1;31mE (780450) task_wdt: Print CPU 0 (current core) registers[0m
Core  0 register dump:
MEPC    : 0x42011e78  RA      : 0x42011e4e  SP      : 0x3fcacea0  GP      : 0x3fc8f600  
TP      : 0x3fcacfb0  T0      : 0x00000000  T1      : 0x40000000  T2      : 0x00000000  
S0/FP   : 0x3fc91d70  S1      : 0x3fc92098  A0      : 0x00000001  A1      : 0x00000000  
A2      : 0x3fc92cd4  A3      : 0x00000035  A4      : 0x3fc92c2c  A5      : 0x00000001  
A6      : 0x00000014  A7      : 0x0000000a  S2      : 0x00000000  S3      : 0x3fc920b0  
S4      : 0x00000027  S5      : 0x00000014  S6      : 0x00000000  S7      : 0x00000000  
S8      : 0x00000000  S9      : 0x00000000  S10     : 0x00000000  S11     : 0x00000000  
T3      : 0x00000000  T4      : 0x00000000  T5      : 0x00000000  T6      : 0x00000000  
MSTATUS : 0x00001889  MTVEC   : 0x40380001  MCAUSE  : 0xdeadc0de  MTVAL   : 0xdeadc0de  
MHARTID : 0x00000000  
Please enable CONFIG_ESP_SYSTEM_USE_FRAME_POINTER option to have a full backtrace.
[1;31mE (785450) task_wdt: Task watchdog got triggered. The following tasks/users did not reset the watchdog in time:[0m
[1;31mE (785450) task_wdt:  - IDLE (CPU 0)[0m
[1;31mE (785450) task_wdt: Tasks currently running:[0m
[1;31mE (785450) task_wdt: CPU 0: lvgl_task[0m
[1;31mE (785450) task_wdt: Print CPU 0 (current core) registers[0m
Core  0 register dump:
MEPC    : 0x42011e78  RA      : 0x42011e4e  SP      : 0x3fcacea0  GP      : 0x3fc8f600  
TP      : 0x3fcacfb0  T0      : 0x00000000  T1      : 0x40000000  T2      : 0x00000000  
S0/FP   : 0x3fc91d70  S1      : 0x3fc92098  A0      : 0x00000001  A1      : 0x00000000  
A2      : 0x3fc92cd4  A3      : 0x00000035  A4      : 0x3fc92c2c  A5      : 0x00000001  
A6      : 0x00000014  A7      : 0x0000000a  S2      : 0x00000000  S3      : 0x3fc920b0  
S4      : 0x00000027  S5      : 0x00000014  S6      : 0x00000000  S7      : 0x00000000  
S8      : 0x00000000  S9      : 0x00000000  S10     : 0x00000000  S11     : 0x00000000  
T3      : 0x00000000  T4      : 0x00000000  T5      : 0x00000000  T6      : 0x00000000  
MSTATUS : 0x00001889  MTVEC   : 0x40380001  MCAUSE  : 0xdeadc0de  MTVAL   : 0xdeadc0de  
MHARTID : 0x00000000  
Please enable CONFIG_ESP_SYSTEM_USE_FRAME_POINTER option to have a full backtrace.
[1;31mE (790450) task_wdt: Task watchdog got triggered. The following tasks/users did not reset the watchdog in time:[0m
[1;31mE (790450) task_wdt:  - IDLE (CPU 0)[0m
[1;31mE (790450) task_wdt: Tasks currently running:[0m
[1;31mE (790450) task_wdt: CPU 0: lvgl_task[0m
[1;31mE (790450) task_wdt: Print CPU 0 (current core) registers[0m
Core  0 register dump:
MEPC    : 0x42011e78  RA      : 0x42011e4e  SP      : 0x3fcacea0  GP      : 0x3fc8f600  
TP      : 0x3fcacfb0  T0      : 0x00000000  T1      : 0x40000000  T2      : 0x00000000  
S0/FP   : 0x3fc91d70  S1      : 0x3fc92098  A0      : 0x00000001  A1      : 0x00000000  
A2      : 0x3fc92cd4  A3      : 0x00000035  A4      : 0x3fc92c2c  A5      : 0x00000001  
A6      : 0x00000014  A7      : 0x0000000a  S2      : 0x00000000  S3      : 0x3fc920b0  
S4      : 0x00000027  S5      : 0x00000014  S6      : 0x00000000  S7      : 0x00000000  
S8      : 0x00000000  S9      : 0x00000000  S10     : 0x00000000  S11     : 0x00000000  
T3      : 0x00000000  T4      : 0x00000000  T5      : 0x00000000  T6      : 0x00000000  
MSTATUS : 0x00001889  MTVEC   : 0x40380001  MCAUSE  : 0xdeadc0de  MTVAL   : 0xdeadc0de  
MHARTID : 0x00000000  
Please enable CONFIG_ESP_SYSTEM_USE_FRAME_POINTER option to have a full backtrace.
[1;31mE (795450) task_wdt: Task watchdog got triggered. The following tasks/users did not reset the watchdog in time:[0m
[1;31mE (795450) task_wdt:  - IDLE (CPU 0)[0m
[1;31mE (795450) task_wdt: Tasks currently running:[0m
[1;31mE (795450) task_wdt: CPU 0: lvgl_task[0m
[1;31mE (795450) task_wdt: Print CPU 0 (current core) registers[0m
Core  0 register dump:
MEPC    : 0x42011e78  RA      : 0x42011e4e  SP      : 0x3fcacea0  GP      : 0x3fc8f600  
TP      : 0x3fcacfb0  T0      : 0x00000000  T1      : 0x40000000  T2      : 0x00000000  
S0/FP   : 0x3fc91d70  S1      : 0x3fc92098  A0      : 0x00000001  A1      : 0x00000000  
A2      : 0x3fc92cd4  A3      : 0x00000035  A4      : 0x3fc92c2c  A5      : 0x00000001  
A6      : 0x00000014  A7      : 0x0000000a  S2      : 0x00000000  S3      : 0x3fc920b0  
S4      : 0x00000027  S5      : 0x00000014  S6      : 0x00000000  S7      : 0x00000000  
S8      : 0x00000000  S9      : 0x00000000  S10     : 0x00000000  S11     : 0x00000000  
T3      : 0x00000000  T4      : 0x00000000  T5      : 0x00000000  T6      : 0x00000000  
MSTATUS : 0x00001889  MTVEC   : 0x40380001  MCAUSE  : 0xdeadc0de  MTVAL   : 0xdeadc0de  
MHARTID : 0x00000000  
Please enable CONFIG_ESP_SYSTEM_USE_FRAME_POINTER option to have a full backtrace.
[1;31mE (800450) task_wdt: Task watchdog got triggered. The following tasks/users did not reset the watchdog in time:[0m
[1;31mE (800450) task_wdt:  - IDLE (CPU 0)[0m
[1;31mE (800450) task_wdt: Tasks currently running:[0m
[1;31mE (800450) task_wdt: CPU 0: lvgl_task[0m
[1;31mE (800450) task_wdt: Print CPU 0 (current core) registers[0m
Core  0 register dump:
MEPC    : 0x42011e78  RA      : 0x42011e4e  SP      : 0x3fcacea0  GP      : 0x3fc8f600  
TP      : 0x3fcacfb0  T0      : 0x00000000  T1      : 0x40000000  T2      : 0x00000000  
S0/FP   : 0x3fc91d70  S1      : 0x3fc92098  A0      : 0x00000001  A1      : 0x00000000  
A2      : 0x3fc92cd4  A3      : 0x00000035  A4      : 0x3fc92c2c  A5      : 0x00000001  
A6      : 0x00000014  A7      : 0x0000000a  S2      : 0x00000000  S3      : 0x3fc920b0  
S4      : 0x00000027  S5      : 0x00000014  S6      : 0x00000000  S7      : 0x00000000  
S8      : 0x00000000  S9      : 0x00000000  S10     : 0x00000000  S11     : 0x00000000  
T3      : 0x00000000  T4      : 0x00000000  T5      : 0x00000000  T6      : 0x00000000  
MSTATUS : 0x00001889  MTVEC   : 0x40380001  MCAUSE  : 0xdeadc0de  MTVAL   : 0xdeadc0de  
MHARTID : 0x00000000  
Please enable CONFIG_ESP_SYSTEM_USE_FRAME_POINTER option to have a full backtrace.
[1;31mE (805450) task_wdt: Task watchdog got triggered. The following tasks/users did not reset the watchdog in time:[0m
[1;31mE (805450) task_wdt:  - IDLE (CPU 0)[0m
[1;31mE (805450) task_wdt: Tasks currently running:[0m
[1;31mE (805450) task_wdt: CPU 0: lvgl_task[0m
[1;31mE (805450) task_wdt: Print CPU 0 (current core) registers[0m
Core  0 register dump:
MEPC    : 0x42011e78  RA      : 0x42011e4e  SP      : 0x3fcacea0  GP      : 0x3fc8f600  
TP      : 0x3fcacfb0  T0      : 0x00000000  T1      : 0x40000000  T2      : 0x00000000  
S0/FP   : 0x3fc91d70  S1      : 0x3fc92098  A0      : 0x00000001  A1      : 0x00000000  
A2      : 0x3fc92cd4  A3      : 0x00000035  A4      : 0x3fc92c2c  A5      : 0x00000001  
A6      : 0x00000014  A7      : 0x0000000a  S2      : 0x00000000  S3      : 0x3fc920b0  
S4      : 0x00000027  S5      : 0x00000014  S6      : 0x00000000  S7      : 0x00000000  
S8      : 0x00000000  S9      : 0x00000000  S10     : 0x00000000  S11     : 0x00000000  
T3      : 0x00000000  T4      : 0x00000000  T5      : 0x00000000  T6      : 0x00000000  
MSTATUS : 0x00001889  MTVEC   : 0x40380001  MCAUSE  : 0xdeadc0de  MTVAL   : 0xdeadc0de  
MHARTID : 0x00000000  
Please enable CONFIG_ESP_SYSTEM_USE_FRAME_POINTER option to have a full backtrace.
[1;31mE (810450) task_wdt: Task watchdog got triggered. The following tasks/users did not reset the watchdog in time:[0m
[1;31mE (810450) task_wdt:  - IDLE (CPU 0)[0m
[1;31mE (810450) task_wdt: Tasks currently running:[0m
[1;31mE (810450) task_wdt: CPU 0: lvgl_task[0m
[1;31mE (810450) task_wdt: Print CPU 0 (current core) registers[0m
Core  0 register dump:
MEPC    : 0x42011e78  RA      : 0x42011e4e  SP      : 0x3fcacea0  GP      : 0x3fc8f600  
TP      : 0x3fcacfb0  T0      : 0x00000000  T1      : 0x40000000  T2      : 0x00000000  
S0/FP   : 0x3fc91d70  S1      : 0x3fc92098  A0      : 0x00000001  A1      : 0x00000000  
A2      : 0x3fc92cd4  A3      : 0x00000035  A4      : 0x3fc92c2c  A5      : 0x00000001  
A6      : 0x00000014  A7      : 0x0000000a  S2      : 0x00000000  S3      : 0x3fc920b0  
S4      : 0x00000027  S5      : 0x00000014  S6      : 0x00000000  S7      : 0x00000000  
S8      : 0x00000000  S9      : 0x00000000  S10     : 0x00000000  S11     : 0x00000000  
T3      : 0x00000000  T4      : 0x00000000  T5      : 0x00000000  T6      : 0x00000000  
MSTATUS : 0x00001889  MTVEC   : 0x40380001  MCAUSE  : 0xdeadc0de  MTVAL   : 0xdeadc0de  
MHARTID : 0x00000000  
Please enable CONFIG_ESP_SYSTEM_USE_FRAME_POINTER option to have a full backtrace.
[1;31mE (815450) task_wdt: Task watchdog got triggered. The following tasks/users did not reset the watchdog in time:[0m
[1;31mE (815450) task_wdt:  - IDLE (CPU 0)[0m
[1;31mE (815450) task_wdt: Tasks currently running:[0m
[1;31mE (815450) task_wdt: CPU 0: lvgl_task[0m
[1;31mE (815450) task_wdt: Print CPU 0 (current core) registers[0m
Core  0 register dump:
MEPC    : 0x42011e78  RA      : 0x42011e4e  SP      : 0x3fcacea0  GP      : 0x3fc8f600  
TP      : 0x3fcacfb0  T0      : 0x00000000  T1      : 0x40000000  T2      : 0x00000000  
S0/FP   : 0x3fc91d70  S1      : 0x3fc92098  A0      : 0x00000001  A1      : 0x00000000  
A2      : 0x3fc92cd4  A3      : 0x00000035  A4      : 0x3fc92c2c  A5      : 0x00000001  
A6      : 0x00000014  A7      : 0x0000000a  S2      : 0x00000000  S3      : 0x3fc920b0  
S4      : 0x00000027  S5      : 0x00000014  S6      : 0x00000000  S7      : 0x00000000  
S8      : 0x00000000  S9      : 0x00000000  S10     : 0x00000000  S11     : 0x00000000  
T3      : 0x00000000  T4      : 0x00000000  T5      : 0x00000000  T6      : 0x00000000  
MSTATUS : 0x00001889  MTVEC   : 0x40380001  MCAUSE  : 0xdeadc0de  MTVAL   : 0xdeadc0de  
MHARTID : 0x00000000  
Please enable CONFIG_ESP_SYSTEM_USE_FRAME_POINTER option to have a full backtrace.
[1;31mE (820450) task_wdt: Task watchdog got triggered. The following tasks/users did not reset the watchdog in time:[0m
[1;31mE (820450) task_wdt:  - IDLE (CPU 0)[0m
[1;31mE (820450) task_wdt: Tasks currently running:[0m
[1;31mE (820450) task_wdt: CPU 0: lvgl_task[0m
[1;31mE (820450) task_wdt: Print CPU 0 (current core) registers[0m
Core  0 register dump:
MEPC    : 0x42011e78  RA      : 0x42011e4e  SP      : 0x3fcacea0  GP      : 0x3fc8f600  
TP      : 0x3fcacfb0  T0      : 0x00000000  T1      : 0x40000000  T2      : 0x00000000  
S0/FP   : 0x3fc91d70  S1      : 0x3fc92098  A0      : 0x00000001  A1      : 0x00000000  
A2      : 0x3fc92cd4  A3      : 0x00000035  A4      : 0x3fc92c2c  A5      : 0x00000001  
A6      : 0x00000014  A7      : 0x0000000a  S2      : 0x00000000  S3      : 0x3fc920b0  
S4      : 0x00000027  S5      : 0x00000014  S6      : 0x00000000  S7      : 0x00000000  
S8      : 0x00000000  S9      : 0x00000000  S10     : 0x00000000  S11     : 0x00000000  
T3      : 0x00000000  T4      : 0x00000000  T5      : 0x00000000  T6      : 0x00000000  
MSTATUS : 0x00001889  MTVEC   : 0x40380001  MCAUSE  : 0xdeadc0de  MTVAL   : 0xdeadc0de  
MHARTID : 0x00000000  
Please enable CONFIG_ESP_SYSTEM_USE_FRAME_POINTER option to have a full backtrace.
[1;31mE (825450) task_wdt: Task watchdog got triggered. The following tasks/users did not reset the watchdog in time:[0m
[1;31mE (825450) task_wdt:  - IDLE (CPU 0)[0m
[1;31mE (825450) task_wdt: Tasks currently running:[0m
[1;31mE (825450) task_wdt: CPU 0: lvgl_task[0m
[1;31mE (825450) task_wdt: Print CPU 0 (current core) registers[0m
Core  0 register dump:
MEPC    : 0x42011e78  RA      : 0x42011e4e  SP      : 0x3fcacea0  GP      : 0x3fc8f600  
TP      : 0x3fcacfb0  T0      : 0x00000000  T1      : 0x40000000  T2      : 0x00000000  
S0/FP   : 0x3fc91d70  S1      : 0x3fc92098  A0      : 0x00000001  A1      : 0x00000000  
A2      : 0x3fc92cd4  A3      : 0x00000035  A4      : 0x3fc92c2c  A5      : 0x00000001  
A6      : 0x00000014  A7      : 0x0000000a  S2      : 0x00000000  S3      : 0x3fc920b0  
S4      : 0x00000027  S5      : 0x00000014  S6      : 0x00000000  S7      : 0x00000000  
S8      : 0x00000000  S9      : 0x00000000  S10     : 0x00000000  S11     : 0x00000000  
T3      : 0x00000000  T4      : 0x00000000  T5      : 0x00000000  T6      : 0x00000000  
MSTATUS : 0x00001889  MTVEC   : 0x40380001  MCAUSE  : 0xdeadc0de  MTVAL   : 0xdeadc0de  
MHARTID : 0x00000000  
Please enable CONFIG_ESP_SYSTEM_USE_FRAME_POINTER option to have a full backtrace.
[1;31mE (830450) task_wdt: Task watchdog got triggered. The following tasks/users did not reset the watchdog in time:[0m
[1;31mE (830450) task_wdt:  - IDLE (CPU 0)[0m
[1;31mE (830450) task_wdt: Tasks currently running:[0m
[1;31mE (830450) task_wdt: CPU 0: lvgl_task[0m
[1;31mE (830450) task_wdt: Print CPU 0 (current core) registers[0m
Core  0 register dump:
MEPC    : 0x42011e78  RA      : 0x42011e4e  SP      : 0x3fcacea0  GP      : 0x3fc8f600  
TP      : 0x3fcacfb0  T0      : 0x00000000  T1      : 0x40000000  T2      : 0x00000000  
S0/FP   : 0x3fc91d70  S1      : 0x3fc92098  A0      : 0x00000001  A1      : 0x00000000  
A2      : 0x3fc92cd4  A3      : 0x00000035  A4      : 0x3fc92c2c  A5      : 0x00000001  
A6      : 0x00000014  A7      : 0x0000000a  S2      : 0x00000000  S3      : 0x3fc920b0  
S4      : 0x00000027  S5      : 0x00000014  S6      : 0x00000000  S7      : 0x00000000  
S8      : 0x00000000  S9      : 0x00000000  S10     : 0x00000000  S11     : 0x00000000  
T3      : 0x00000000  T4      : 0x00000000  T5      : 0x00000000  T6      : 0x00000000  
MSTATUS : 0x00001889  MTVEC   : 0x40380001  MCAUSE  : 0xdeadc0de  MTVAL   : 0xdeadc0de  
MHARTID : 0x00000000  
Please enable CONFIG_ESP_SYSTEM_USE_FRAME_POINTER option to have a full backtrace.
[1;31mE (835450) task_wdt: Task watchdog got triggered. The following tasks/users did not reset the watchdog in time:[0m
[1;31mE (835450) task_wdt:  - IDLE (CPU 0)[0m
[1;31mE (835450) task_wdt: Tasks currently running:[0m
[1;31mE (835450) task_wdt: CPU 0: lvgl_task[0m
[1;31mE (835450) task_wdt: Print CPU 0 (current core) registers[0m
Core  0 register dump:
MEPC    : 0x42011e78  RA      : 0x42011e4e  SP      : 0x3fcacea0  GP      : 0x3fc8f600  
TP      : 0x3fcacfb0  T0      : 0x00000000  T1      : 0x40000000  T2      : 0x00000000  
S0/FP   : 0x3fc91d70  S1      : 0x3fc92098  A0      : 0x00000001  A1      : 0x00000000  
A2      : 0x3fc92cd4  A3      : 0x00000035  A4      : 0x3fc92c2c  A5      : 0x00000001  
A6      : 0x00000014  A7      : 0x0000000a  S2      : 0x00000000  S3      : 0x3fc920b0  
S4      : 0x00000027  S5      : 0x00000014  S6      : 0x00000000  S7      : 0x00000000  
S8      : 0x00000000  S9      : 0x00000000  S10     : 0x00000000  S11     : 0x00000000  
T3      : 0x00000000  T4      : 0x00000000  T5      : 0x00000000  T6      : 0x00000000  
MSTATUS : 0x00001889  MTVEC   : 0x40380001  MCAUSE  : 0xdeadc0de  MTVAL   : 0xdeadc0de  
MHARTID : 0x00000000  
Please enable CONFIG_ESP_SYSTEM_USE_FRAME_POINTER option to have a full backtrace.
[1;31mE (840450) task_wdt: Task watchdog got triggered. The following tasks/users did not reset the watchdog in time:[0m
[1;31mE (840450) task_wdt:  - IDLE (CPU 0)[0m
[1;31mE (840450) task_wdt: Tasks currently running:[0m
[1;31mE (840450) task_wdt: CPU 0: lvgl_task[0m
[1;31mE (840450) task_wdt: Print CPU 0 (current core) registers[0m
Core  0 register dump:
MEPC    : 0x42011e78  RA      : 0x42011e4e  SP      : 0x3fcacea0  GP      : 0x3fc8f600  
TP      : 0x3fcacfb0  T0      : 0x00000000  T1      : 0x40000000  T2      : 0x00000000  
S0/FP   : 0x3fc91d70  S1      : 0x3fc92098  A0      : 0x00000001  A1      : 0x00000000  
A2      : 0x3fc92cd4  A3      : 0x00000035  A4      : 0x3fc92c2c  A5      : 0x00000001  
A6      : 0x00000014  A7      : 0x0000000a  S2      : 0x00000000  S3      : 0x3fc920b0  
S4      : 0x00000027  S5      : 0x00000014  S6      : 0x00000000  S7      : 0x00000000  
S8      : 0x00000000  S9      : 0x00000000  S10     : 0x00000000  S11     : 0x00000000  
T3      : 0x00000000  T4      : 0x00000000  T5      : 0x00000000  T6      : 0x00000000  
MSTATUS : 0x00001889  MTVEC   : 0x40380001  MCAUSE  : 0xdeadc0de  MTVAL   : 0xdeadc0de  
MHARTID : 0x00000000  
Please enable CONFIG_ESP_SYSTEM_USE_FRAME_POINTER option to have a full backtrace.
[1;31mE (845450) task_wdt: Task watchdog got triggered. The following tasks/users did not reset the watchdog in time:[0m
[1;31mE (845450) task_wdt:  - IDLE (CPU 0)[0m
[1;31mE (845450) task_wdt: Tasks currently running:[0m
[1;31mE (845450) task_wdt: CPU 0: lvgl_task[0m
[1;31mE (845450) task_wdt: Print CPU 0 (current core) registers[0m
Core  0 register dump:
MEPC    : 0x42011e78  RA      : 0x42011e4e  SP      : 0x3fcacea0  GP      : 0x3fc8f600  
TP      : 0x3fcacfb0  T0      : 0x00000000  T1      : 0x40000000  T2      : 0x00000000  
S0/FP   : 0x3fc91d70  S1      : 0x3fc92098  A0      : 0x00000001  A1      : 0x00000000  
A2      : 0x3fc92cd4  A3      : 0x00000035  A4      : 0x3fc92c2c  A5      : 0x00000001  
A6      : 0x00000014  A7      : 0x0000000a  S2      : 0x00000000  S3      : 0x3fc920b0  
S4      : 0x00000027  S5      : 0x00000014  S6      : 0x00000000  S7      : 0x00000000  
S8      : 0x00000000  S9      : 0x00000000  S10     : 0x00000000  S11     : 0x00000000  
T3      : 0x00000000  T4      : 0x00000000  T5      : 0x00000000  T6      : 0x00000000  
MSTATUS : 0x00001889  MTVEC   : 0x40380001  MCAUSE  : 0xdeadc0de  MTVAL   : 0xdeadc0de  
MHARTID : 0x00000000  
Please enable CONFIG_ESP_SYSTEM_USE_FRAME_POINTER option to have a full backtrace.
[1;31mE (850450) task_wdt: Task watchdog got triggered. The following tasks/users did not reset the watchdog in time:[0m
[1;31mE (850450) task_wdt:  - IDLE (CPU 0)[0m
[1;31mE (850450) task_wdt: Tasks currently running:[0m
[1;31mE (850450) task_wdt: CPU 0: lvgl_task[0m
[1;31mE (850450) task_wdt: Print CPU 0 (current core) registers[0m
Core  0 register dump:
MEPC    : 0x42011e78  RA      : 0x42011e4e  SP      : 0x3fcacea0  GP      : 0x3fc8f600  
TP      : 0x3fcacfb0  T0      : 0x00000000  T1      : 0x40000000  T2      : 0x00000000  
S0/FP   : 0x3fc91d70  S1      : 0x3fc92098  A0      : 0x00000001  A1      : 0x00000000  
A2      : 0x3fc92cd4  A3      : 0x00000035  A4      : 0x3fc92c2c  A5      : 0x00000001  
A6      : 0x00000014  A7      : 0x0000000a  S2      : 0x00000000  S3      : 0x3fc920b0  
S4      : 0x00000027  S5      : 0x00000014  S6      : 0x00000000  S7      : 0x00000000  
S8      : 0x00000000  S9      : 0x00000000  S10     : 0x00000000  S11     : 0x00000000  
T3      : 0x00000000  T4      : 0x00000000  T5      : 0x00000000  T6      : 0x00000000  
MSTATUS : 0x00001889  MTVEC   : 0x40380001  MCAUSE  : 0xdeadc0de  MTVAL   : 0xdeadc0de  
MHARTID : 0x00000000  
Please enable CONFIG_ESP_SYSTEM_USE_FRAME_POINTER option to have a full backtrace.
[1;31mE (855450) task_wdt: Task watchdog got triggered. The following tasks/users did not reset the watchdog in time:[0m
[1;31mE (855450) task_wdt:  - IDLE (CPU 0)[0m
[1;31mE (855450) task_wdt: Tasks currently running:[0m
[1;31mE (855450) task_wdt: CPU 0: lvgl_task[0m
[1;31mE (855450) task_wdt: Print CPU 0 (current core) registers[0m
Core  0 register dump:
MEPC    : 0x42011e78  RA      : 0x42011e4e  SP      : 0x3fcacea0  GP      : 0x3fc8f600  
TP      : 0x3fcacfb0  T0      : 0x00000000  T1      : 0x40000000  T2      : 0x00000000  
S0/FP   : 0x3fc91d70  S1      : 0x3fc92098  A0      : 0x00000001  A1      : 0x00000000  
A2      : 0x3fc92cd4  A3      : 0x00000035  A4      : 0x3fc92c2c  A5      : 0x00000001  
A6      : 0x00000014  A7      : 0x0000000a  S2      : 0x00000000  S3      : 0x3fc920b0  
S4      : 0x00000027  S5      : 0x00000014  S6      : 0x00000000  S7      : 0x00000000  
S8      : 0x00000000  S9      : 0x00000000  S10     : 0x00000000  S11     : 0x00000000  
T3      : 0x00000000  T4      : 0x00000000  T5      : 0x00000000  T6      : 0x00000000  
MSTATUS : 0x00001889  MTVEC   : 0x40380001  MCAUSE  : 0xdeadc0de  MTVAL   : 0xdeadc0de  
MHARTID : 0x00000000  
Please enable CONFIG_ESP_SYSTEM_USE_FRAME_POINTER option to have a full backtrace.
[1;31mE (860450) task_wdt: Task watchdog got triggered. The following tasks/users did not reset the watchdog in time:[0m
[1;31mE (860450) task_wdt:  - IDLE (CPU 0)[0m
[1;31mE (860450) task_wdt: Tasks currently running:[0m
[1;31mE (860450) task_wdt: CPU 0: lvgl_task[0m
[1;31mE (860450) task_wdt: Print CPU 0 (current core) registers[0m
Core  0 register dump:
MEPC    : 0x42011e78  RA      : 0x42011e4e  SP      : 0x3fcacea0  GP      : 0x3fc8f600  
TP      : 0x3fcacfb0  T0      : 0x00000000  T1      : 0x40000000  T2      : 0x00000000  
S0/FP   : 0x3fc91d70  S1      : 0x3fc92098  A0      : 0x00000001  A1      : 0x00000000  
A2      : 0x3fc92cd4  A3      : 0x00000035  A4      : 0x3fc92c2c  A5      : 0x00000001  
A6      : 0x00000014  A7      : 0x0000000a  S2      : 0x00000000  S3      : 0x3fc920b0  
S4      : 0x00000027  S5      : 0x00000014  S6      : 0x00000000  S7      : 0x00000000  
S8      : 0x00000000  S9      : 0x00000000  S10     : 0x00000000  S11     : 0x00000000  
T3      : 0x00000000  T4      : 0x00000000  T5      : 0x00000000  T6      : 0x00000000  
MSTATUS : 0x00001889  MTVEC   : 0x40380001  MCAUSE  : 0xdeadc0de  MTVAL   : 0xdeadc0de  
MHARTID : 0x00000000  
Please enable CONFIG_ESP_SYSTEM_USE_FRAME_POINTER option to have a full backtrace.
[1;31mE (865450) task_wdt: Task watchdog got triggered. The following tasks/users did not reset the watchdog in time:[0m
[1;31mE (865450) task_wdt:  - IDLE (CPU 0)[0m
[1;31mE (865450) task_wdt: Tasks currently running:[0m
[1;31mE (865450) task_wdt: CPU 0: lvgl_task[0m
[1;31mE (865450) task_wdt: Print CPU 0 (current core) registers[0m
Core  0 register dump:
MEPC    : 0x42011e78  RA      : 0x42011e4e  SP      : 0x3fcacea0  GP      : 0x3fc8f600  
TP      : 0x3fcacfb0  T0      : 0x00000000  T1      : 0x40000000  T2      : 0x00000000  
S0/FP   : 0x3fc91d70  S1      : 0x3fc92098  A0      : 0x00000001  A1      : 0x00000000  
A2      : 0x3fc92cd4  A3      : 0x00000035  A4      : 0x3fc92c2c  A5      : 0x00000001  
A6      : 0x00000014  A7      : 0x0000000a  S2      : 0x00000000  S3      : 0x3fc920b0  
S4      : 0x00000027  S5      : 0x00000014  S6      : 0x00000000  S7      : 0x00000000  
S8      : 0x00000000  S9      : 0x00000000  S10     : 0x00000000  S11     : 0x00000000  
T3      : 0x00000000  T4      : 0x00000000  T5      : 0x00000000  T6      : 0x00000000  
MSTATUS : 0x00001889  MTVEC   : 0x40380001  MCAUSE  : 0xdeadc0de  MTVAL   : 0xdeadc0de  
MHARTID : 0x00000000  
Please enable CONFIG_ESP_SYSTEM_USE_FRAME_POINTER option to have a full backtrace.
[1;31mE (870450) task_wdt: Task watchdog got triggered. The following tasks/users did not reset the watchdog in time:[0m
[1;31mE (870450) task_wdt:  - IDLE (CPU 0)[0m
[1;31mE (870450) task_wdt: Tasks currently running:[0m
[1;31mE (870450) task_wdt: CPU 0: lvgl_task[0m
[1;31mE (870450) task_wdt: Print CPU 0 (current core) registers[0m
Core  0 register dump:
MEPC    : 0x42011e78  RA      : 0x42011e4e  SP      : 0x3fcacea0  GP      : 0x3fc8f600  
TP      : 0x3fcacfb0  T0      : 0x00000000  T1      : 0x40000000  T2      : 0x00000000  
S0/FP   : 0x3fc91d70  S1      : 0x3fc92098  A0      : 0x00000001  A1      : 0x00000000  
A2      : 0x3fc92cd4  A3      : 0x00000035  A4      : 0x3fc92c2c  A5      : 0x00000001  
A6      : 0x00000014  A7      : 0x0000000a  S2      : 0x00000000  S3      : 0x3fc920b0  
S4      : 0x00000027  S5      : 0x00000014  S6      : 0x00000000  S7      : 0x00000000  
S8      : 0x00000000  S9      : 0x00000000  S10     : 0x00000000  S11     : 0x00000000  
T3      : 0x00000000  T4      : 0x00000000  T5      : 0x00000000  T6      : 0x00000000  
MSTATUS : 0x00001889  MTVEC   : 0x40380001  MCAUSE  : 0xdeadc0de  MTVAL   : 0xdeadc0de  
MHARTID : 0x00000000  
Please enable CONFIG_ESP_SYSTEM_USE_FRAME_POINTER option to have a full backtrace.
[1;31mE (875450) task_wdt: Task watchdog got triggered. The following tasks/users did not reset the watchdog in time:[0m
[1;31mE (875450) task_wdt:  - IDLE (CPU 0)[0m
[1;31mE (875450) task_wdt: Tasks currently running:[0m
[1;31mE (875450) task_wdt: CPU 0: lvgl_task[0m
[1;31mE (875450) task_wdt: Print CPU 0 (current core) registers[0m
Core  0 register dump:
MEPC    : 0x42011e78  RA      : 0x42011e4e  SP      : 0x3fcacea0  GP      : 0x3fc8f600  
TP      : 0x3fcacfb0  T0      : 0x00000000  T1      : 0x40000000  T2      : 0x00000000  
S0/FP   : 0x3fc91d70  S1      : 0x3fc92098  A0      : 0x00000001  A1      : 0x00000000  
A2      : 0x3fc92cd4  A3      : 0x00000035  A4      : 0x3fc92c2c  A5      : 0x00000001  
A6      : 0x00000014  A7      : 0x0000000a  S2      : 0x00000000  S3      : 0x3fc920b0  
S4      : 0x00000027  S5      : 0x00000014  S6      : 0x00000000  S7      : 0x00000000  
S8      : 0x00000000  S9      : 0x00000000  S10     : 0x00000000  S11     : 0x00000000  
T3      : 0x00000000  T4      : 0x00000000  T5      : 0x00000000  T6      : 0x00000000  
MSTATUS : 0x00001889  MTVEC   : 0x40380001  MCAUSE  : 0xdeadc0de  MTVAL   : 0xdeadc0de  
MHARTID : 0x00000000  
Please enable CONFIG_ESP_SYSTEM_USE_FRAME_POINTER option to have a full backtrace.
[1;31mE (880450) task_wdt: Task watchdog got triggered. The following tasks/users did not reset the watchdog in time:[0m
[1;31mE (880450) task_wdt:  - IDLE (CPU 0)[0m
[1;31mE (880450) task_wdt: Tasks currently running:[0m
[1;31mE (880450) task_wdt: CPU 0: lvgl_task[0m
[1;31mE (880450) task_wdt: Print CPU 0 (current core) registers[0m
Core  0 register dump:
MEPC    : 0x42011e78  RA      : 0x42011e4e  SP      : 0x3fcacea0  GP      : 0x3fc8f600  
TP      : 0x3fcacfb0  T0      : 0x00000000  T1      : 0x40000000  T2      : 0x00000000  
S0/FP   : 0x3fc91d70  S1      : 0x3fc92098  A0      : 0x00000001  A1      : 0x00000000  
A2      : 0x3fc92cd4  A3      : 0x00000035  A4      : 0x3fc92c2c  A5      : 0x00000001  
A6      : 0x00000014  A7      : 0x0000000a  S2      : 0x00000000  S3      : 0x3fc920b0  
S4      : 0x00000027  S5      : 0x00000014  S6      : 0x00000000  S7      : 0x00000000  
S8      : 0x00000000  S9      : 0x00000000  S10     : 0x00000000  S11     : 0x00000000  
T3      : 0x00000000  T4      : 0x00000000  T5      : 0x00000000  T6      : 0x00000000  
MSTATUS : 0x00001889  MTVEC   : 0x40380001  MCAUSE  : 0xdeadc0de  MTVAL   : 0xdeadc0de  
MHARTID : 0x00000000  
Please enable CONFIG_ESP_SYSTEM_USE_FRAME_POINTER option to have a full backtrace.
[1;31mE (885450) task_wdt: Task watchdog got triggered. The following tasks/users did not reset the watchdog in time:[0m
[1;31mE (885450) task_wdt:  - IDLE (CPU 0)[0m
[1;31mE (885450) task_wdt: Tasks currently running:[0m
[1;31mE (885450) task_wdt: CPU 0: lvgl_task[0m
[1;31mE (885450) task_wdt: Print CPU 0 (current core) registers[0m
Core  0 register dump:
MEPC    : 0x42011e78  RA      : 0x42011e4e  SP      : 0x3fcacea0  GP      : 0x3fc8f600  
TP      : 0x3fcacfb0  T0      : 0x00000000  T1      : 0x40000000  T2      : 0x00000000  
S0/FP   : 0x3fc91d70  S1      : 0x3fc92098  A0      : 0x00000001  A1      : 0x00000000  
A2      : 0x3fc92cd4  A3      : 0x00000035  A4      : 0x3fc92c2c  A5      : 0x00000001  
A6      : 0x00000014  A7      : 0x0000000a  S2      : 0x00000000  S3      : 0x3fc920b0  
S4      : 0x00000027  S5      : 0x00000014  S6      : 0x00000000  S7      : 0x00000000  
S8      : 0x00000000  S9      : 0x00000000  S10     : 0x00000000  S11     : 0x00000000  
T3      : 0x00000000  T4      : 0x00000000  T5      : 0x00000000  T6      : 0x00000000  
MSTATUS : 0x00001889  MTVEC   : 0x40380001  MCAUSE  : 0xdeadc0de  MTVAL   : 0xdeadc0de  
MHARTID : 0x00000000  
Please enable CONFIG_ESP_SYSTEM_USE_FRAME_POINTER option to have a full backtrace.
[1;31mE (890450) task_wdt: Task watchdog got triggered. The following tasks/users did not reset the watchdog in time:[0m
[1;31mE (890450) task_wdt:  - IDLE (CPU 0)[0m
[1;31mE (890450) task_wdt: Tasks currently running:[0m
[1;31mE (890450) task_wdt: CPU 0: lvgl_task[0m
[1;31mE (890450) task_wdt: Print CPU 0 (current core) registers[0m
Core  0 register dump:
MEPC    : 0x42011e78  RA      : 0x42011e4e  SP      : 0x3fcacea0  GP      : 0x3fc8f600  
TP      : 0x3fcacfb0  T0      : 0x00000000  T1      : 0x40000000  T2      : 0x00000000  
S0/FP   : 0x3fc91d70  S1      : 0x3fc92098  A0      : 0x00000001  A1      : 0x00000000  
A2      : 0x3fc92cd4  A3      : 0x00000035  A4      : 0x3fc92c2c  A5      : 0x00000001  
A6      : 0x00000014  A7      : 0x0000000a  S2      : 0x00000000  S3      : 0x3fc920b0  
S4      : 0x00000027  S5      : 0x00000014  S6      : 0x00000000  S7      : 0x00000000  
S8      : 0x00000000  S9      : 0x00000000  S10     : 0x00000000  S11     : 0x00000000  
T3      : 0x00000000  T4      : 0x00000000  T5      : 0x00000000  T6      : 0x00000000  
MSTATUS : 0x00001889  MTVEC   : 0x40380001  MCAUSE  : 0xdeadc0de  MTVAL   : 0xdeadc0de  
MHARTID : 0x00000000  
Please enable CONFIG_ESP_SYSTEM_USE_FRAME_POINTER option to have a full backtrace.
[1;31mE (895450) task_wdt: Task watchdog got triggered. The following tasks/users did not reset the watchdog in time:[0m
[1;31mE (895450) task_wdt:  - IDLE (CPU 0)[0m
[1;31mE (895450) task_wdt: Tasks currently running:[0m
[1;31mE (895450) task_wdt: CPU 0: lvgl_task[0m
[1;31mE (895450) task_wdt: Print CPU 0 (current core) registers[0m
Core  0 register dump:
MEPC    : 0x42011e78  RA      : 0x42011e4e  SP      : 0x3fcacea0  GP      : 0x3fc8f600  
TP      : 0x3fcacfb0  T0      : 0x00000000  T1      : 0x40000000  T2      : 0x00000000  
S0/FP   : 0x3fc91d70  S1      : 0x3fc92098  A0      : 0x00000001  A1      : 0x00000000  
A2      : 0x3fc92cd4  A3      : 0x00000035  A4      : 0x3fc92c2c  A5      : 0x00000001  
A6      : 0x00000014  A7      : 0x0000000a  S2      : 0x00000000  S3      : 0x3fc920b0  
S4      : 0x00000027  S5      : 0x00000014  S6      : 0x00000000  S7      : 0x00000000  
S8      : 0x00000000  S9      : 0x00000000  S10     : 0x00000000  S11     : 0x00000000  
T3      : 0x00000000  T4      : 0x00000000  T5      : 0x00000000  T6      : 0x00000000  
MSTATUS : 0x00001889  MTVEC   : 0x40380001  MCAUSE  : 0xdeadc0de  MTVAL   : 0xdeadc0de  
MHARTID : 0x00000000  
Please enable CONFIG_ESP_SYSTEM_USE_FRAME_POINTER option to have a full backtrace.
[1;31mE (900450) task_wdt: Task watchdog got triggered. The following tasks/users did not reset the watchdog in time:[0m
[1;31mE (900450) task_wdt:  - IDLE (CPU 0)[0m
[1;31mE (900450) task_wdt: Tasks currently running:[0m
[1;31mE (900450) task_wdt: CPU 0: lvgl_task[0m
[1;31mE (900450) task_wdt: Print CPU 0 (current core) registers[0m
Core  0 register dump:
MEPC    : 0x42011e78  RA      : 0x42011e4e  SP      : 0x3fcacea0  GP      : 0x3fc8f600  
TP      : 0x3fcacfb0  T0      : 0x00000000  T1      : 0x40000000  T2      : 0x00000000  
S0/FP   : 0x3fc91d70  S1      : 0x3fc92098  A0      : 0x00000001  A1      : 0x00000000  
A2      : 0x3fc92cd4  A3      : 0x00000035  A4      : 0x3fc92c2c  A5      : 0x00000001  
A6      : 0x00000014  A7      : 0x0000000a  S2      : 0x00000000  S3      : 0x3fc920b0  
S4      : 0x00000027  S5      : 0x00000014  S6      : 0x00000000  S7      : 0x00000000  
S8      : 0x00000000  S9      : 0x00000000  S10     : 0x00000000  S11     : 0x00000000  
T3      : 0x00000000  T4      : 0x00000000  T5      : 0x00000000  T6      : 0x00000000  
MSTATUS : 0x00001889  MTVEC   : 0x40380001  MCAUSE  : 0xdeadc0de  MTVAL   : 0xdeadc0de  
MHARTID : 0x00000000  
Please enable CONFIG_ESP_SYSTEM_USE_FRAME_POINTER option to have a full backtrace.
[1;31mE (905450) task_wdt: Task watchdog got triggered. The following tasks/users did not reset the watchdog in time:[0m
[1;31mE (905450) task_wdt:  - IDLE (CPU 0)[0m
[1;31mE (905450) task_wdt: Tasks currently running:[0m
[1;31mE (905450) task_wdt: CPU 0: lvgl_task[0m
[1;31mE (905450) task_wdt: Print CPU 0 (current core) registers[0m
Core  0 register dump:
MEPC    : 0x42011e78  RA      : 0x42011e4e  SP      : 0x3fcacea0  GP      : 0x3fc8f600  
TP      : 0x3fcacfb0  T0      : 0x00000000  T1      : 0x40000000  T2      : 0x00000000  
S0/FP   : 0x3fc91d70  S1      : 0x3fc92098  A0      : 0x00000001  A1      : 0x00000000  
A2      : 0x3fc92cd4  A3      : 0x00000035  A4      : 0x3fc92c2c  A5      : 0x00000001  
A6      : 0x00000014  A7      : 0x0000000a  S2      : 0x00000000  S3      : 0x3fc920b0  
S4      : 0x00000027  S5      : 0x00000014  S6      : 0x00000000  S7      : 0x00000000  
S8      : 0x00000000  S9      : 0x00000000  S10     : 0x00000000  S11     : 0x00000000  
T3      : 0x00000000  T4      : 0x00000000  T5      : 0x00000000  T6      : 0x00000000  
MSTATUS : 0x00001889  MTVEC   : 0x40380001  MCAUSE  : 0xdeadc0de  MTVAL   : 0xdeadc0de  
MHARTID : 0x00000000  
Please enable CONFIG_ESP_SYSTEM_USE_FRAME_POINTER option to have a full backtrace.
[1;31mE (910450) task_wdt: Task watchdog got triggered. The following tasks/users did not reset the watchdog in time:[0m
[1;31mE (910450) task_wdt:  - IDLE (CPU 0)[0m
[1;31mE (910450) task_wdt: Tasks currently running:[0m
[1;31mE (910450) task_wdt: CPU 0: lvgl_task[0m
[1;31mE (910450) task_wdt: Print CPU 0 (current core) registers[0m
Core  0 register dump:
MEPC    : 0x42011e78  RA      : 0x42011e4e  SP      : 0x3fcacea0  GP      : 0x3fc8f600  
TP      : 0x3fcacfb0  T0      : 0x00000000  T1      : 0x40000000  T2      : 0x00000000  
S0/FP   : 0x3fc91d70  S1      : 0x3fc92098  A0      : 0x00000001  A1      : 0x00000000  
A2      : 0x3fc92cd4  A3      : 0x00000035  A4      : 0x3fc92c2c  A5      : 0x00000001  
A6      : 0x00000014  A7      : 0x0000000a  S2      : 0x00000000  S3      : 0x3fc920b0  
S4      : 0x00000027  S5      : 0x00000014  S6      : 0x00000000  S7      : 0x00000000  
S8      : 0x00000000  S9      : 0x00000000  S10     : 0x00000000  S11     : 0x00000000  
T3      : 0x00000000  T4      : 0x00000000  T5      : 0x00000000  T6      : 0x00000000  
MSTATUS : 0x00001889  MTVEC   : 0x40380001  MCAUSE  : 0xdeadc0de  MTVAL   : 0xdeadc0de  
MHARTID : 0x00000000  
Please enable CONFIG_ESP_SYSTEM_USE_FRAME_POINTER option to have a full backtrace.
[1;31mE (915450) task_wdt: Task watchdog got triggered. The following tasks/users did not reset the watchdog in time:[0m
[1;31mE (915450) task_wdt:  - IDLE (CPU 0)[0m
[1;31mE (915450) task_wdt: Tasks currently running:[0m
[1;31mE (915450) task_wdt: CPU 0: lvgl_task[0m
[1;31mE (915450) task_wdt: Print CPU 0 (current core) registers[0m
Core  0 register dump:
MEPC    : 0x42011e78  RA      : 0x42011e4e  SP      : 0x3fcacea0  GP      : 0x3fc8f600  
TP      : 0x3fcacfb0  T0      : 0x00000000  T1      : 0x40000000  T2      : 0x00000000  
S0/FP   : 0x3fc91d70  S1      : 0x3fc92098  A0      : 0x00000001  A1      : 0x00000000  
A2      : 0x3fc92cd4  A3      : 0x00000035  A4      : 0x3fc92c2c  A5      : 0x00000001  
A6      : 0x00000014  A7      : 0x0000000a  S2      : 0x00000000  S3      : 0x3fc920b0  
S4      : 0x00000027  S5      : 0x00000014  S6      : 0x00000000  S7      : 0x00000000  
S8      : 0x00000000  S9      : 0x00000000  S10     : 0x00000000  S11     : 0x00000000  
T3      : 0x00000000  T4      : 0x00000000  T5      : 0x00000000  T6      : 0x00000000  
MSTATUS : 0x00001889  MTVEC   : 0x40380001  MCAUSE  : 0xdeadc0de  MTVAL   : 0xdeadc0de  
MHARTID : 0x00000000  
Please enable CONFIG_ESP_SYSTEM_USE_FRAME_POINTER option to have a full backtrace.
[1;31mE (920450) task_wdt: Task watchdog got triggered. The following tasks/users did not reset the watchdog in time:[0m
[1;31mE (920450) task_wdt:  - IDLE (CPU 0)[0m
[1;31mE (920450) task_wdt: Tasks currently running:[0m
[1;31mE (920450) task_wdt: CPU 0: lvgl_task[0m
[1;31mE (920450) task_wdt: Print CPU 0 (current core) registers[0m
Core  0 register dump:
MEPC    : 0x42011e78  RA      : 0x42011e4e  SP      : 0x3fcacea0  GP      : 0x3fc8f600  
TP      : 0x3fcacfb0  T0      : 0x00000000  T1      : 0x40000000  T2      : 0x00000000  
S0/FP   : 0x3fc91d70  S1      : 0x3fc92098  A0      : 0x00000001  A1      : 0x00000000  
A2      : 0x3fc92cd4  A3      : 0x00000035  A4      : 0x3fc92c2c  A5      : 0x00000001  
A6      : 0x00000014  A7      : 0x0000000a  S2      : 0x00000000  S3      : 0x3fc920b0  
S4      : 0x00000027  S5      : 0x00000014  S6      : 0x00000000  S7      : 0x00000000  
S8      : 0x00000000  S9      : 0x00000000  S10     : 0x00000000  S11     : 0x00000000  
T3      : 0x00000000  T4      : 0x00000000  T5      : 0x00000000  T6      : 0x00000000  
MSTATUS : 0x00001889  MTVEC   : 0x40380001  MCAUSE  : 0xdeadc0de  MTVAL   : 0xdeadc0de  
MHARTID : 0x00000000  
Please enable CONFIG_ESP_SYSTEM_USE_FRAME_POINTER option to have a full backtrace.
[1;31mE (925450) task_wdt: Task watchdog got triggered. The following tasks/users did not reset the watchdog in time:[0m
[1;31mE (925450) task_wdt:  - IDLE (CPU 0)[0m
[1;31mE (925450) task_wdt: Tasks currently running:[0m
[1;31mE (925450) task_wdt: CPU 0: lvgl_task[0m
[1;31mE (925450) task_wdt: Print CPU 0 (current core) registers[0m
Core  0 register dump:
MEPC    : 0x42011e78  RA      : 0x42011e4e  SP      : 0x3fcacea0  GP      : 0x3fc8f600  
TP      : 0x3fcacfb0  T0      : 0x00000000  T1      : 0x40000000  T2      : 0x00000000  
S0/FP   : 0x3fc91d70  S1      : 0x3fc92098  A0      : 0x00000001  A1      : 0x00000000  
A2      : 0x3fc92cd4  A3      : 0x00000035  A4      : 0x3fc92c2c  A5      : 0x00000001  
A6      : 0x00000014  A7      : 0x0000000a  S2      : 0x00000000  S3      : 0x3fc920b0  
S4      : 0x00000027  S5      : 0x00000014  S6      : 0x00000000  S7      : 0x00000000  
S8      : 0x00000000  S9      : 0x00000000  S10     : 0x00000000  S11     : 0x00000000  
T3      : 0x00000000  T4      : 0x00000000  T5      : 0x00000000  T6      : 0x00000000  
MSTATUS : 0x00001889  MTVEC   : 0x40380001  MCAUSE  : 0xdeadc0de  MTVAL   : 0xdeadc0de  
MHARTID : 0x00000000  
Please enable CONFIG_ESP_SYSTEM_USE_FRAME_POINTER option to have a full backtrace.
[1;31mE (930450) task_wdt: Task watchdog got triggered. The following tasks/users did not reset the watchdog in time:[0m
[1;31mE (930450) task_wdt:  - IDLE (CPU 0)[0m
[1;31mE (930450) task_wdt: Tasks currently running:[0m
[1;31mE (930450) task_wdt: CPU 0: lvgl_task[0m
[1;31mE (930450) task_wdt: Print CPU 0 (current core) registers[0m
Core  0 register dump:
MEPC    : 0x42011e78  RA      : 0x42011e4e  SP      : 0x3fcacea0  GP      : 0x3fc8f600  
TP      : 0x3fcacfb0  T0      : 0x00000000  T1      : 0x40000000  T2      : 0x00000000  
S0/FP   : 0x3fc91d70  S1      : 0x3fc92098  A0      : 0x00000001  A1      : 0x00000000  
A2      : 0x3fc92cd4  A3      : 0x00000035  A4      : 0x3fc92c2c  A5      : 0x00000001  
A6      : 0x00000014  A7      : 0x0000000a  S2      : 0x00000000  S3      : 0x3fc920b0  
S4      : 0x00000027  S5      : 0x00000014  S6      : 0x00000000  S7      : 0x00000000  
S8      : 0x00000000  S9      : 0x00000000  S10     : 0x00000000  S11     : 0x00000000  
T3      : 0x00000000  T4      : 0x00000000  T5      : 0x00000000  T6      : 0x00000000  
MSTATUS : 0x00001889  MTVEC   : 0x40380001  MCAUSE  : 0xdeadc0de  MTVAL   : 0xdeadc0de  
MHARTID : 0x00000000  
Please enable CONFIG_ESP_SYSTEM_USE_FRAME_POINTER option to have a full backtrace.
[1;31mE (935450) task_wdt: Task watchdog got triggered. The following tasks/users did not reset the watchdog in time:[0m
[1;31mE (935450) task_wdt:  - IDLE (CPU 0)[0m
[1;31mE (935450) task_wdt: Tasks currently running:[0m
[1;31mE (935450) task_wdt: CPU 0: lvgl_task[0m
[1;31mE (935450) task_wdt: Print CPU 0 (current core) registers[0m
Core  0 register dump:
MEPC    : 0x42011e78  RA      : 0x42011e4e  SP      : 0x3fcacea0  GP      : 0x3fc8f600  
TP      : 0x3fcacfb0  T0      : 0x00000000  T1      : 0x40000000  T2      : 0x00000000  
S0/FP   : 0x3fc91d70  S1      : 0x3fc92098  A0      : 0x00000001  A1      : 0x00000000  
A2      : 0x3fc92cd4  A3      : 0x00000035  A4      : 0x3fc92c2c  A5      : 0x00000001  
A6      : 0x00000014  A7      : 0x0000000a  S2      : 0x00000000  S3      : 0x3fc920b0  
S4      : 0x00000027  S5      : 0x00000014  S6      : 0x00000000  S7      : 0x00000000  
S8      : 0x00000000  S9      : 0x00000000  S10     : 0x00000000  S11     : 0x00000000  
T3      : 0x00000000  T4      : 0x00000000  T5      : 0x00000000  T6      : 0x00000000  
MSTATUS : 0x00001889  MTVEC   : 0x40380001  MCAUSE  : 0xdeadc0de  MTVAL   : 0xdeadc0de  
MHARTID : 0x00000000  
Please enable CONFIG_ESP_SYSTEM_USE_FRAME_POINTER option to have a full backtrace.
[1;31mE (940450) task_wdt: Task watchdog got triggered. The following tasks/users did not reset the watchdog in time:[0m
[1;31mE (940450) task_wdt:  - IDLE (CPU 0)[0m
[1;31mE (940450) task_wdt: Tasks currently running:[0m
[1;31mE (940450) task_wdt: CPU 0: lvgl_task[0m
[1;31mE (940450) task_wdt: Print CPU 0 (current core) registers[0m
Core  0 register dump:
MEPC    : 0x42011e78  RA      : 0x42011e4e  SP      : 0x3fcacea0  GP      : 0x3fc8f600  
TP      : 0x3fcacfb0  T0      : 0x00000000  T1      : 0x40000000  T2      : 0x00000000  
S0/FP   : 0x3fc91d70  S1      : 0x3fc92098  A0      : 0x00000001  A1      : 0x00000000  
A2      : 0x3fc92cd4  A3      : 0x00000035  A4      : 0x3fc92c2c  A5      : 0x00000001  
A6      : 0x00000014  A7      : 0x0000000a  S2      : 0x00000000  S3      : 0x3fc920b0  
S4      : 0x00000027  S5      : 0x00000014  S6      : 0x00000000  S7      : 0x00000000  
S8      : 0x00000000  S9      : 0x00000000  S10     : 0x00000000  S11     : 0x00000000  
T3      : 0x00000000  T4      : 0x00000000  T5      : 0x00000000  T6      : 0x00000000  
MSTATUS : 0x00001889  MTVEC   : 0x40380001  MCAUSE  : 0xdeadc0de  MTVAL   : 0xdeadc0de  
MHARTID : 0x00000000  
Please enable CONFIG_ESP_SYSTEM_USE_FRAME_POINTER option to have a full backtrace.
[1;31mE (945450) task_wdt: Task watchdog got triggered. The following tasks/users did not reset the watchdog in time:[0m
[1;31mE (945450) task_wdt:  - IDLE (CPU 0)[0m
[1;31mE (945450) task_wdt: Tasks currently running:[0m
[1;31mE (945450) task_wdt: CPU 0: lvgl_task[0m
[1;31mE (945450) task_wdt: Print CPU 0 (current core) registers[0m
Core  0 register dump:
MEPC    : 0x42011e78  RA      : 0x42011e4e  SP      : 0x3fcacea0  GP      : 0x3fc8f600  
TP      : 0x3fcacfb0  T0      : 0x00000000  T1      : 0x40000000  T2      : 0x00000000  
S0/FP   : 0x3fc91d70  S1      : 0x3fc92098  A0      : 0x00000001  A1      : 0x00000000  
A2      : 0x3fc92cd4  A3      : 0x00000035  A4      : 0x3fc92c2c  A5      : 0x00000001  
A6      : 0x00000014  A7      : 0x0000000a  S2      : 0x00000000  S3      : 0x3fc920b0  
S4      : 0x00000027  S5      : 0x00000014  S6      : 0x00000000  S7      : 0x00000000  
S8      : 0x00000000  S9      : 0x00000000  S10     : 0x00000000  S11     : 0x00000000  
T3      : 0x00000000  T4      : 0x00000000  T5      : 0x00000000  T6      : 0x00000000  
MSTATUS : 0x00001889  MTVEC   : 0x40380001  MCAUSE  : 0xdeadc0de  MTVAL   : 0xdeadc0de  
MHARTID : 0x00000000  
Please enable CONFIG_ESP_SYSTEM_USE_FRAME_POINTER option to have a full backtrace.
[1;31mE (950450) task_wdt: Task watchdog got triggered. The following tasks/users did not reset the watchdog in time:[0m
[1;31mE (950450) task_wdt:  - IDLE (CPU 0)[0m
[1;31mE (950450) task_wdt: Tasks currently running:[0m
[1;31mE (950450) task_wdt: CPU 0: lvgl_task[0m
[1;31mE (950450) task_wdt: Print CPU 0 (current core) registers[0m
Core  0 register dump:
MEPC    : 0x42011e78  RA      : 0x42011e4e  SP      : 0x3fcacea0  GP      : 0x3fc8f600  
TP      : 0x3fcacfb0  T0      : 0x00000000  T1      : 0x40000000  T2      : 0x00000000  
S0/FP   : 0x3fc91d70  S1      : 0x3fc92098  A0      : 0x00000001  A1      : 0x00000000  
A2      : 0x3fc92cd4  A3      : 0x00000035  A4      : 0x3fc92c2c  A5      : 0x00000001  
A6      : 0x00000014  A7      : 0x0000000a  S2      : 0x00000000  S3      : 0x3fc920b0  
S4      : 0x00000027  S5      : 0x00000014  S6      : 0x00000000  S7      : 0x00000000  
S8      : 0x00000000  S9      : 0x00000000  S10     : 0x00000000  S11     : 0x00000000  
T3      : 0x00000000  T4      : 0x00000000  T5      : 0x00000000  T6      : 0x00000000  
MSTATUS : 0x00001889  MTVEC   : 0x40380001  MCAUSE  : 0xdeadc0de  MTVAL   : 0xdeadc0de  
MHARTID : 0x00000000  
Please enable CONFIG_ESP_SYSTEM_USE_FRAME_POINTER option to have a full backtrace.
[1;31mE (955450) task_wdt: Task watchdog got triggered. The following tasks/users did not reset the watchdog in time:[0m
[1;31mE (955450) task_wdt:  - IDLE (CPU 0)[0m
[1;31mE (955450) task_wdt: Tasks currently running:[0m
[1;31mE (955450) task_wdt: CPU 0: lvgl_task[0m
[1;31mE (955450) task_wdt: Print CPU 0 (current core) registers[0m
Core  0 register dump:
MEPC    : 0x42011e78  RA      : 0x42011e4e  SP      : 0x3fcacea0  GP      : 0x3fc8f600  
TP      : 0x3fcacfb0  T0      : 0x00000000  T1      : 0x40000000  T2      : 0x00000000  
S0/FP   : 0x3fc91d70  S1      : 0x3fc92098  A0      : 0x00000001  A1      : 0x00000000  
A2      : 0x3fc92cd4  A3      : 0x00000035  A4      : 0x3fc92c2c  A5      : 0x00000001  
A6      : 0x00000014  A7      : 0x0000000a  S2      : 0x00000000  S3      : 0x3fc920b0  
S4      : 0x00000027  S5      : 0x00000014  S6      : 0x00000000  S7      : 0x00000000  
S8      : 0x00000000  S9      : 0x00000000  S10     : 0x00000000  S11     : 0x00000000  
T3      : 0x00000000  T4      : 0x00000000  T5      : 0x00000000  T6      : 0x00000000  
MSTATUS : 0x00001889  MTVEC   : 0x40380001  MCAUSE  : 0xdeadc0de  MTVAL   : 0xdeadc0de  
MHARTID : 0x00000000  
Please enable CONFIG_ESP_SYSTEM_USE_FRAME_POINTER option to have a full backtrace.
[1;31mE (960450) task_wdt: Task watchdog got triggered. The following tasks/users did not reset the watchdog in time:[0m
[1;31mE (960450) task_wdt:  - IDLE (CPU 0)[0m
[1;31mE (960450) task_wdt: Tasks currently running:[0m
[1;31mE (960450) task_wdt: CPU 0: lvgl_task[0m
[1;31mE (960450) task_wdt: Print CPU 0 (current core) registers[0m
Core  0 register dump:
MEPC    : 0x42011e78  RA      : 0x42011e4e  SP      : 0x3fcacea0  GP      : 0x3fc8f600  
TP      : 0x3fcacfb0  T0      : 0x00000000  T1      : 0x40000000  T2      : 0x00000000  
S0/FP   : 0x3fc91d70  S1      : 0x3fc92098  A0      : 0x00000001  A1      : 0x00000000  
A2      : 0x3fc92cd4  A3      : 0x00000035  A4      : 0x3fc92c2c  A5      : 0x00000001  
A6      : 0x00000014  A7      : 0x0000000a  S2      : 0x00000000  S3      : 0x3fc920b0  
S4      : 0x00000027  S5      : 0x00000014  S6      : 0x00000000  S7      : 0x00000000  
S8      : 0x00000000  S9      : 0x00000000  S10     : 0x00000000  S11     : 0x00000000  
T3      : 0x00000000  T4      : 0x00000000  T5      : 0x00000000  T6      : 0x00000000  
MSTATUS : 0x00001889  MTVEC   : 0x40380001  MCAUSE  : 0xdeadc0de  MTVAL   : 0xdeadc0de  
MHARTID : 0x00000000  
Please enable CONFIG_ESP_SYSTEM_USE_FRAME_POINTER option to have a full backtrace.
[1;31mE (965450) task_wdt: Task watchdog got triggered. The following tasks/users did not reset the watchdog in time:[0m
[1;31mE (965450) task_wdt:  - IDLE (CPU 0)[0m
[1;31mE (965450) task_wdt: Tasks currently running:[0m
[1;31mE (965450) task_wdt: CPU 0: lvgl_task[0m
[1;31mE (965450) task_wdt: Print CPU 0 (current core) registers[0m
Core  0 register dump:
MEPC    : 0x42011e78  RA      : 0x42011e4e  SP      : 0x3fcacea0  GP      : 0x3fc8f600  
TP      : 0x3fcacfb0  T0      : 0x00000000  T1      : 0x40000000  T2      : 0x00000000  
S0/FP   : 0x3fc91d70  S1      : 0x3fc92098  A0      : 0x00000001  A1      : 0x00000000  
A2      : 0x3fc92cd4  A3      : 0x00000035  A4      : 0x3fc92c2c  A5      : 0x00000001  
A6      : 0x00000014  A7      : 0x0000000a  S2      : 0x00000000  S3      : 0x3fc920b0  
S4      : 0x00000027  S5      : 0x00000014  S6      : 0x00000000  S7      : 0x00000000  
S8      : 0x00000000  S9      : 0x00000000  S10     : 0x00000000  S11     : 0x00000000  
T3      : 0x00000000  T4      : 0x00000000  T5      : 0x00000000  T6      : 0x00000000  
MSTATUS : 0x00001889  MTVEC   : 0x40380001  MCAUSE  : 0xdeadc0de  MTVAL   : 0xdeadc0de  
MHARTID : 0x00000000  
Please enable CONFIG_ESP_SYSTEM_USE_FRAME_POINTER option to have a full backtrace.
[1;31mE (970450) task_wdt: Task watchdog got triggered. The following tasks/users did not reset the watchdog in time:[0m
[1;31mE (970450) task_wdt:  - IDLE (CPU 0)[0m
[1;31mE (970450) task_wdt: Tasks currently running:[0m
[1;31mE (970450) task_wdt: CPU 0: lvgl_task[0m
[1;31mE (970450) task_wdt: Print CPU 0 (current core) registers[0m
Core  0 register dump:
MEPC    : 0x42011e78  RA      : 0x42011e4e  SP      : 0x3fcacea0  GP      : 0x3fc8f600  
TP      : 0x3fcacfb0  T0      : 0x00000000  T1      : 0x40000000  T2      : 0x00000000  
S0/FP   : 0x3fc91d70  S1      : 0x3fc92098  A0      : 0x00000001  A1      : 0x00000000  
A2      : 0x3fc92cd4  A3      : 0x00000035  A4      : 0x3fc92c2c  A5      : 0x00000001  
A6      : 0x00000014  A7      : 0x0000000a  S2      : 0x00000000  S3      : 0x3fc920b0  
S4      : 0x00000027  S5      : 0x00000014  S6      : 0x00000000  S7      : 0x00000000  
S8      : 0x00000000  S9      : 0x00000000  S10     : 0x00000000  S11     : 0x00000000  
T3      : 0x00000000  T4      : 0x00000000  T5      : 0x00000000  T6      : 0x00000000  
MSTATUS : 0x00001889  MTVEC   : 0x40380001  MCAUSE  : 0xdeadc0de  MTVAL   : 0xdeadc0de  
MHARTID : 0x00000000  
Please enable CONFIG_ESP_SYSTEM_USE_FRAME_POINTER option to have a full backtrace.
[1;31mE (975450) task_wdt: Task watchdog got triggered. The following tasks/users did not reset the watchdog in time:[0m
[1;31mE (975450) task_wdt:  - IDLE (CPU 0)[0m
[1;31mE (975450) task_wdt: Tasks currently running:[0m
[1;31mE (975450) task_wdt: CPU 0: lvgl_task[0m
[1;31mE (975450) task_wdt: Print CPU 0 (current core) registers[0m
Core  0 register dump:
MEPC    : 0x42011e78  RA      : 0x42011e4e  SP      : 0x3fcacea0  GP      : 0x3fc8f600  
TP      : 0x3fcacfb0  T0      : 0x00000000  T1      : 0x40000000  T2      : 0x00000000  
S0/FP   : 0x3fc91d70  S1      : 0x3fc92098  A0      : 0x00000001  A1      : 0x00000000  
A2      : 0x3fc92cd4  A3      : 0x00000035  A4      : 0x3fc92c2c  A5      : 0x00000001  
A6      : 0x00000014  A7      : 0x0000000a  S2      : 0x00000000  S3      : 0x3fc920b0  
S4      : 0x00000027  S5      : 0x00000014  S6      : 0x00000000  S7      : 0x00000000  
S8      : 0x00000000  S9      : 0x00000000  S10     : 0x00000000  S11     : 0x00000000  
T3      : 0x00000000  T4      : 0x00000000  T5      : 0x00000000  T6      : 0x00000000  
MSTATUS : 0x00001889  MTVEC   : 0x40380001  MCAUSE  : 0xdeadc0de  MTVAL   : 0xdeadc0de  
MHARTID : 0x00000000  
Please enable CONFIG_ESP_SYSTEM_USE_FRAME_POINTER option to have a full backtrace.
[1;31mE (980450) task_wdt: Task watchdog got triggered. The following tasks/users did not reset the watchdog in time:[0m
[1;31mE (980450) task_wdt:  - IDLE (CPU 0)[0m
[1;31mE (980450) task_wdt: Tasks currently running:[0m
[1;31mE (980450) task_wdt: CPU 0: lvgl_task[0m
[1;31mE (980450) task_wdt: Print CPU 0 (current core) registers[0m
Core  0 register dump:
MEPC    : 0x42011e78  RA      : 0x42011e4e  SP      : 0x3fcacea0  GP      : 0x3fc8f600  
TP      : 0x3fcacfb0  T0      : 0x00000000  T1      : 0x40000000  T2      : 0x00000000  
S0/FP   : 0x3fc91d70  S1      : 0x3fc92098  A0      : 0x00000001  A1      : 0x00000000  
A2      : 0x3fc92cd4  A3      : 0x00000035  A4      : 0x3fc92c2c  A5      : 0x00000001  
A6      : 0x00000014  A7      : 0x0000000a  S2      : 0x00000000  S3      : 0x3fc920b0  
S4      : 0x00000027  S5      : 0x00000014  S6      : 0x00000000  S7      : 0x00000000  
S8      : 0x00000000  S9      : 0x00000000  S10     : 0x00000000  S11     : 0x00000000  
T3      : 0x00000000  T4      : 0x00000000  T5      : 0x00000000  T6      : 0x00000000  
MSTATUS : 0x00001889  MTVEC   : 0x40380001  MCAUSE  : 0xdeadc0de  MTVAL   : 0xdeadc0de  
MHARTID : 0x00000000  
Please enable CONFIG_ESP_SYSTEM_USE_FRAME_POINTER option to have a full backtrace.
[1;31mE (985450) task_wdt: Task watchdog got triggered. The following tasks/users did not reset the watchdog in time:[0m
[1;31mE (985450) task_wdt:  - IDLE (CPU 0)[0m
[1;31mE (985450) task_wdt: Tasks currently running:[0m
[1;31mE (985450) task_wdt: CPU 0: lvgl_task[0m
[1;31mE (985450) task_wdt: Print CPU 0 (current core) registers[0m
Core  0 register dump:
MEPC    : 0x42011e78  RA      : 0x42011e4e  SP      : 0x3fcacea0  GP      : 0x3fc8f600  
TP      : 0x3fcacfb0  T0      : 0x00000000  T1      : 0x40000000  T2      : 0x00000000  
S0/FP   : 0x3fc91d70  S1      : 0x3fc92098  A0      : 0x00000001  A1      : 0x00000000  
A2      : 0x3fc92cd4  A3      : 0x00000035  A4      : 0x3fc92c2c  A5      : 0x00000001  
A6      : 0x00000014  A7      : 0x0000000a  S2      : 0x00000000  S3      : 0x3fc920b0  
S4      : 0x00000027  S5      : 0x00000014  S6      : 0x00000000  S7      : 0x00000000  
S8      : 0x00000000  S9      : 0x00000000  S10     : 0x00000000  S11     : 0x00000000  
T3      : 0x00000000  T4      : 0x00000000  T5      : 0x00000000  T6      : 0x00000000  
MSTATUS : 0x00001889  MTVEC   : 0x40380001  MCAUSE  : 0xdeadc0de  MTVAL   : 0xdeadc0de  
MHARTID : 0x00000000  
Please enable CONFIG_ESP_SYSTEM_USE_FRAME_POINTER option to have a full backtrace.
[1;31mE (990450) task_wdt: Task watchdog got triggered. The following tasks/users did not reset the watchdog in time:[0m
[1;31mE (990450) task_wdt:  - IDLE (CPU 0)[0m
[1;31mE (990450) task_wdt: Tasks currently running:[0m
[1;31mE (990450) task_wdt: CPU 0: lvgl_task[0m
[1;31mE (990450) task_wdt: Print CPU 0 (current core) registers[0m
Core  0 register dump:
MEPC    : 0x42011e78  RA      : 0x42011e4e  SP      : 0x3fcacea0  GP      : 0x3fc8f600  
TP      : 0x3fcacfb0  T0      : 0x00000000  T1      : 0x40000000  T2      : 0x00000000  
S0/FP   : 0x3fc91d70  S1      : 0x3fc92098  A0      : 0x00000001  A1      : 0x00000000  
A2      : 0x3fc92cd4  A3      : 0x00000035  A4      : 0x3fc92c2c  A5      : 0x00000001  
A6      : 0x00000014  A7      : 0x0000000a  S2      : 0x00000000  S3      : 0x3fc920b0  
S4      : 0x00000027  S5      : 0x00000014  S6      : 0x00000000  S7      : 0x00000000  
S8      : 0x00000000  S9      : 0x00000000  S10     : 0x00000000  S11     : 0x00000000  
T3      : 0x00000000  T4      : 0x00000000  T5      : 0x00000000  T6      : 0x00000000  
MSTATUS : 0x00001889  MTVEC   : 0x40380001  MCAUSE  : 0xdeadc0de  MTVAL   : 0xdeadc0de  
MHARTID : 0x00000000  
Please enable CONFIG_ESP_SYSTEM_USE_FRAME_POINTER option to have a full backtrace.
[1;31mE (995450) task_wdt: Task watchdog got triggered. The following tasks/users did not reset the watchdog in time:[0m
[1;31mE (995450) task_wdt:  - IDLE (CPU 0)[0m
[1;31mE (995450) task_wdt: Tasks currently running:[0m
[1;31mE (995450) task_wdt: CPU 0: lvgl_task[0m
[1;31mE (995450) task_wdt: Print CPU 0 (current core) registers[0m
Core  0 register dump:
MEPC    : 0x42011e78  RA      : 0x42011e4e  SP      : 0x3fcacea0  GP      : 0x3fc8f600  
TP      : 0x3fcacfb0  T0      : 0x00000000  T1      : 0x40000000  T2      : 0x00000000  
S0/FP   : 0x3fc91d70  S1      : 0x3fc92098  A0      : 0x00000001  A1      : 0x00000000  
A2      : 0x3fc92cd4  A3      : 0x00000035  A4      : 0x3fc92c2c  A5      : 0x00000001  
A6      : 0x00000014  A7      : 0x0000000a  S2      : 0x00000000  S3      : 0x3fc920b0  
S4      : 0x00000027  S5      : 0x00000014  S6      : 0x00000000  S7      : 0x00000000  
S8      : 0x00000000  S9      : 0x00000000  S10     : 0x00000000  S11     : 0x00000000  
T3      : 0x00000000  T4      : 0x00000000  T5      : 0x00000000  T6      : 0x00000000  
MSTATUS : 0x00001889  MTVEC   : 0x40380001  MCAUSE  : 0xdeadc0de  MTVAL   : 0xdeadc0de  
MHARTID : 0x00000000  
Please enable CONFIG_ESP_SYSTEM_USE_FRAME_POINTER option to have a full backtrace.
[1;31mE (1000450) task_wdt: Task watchdog got triggered. The following tasks/users did not reset the watchdog in time:[0m
[1;31mE (1000450) task_wdt:  - IDLE (CPU 0)[0m
[1;31mE (1000450) task_wdt: Tasks currently running:[0m
[1;31mE (1000450) task_wdt: CPU 0: lvgl_task[0m
[1;31mE (1000450) task_wdt: Print CPU 0 (current core) registers[0m
Core  0 register dump:
MEPC    : 0x42011e78  RA      : 0x42011e4e  SP      : 0x3fcacea0  GP      : 0x3fc8f600  
TP      : 0x3fcacfb0  T0      : 0x00000000  T1      : 0x40000000  T2      : 0x00000000  
S0/FP   : 0x3fc91d70  S1      : 0x3fc92098  A0      : 0x00000001  A1      : 0x00000000  
A2      : 0x3fc92cd4  A3      : 0x00000035  A4      : 0x3fc92c2c  A5      : 0x00000001  
A6      : 0x00000014  A7      : 0x0000000a  S2      : 0x00000000  S3      : 0x3fc920b0  
S4      : 0x00000027  S5      : 0x00000014  S6      : 0x00000000  S7      : 0x00000000  
S8      : 0x00000000  S9      : 0x00000000  S10     : 0x00000000  S11     : 0x00000000  
T3      : 0x00000000  T4      : 0x00000000  T5      : 0x00000000  T6      : 0x00000000  
MSTATUS : 0x00001889  MTVEC   : 0x40380001  MCAUSE  : 0xdeadc0de  MTVAL   : 0xdeadc0de  
MHARTID : 0x00000000  
Please enable CONFIG_ESP_SYSTEM_USE_FRAME_POINTER option to have a full backtrace.
[1;31mE (1005450) task_wdt: Task watchdog got triggered. The following tasks/users did not reset the watchdog in time:[0m
[1;31mE (1005450) task_wdt:  - IDLE (CPU 0)[0m
[1;31mE (1005450) task_wdt: Tasks currently running:[0m
[1;31mE (1005450) task_wdt: CPU 0: lvgl_task[0m
[1;31mE (1005450) task_wdt: Print CPU 0 (current core) registers[0m
Core  0 register dump:
MEPC    : 0x42011e78  RA      : 0x42011e4e  SP      : 0x3fcacea0  GP      : 0x3fc8f600  
TP      : 0x3fcacfb0  T0      : 0x00000000  T1      : 0x40000000  T2      : 0x00000000  
S0/FP   : 0x3fc91d70  S1      : 0x3fc92098  A0      : 0x00000001  A1      : 0x00000000  
A2      : 0x3fc92cd4  A3      : 0x00000035  A4      : 0x3fc92c2c  A5      : 0x00000001  
A6      : 0x00000014  A7      : 0x0000000a  S2      : 0x00000000  S3      : 0x3fc920b0  
S4      : 0x00000027  S5      : 0x00000014  S6      : 0x00000000  S7      : 0x00000000  
S8      : 0x00000000  S9      : 0x00000000  S10     : 0x00000000  S11     : 0x00000000  
T3      : 0x00000000  T4      : 0x00000000  T5      : 0x00000000  T6      : 0x00000000  
MSTATUS : 0x00001889  MTVEC   : 0x40380001  MCAUSE  : 0xdeadc0de  MTVAL   : 0xdeadc0de  
MHARTID : 0x00000000  
Please enable CONFIG_ESP_SYSTEM_USE_FRAME_POINTER option to have a full backtrace.
[1;31mE (1010450) task_wdt: Task watchdog got triggered. The following tasks/users did not reset the watchdog in time:[0m
[1;31mE (1010450) task_wdt:  - IDLE (CPU 0)[0m
[1;31mE (1010450) task_wdt: Tasks currently running:[0m
[1;31mE (1010450) task_wdt: CPU 0: lvgl_task[0m
[1;31mE (1010450) task_wdt: Print CPU 0 (current core) registers[0m
Core  0 register dump:
MEPC    : 0x42011e78  RA      : 0x42011e4e  SP      : 0x3fcacea0  GP      : 0x3fc8f600  
TP      : 0x3fcacfb0  T0      : 0x00000000  T1      : 0x40000000  T2      : 0x00000000  
S0/FP   : 0x3fc91d70  S1      : 0x3fc92098  A0      : 0x00000001  A1      : 0x00000000  
A2      : 0x3fc92cd4  A3      : 0x00000035  A4      : 0x3fc92c2c  A5      : 0x00000001  
A6      : 0x00000014  A7      : 0x0000000a  S2      : 0x00000000  S3      : 0x3fc920b0  
S4      : 0x00000027  S5      : 0x00000014  S6      : 0x00000000  S7      : 0x00000000  
S8      : 0x00000000  S9      : 0x00000000  S10     : 0x00000000  S11     : 0x00000000  
T3      : 0x00000000  T4      : 0x00000000  T5      : 0x00000000  T6      : 0x00000000  
MSTATUS : 0x00001889  MTVEC   : 0x40380001  MCAUSE  : 0xdeadc0de  MTVAL   : 0xdeadc0de  
MHARTID : 0x00000000  
Please enable CONFIG_ESP_SYSTEM_USE_FRAME_POINTER option to have a full backtrace.
[1;31mE (1015450) task_wdt: Task watchdog got triggered. The following tasks/users did not reset the watchdog in time:[0m
[1;31mE (1015450) task_wdt:  - IDLE (CPU 0)[0m
[1;31mE (1015450) task_wdt: Tasks currently running:[0m
[1;31mE (1015450) task_wdt: CPU 0: lvgl_task[0m
[1;31mE (1015450) task_wdt: Print CPU 0 (current core) registers[0m
Core  0 register dump:
MEPC    : 0x42011e78  RA      : 0x42011e4e  SP      : 0x3fcacea0  GP      : 0x3fc8f600  
TP      : 0x3fcacfb0  T0      : 0x00000000  T1      : 0x40000000  T2      : 0x00000000  
S0/FP   : 0x3fc91d70  S1      : 0x3fc92098  A0      : 0x00000001  A1      : 0x00000000  
A2      : 0x3fc92cd4  A3      : 0x00000035  A4      : 0x3fc92c2c  A5      : 0x00000001  
A6      : 0x00000014  A7      : 0x0000000a  S2      : 0x00000000  S3      : 0x3fc920b0  
S4      : 0x00000027  S5      : 0x00000014  S6      : 0x00000000  S7      : 0x00000000  
S8      : 0x00000000  S9      : 0x00000000  S10     : 0x00000000  S11     : 0x00000000  
T3      : 0x00000000  T4      : 0x00000000  T5      : 0x00000000  T6      : 0x00000000  
MSTATUS : 0x00001889  MTVEC   : 0x40380001  MCAUSE  : 0xdeadc0de  MTVAL   : 0xdeadc0de  
MHARTID : 0x00000000  
Please enable CONFIG_ESP_SYSTEM_USE_FRAME_POINTER option to have a full backtrace.
[1;31mE (1020450) task_wdt: Task watchdog got triggered. The following tasks/users did not reset the watchdog in time:[0m
[1;31mE (1020450) task_wdt:  - IDLE (CPU 0)[0m
[1;31mE (1020450) task_wdt: Tasks currently running:[0m
[1;31mE (1020450) task_wdt: CPU 0: lvgl_task[0m
[1;31mE (1020450) task_wdt: Print CPU 0 (current core) registers[0m
Core  0 register dump:
MEPC    : 0x42011e78  RA      : 0x42011e4e  SP      : 0x3fcacea0  GP      : 0x3fc8f600  
TP      : 0x3fcacfb0  T0      : 0x00000000  T1      : 0x40000000  T2      : 0x00000000  
S0/FP   : 0x3fc91d70  S1      : 0x3fc92098  A0      : 0x00000001  A1      : 0x00000000  
A2      : 0x3fc92cd4  A3      : 0x00000035  A4      : 0x3fc92c2c  A5      : 0x00000001  
A6      : 0x00000014  A7      : 0x0000000a  S2      : 0x00000000  S3      : 0x3fc920b0  
S4      : 0x00000027  S5      : 0x00000014  S6      : 0x00000000  S7      : 0x00000000  
S8      : 0x00000000  S9      : 0x00000000  S10     : 0x00000000  S11     : 0x00000000  
T3      : 0x00000000  T4      : 0x00000000  T5      : 0x00000000  T6      : 0x00000000  
MSTATUS : 0x00001889  MTVEC   : 0x40380001  MCAUSE  : 0xdeadc0de  MTVAL   : 0xdeadc0de  
MHARTID : 0x00000000  
Please enable CONFIG_ESP_SYSTEM_USE_FRAME_POINTER option to have a full backtrace.
[1;31mE (1025450) task_wdt: Task watchdog got triggered. The following tasks/users did not reset the watchdog in time:[0m
[1;31mE (1025450) task_wdt:  - IDLE (CPU 0)[0m
[1;31mE (1025450) task_wdt: Tasks currently running:[0m
[1;31mE (1025450) task_wdt: CPU 0: lvgl_task[0m
[1;31mE (1025450) task_wdt: Print CPU 0 (current core) registers[0m
Core  0 register dump:
MEPC    : 0x42011e78  RA      : 0x42011e4e  SP      : 0x3fcacea0  GP      : 0x3fc8f600  
TP      : 0x3fcacfb0  T0      : 0x00000000  T1      : 0x40000000  T2      : 0x00000000  
S0/FP   : 0x3fc91d70  S1      : 0x3fc92098  A0      : 0x00000001  A1      : 0x00000000  
A2      : 0x3fc92cd4  A3      : 0x00000035  A4      : 0x3fc92c2c  A5      : 0x00000001  
A6      : 0x00000014  A7      : 0x0000000a  S2      : 0x00000000  S3      : 0x3fc920b0  
S4      : 0x00000027  S5      : 0x00000014  S6      : 0x00000000  S7      : 0x00000000  
S8      : 0x00000000  S9      : 0x00000000  S10     : 0x00000000  S11     : 0x00000000  
T3      : 0x00000000  T4      : 0x00000000  T5      : 0x00000000  T6      : 0x00000000  
MSTATUS : 0x00001889  MTVEC   : 0x40380001  MCAUSE  : 0xdeadc0de  MTVAL   : 0xdeadc0de  
MHARTID : 0x00000000  
Please enable CONFIG_ESP_SYSTEM_USE_FRAME_POINTER option to have a full backtrace.
[1;31mE (1030450) task_wdt: Task watchdog got triggered. The following tasks/users did not reset the watchdog in time:[0m
[1;31mE (1030450) task_wdt:  - IDLE (CPU 0)[0m
[1;31mE (1030450) task_wdt: Tasks currently running:[0m
[1;31mE (1030450) task_wdt: CPU 0: lvgl_task[0m
[1;31mE (1030450) task_wdt: Print CPU 0 (current core) registers[0m
Core  0 register dump:
MEPC    : 0x42011e78  RA      : 0x42011e4e  SP      : 0x3fcacea0  GP      : 0x3fc8f600  
TP      : 0x3fcacfb0  T0      : 0x00000000  T1      : 0x40000000  T2      : 0x00000000  
S0/FP   : 0x3fc91d70  S1      : 0x3fc92098  A0      : 0x00000001  A1      : 0x00000000  
A2      : 0x3fc92cd4  A3      : 0x00000035  A4      : 0x3fc92c2c  A5      : 0x00000001  
A6      : 0x00000014  A7      : 0x0000000a  S2      : 0x00000000  S3      : 0x3fc920b0  
S4      : 0x00000027  S5      : 0x00000014  S6      : 0x00000000  S7      : 0x00000000  
S8      : 0x00000000  S9      : 0x00000000  S10     : 0x00000000  S11     : 0x00000000  
T3      : 0x00000000  T4      : 0x00000000  T5      : 0x00000000  T6      : 0x00000000  
MSTATUS : 0x00001889  MTVEC   : 0x40380001  MCAUSE  : 0xdeadc0de  MTVAL   : 0xdeadc0de  
MHARTID : 0x00000000  
Please enable CONFIG_ESP_SYSTEM_USE_FRAME_POINTER option to have a full backtrace.
[1;31mE (1035450) task_wdt: Task watchdog got triggered. The following tasks/users did not reset the watchdog in time:[0m
[1;31mE (1035450) task_wdt:  - IDLE (CPU 0)[0m
[1;31mE (1035450) task_wdt: Tasks currently running:[0m
[1;31mE (1035450) task_wdt: CPU 0: lvgl_task[0m
[1;31mE (1035450) task_wdt: Print CPU 0 (current core) registers[0m
Core  0 register dump:
MEPC    : 0x42011e78  RA      : 0x42011e4e  SP      : 0x3fcacea0  GP      : 0x3fc8f600  
TP      : 0x3fcacfb0  T0      : 0x00000000  T1      : 0x40000000  T2      : 0x00000000  
S0/FP   : 0x3fc91d70  S1      : 0x3fc92098  A0      : 0x00000001  A1      : 0x00000000  
A2      : 0x3fc92cd4  A3      : 0x00000035  A4      : 0x3fc92c2c  A5      : 0x00000001  
A6      : 0x00000014  A7      : 0x0000000a  S2      : 0x00000000  S3      : 0x3fc920b0  
S4      : 0x00000027  S5      : 0x00000014  S6      : 0x00000000  S7      : 0x00000000  
S8      : 0x00000000  S9      : 0x00000000  S10     : 0x00000000  S11     : 0x00000000  
T3      : 0x00000000  T4      : 0x00000000  T5      : 0x00000000  T6      : 0x00000000  
MSTATUS : 0x00001889  MTVEC   : 0x40380001  MCAUSE  : 0xdeadc0de  MTVAL   : 0xdeadc0de  
MHARTID : 0x00000000  
Please enable CONFIG_ESP_SYSTEM_USE_FRAME_POINTER option to have a full backtrace.
[1;31mE (1040450) task_wdt: Task watchdog got triggered. The following tasks/users did not reset the watchdog in time:[0m
[1;31mE (1040450) task_wdt:  - IDLE (CPU 0)[0m
[1;31mE (1040450) task_wdt: Tasks currently running:[0m
[1;31mE (1040450) task_wdt: CPU 0: lvgl_task[0m
[1;31mE (1040450) task_wdt: Print CPU 0 (current core) registers[0m
Core  0 register dump:
MEPC    : 0x42011e78  RA      : 0x42011e4e  SP      : 0x3fcacea0  GP      : 0x3fc8f600  
TP      : 0x3fcacfb0  T0      : 0x00000000  T1      : 0x40000000  T2      : 0x00000000  
S0/FP   : 0x3fc91d70  S1      : 0x3fc92098  A0      : 0x00000001  A1      : 0x00000000  
A2      : 0x3fc92cd4  A3      : 0x00000035  A4      : 0x3fc92c2c  A5      : 0x00000001  
A6      : 0x00000014  A7      : 0x0000000a  S2      : 0x00000000  S3      : 0x3fc920b0  
S4      : 0x00000027  S5      : 0x00000014  S6      : 0x00000000  S7      : 0x00000000  
S8      : 0x00000000  S9      : 0x00000000  S10     : 0x00000000  S11     : 0x00000000  
T3      : 0x00000000  T4      : 0x00000000  T5      : 0x00000000  T6      : 0x00000000  
MSTATUS : 0x00001889  MTVEC   : 0x40380001  MCAUSE  : 0xdeadc0de  MTVAL   : 0xdeadc0de  
MHARTID : 0x00000000  
Please enable CONFIG_ESP_SYSTEM_USE_FRAME_POINTER option to have a full backtrace.
